A1: 所属同花顺行业 | B1: 所属同花顺行业 | D1: 所属同花顺行业
A2: 综合-综合-综合Ⅲ | B2: 综合-综合-综合Ⅲ | D2: 综合-综合-综合Ⅲ | E2: =COUNTIF(A2:A6000,D2) -> 28
A3: 综合-综合-综合Ⅲ | B3: 有色金属-小金属-稀土 | D3: 有色金属-小金属-其他小金属 | E3: =COUNTIF(A3:A6001,D3) -> 20
A4: 综合-综合-综合Ⅲ | B4: 有色金属-小金属-其他小金属 | D4: 有色金属-金属新材料-其他金属新材料 | E4: =COUNTIF(A4:A6002,D4) -> 17
A5: 综合-综合-综合Ⅲ | B5: 有色金属-小金属-能源金属 | D5: 有色金属-贵金属-贵金属Ⅲ | E5: =COUNTIF(A5:A6003,D5) -> 11
A6: 综合-综合-综合Ⅲ | B6: 有色金属-金属新材料-其他金属新材料 | D6: 有色金属-工业金属-铜 | E6: =COUNTIF(A6:A6004,D6) -> 15
A7: 综合-综合-综合Ⅲ | B7: 有色金属-金属新材料-磁性材料 | D7: 有色金属-工业金属-铅锌 | E7: =COUNTIF(A7:A6005,D7) -> 14
A8: 综合-综合-综合Ⅲ | B8: 有色金属-贵金属-贵金属Ⅲ | D8: 有色金属-工业金属-铝 | E8: =COUNTIF(A8:A6006,D8) -> 31
A9: 综合-综合-综合Ⅲ | B9: 有色金属-工业金属-铜 | D9: 银行-银行-农商行 | E9: =COUNTIF(A9:A6007,D9) -> 10
A10: 综合-综合-综合Ⅲ | B10: 有色金属-工业金属-铅锌 | D10: 银行-银行-国有大型银行 | E10: =COUNTIF(A10:A6008,D10) -> 6
A11: 综合-综合-综合Ⅲ | B11: 有色金属-工业金属-铝 | D11: 银行-银行-股份制银行 | E11: =COUNTIF(A11:A6009,D11) -> 9
A12: 综合-综合-综合Ⅲ | B12: 银行-银行-农商行 | D12: 银行-银行-城商行 | E12: =COUNTIF(A12:A6010,D12) -> 17
A13: 综合-综合-综合Ⅲ | B13: 银行-银行-国有大型银行 | D13: 医药生物-中药-中药Ⅲ | E13: =COUNTIF(A13:A6011,D13) -> 73
A14: 综合-综合-综合Ⅲ | B14: 银行-银行-股份制银行 | D14: 医药生物-医药商业-医药商业Ⅲ | E14: =COUNTIF(A14:A6012,D14) -> 31
A15: 综合-综合-综合Ⅲ | B15: 银行-银行-城商行 | D15: 医药生物-医疗器械-医疗设备 | E15: =COUNTIF(A15:A6013,D15) -> 41
A16: 综合-综合-综合Ⅲ | B16: 医药生物-中药-中药Ⅲ | D16: 医药生物-医疗器械-医疗耗材 | E16: =COUNTIF(A16:A6014,D16) -> 45
A17: 综合-综合-综合Ⅲ | B17: 医药生物-医药商业-医药商业Ⅲ | D17: 医药生物-医疗器械-体外诊断 | E17: =COUNTIF(A17:A6015,D17) -> 40
A18: 综合-综合-综合Ⅲ | B18: 医药生物-医疗器械-医疗设备 | D18: 医药生物-生物制品-其他生物制品 | E18: =COUNTIF(A18:A6016,D18) -> 35
A19: 综合-综合-综合Ⅲ | B19: 医药生物-医疗器械-医疗耗材 | D19: 医药生物-化学制药-原料药 | E19: =COUNTIF(A19:A6017,D19) -> 42
A20: 综合-综合-综合Ⅲ | B20: 医药生物-医疗器械-体外诊断 | D20: 医药生物-化学制药-化学制剂 | E20: =COUNTIF(A20:A6018,D20) -> 113
A21: 综合-综合-综合Ⅲ | B21: 医药生物-医疗服务-医疗研发外包 | D21: 通信-通信设备-通信终端及配件 | E21: =COUNTIF(A21:A6019,D21) -> 27
A22: 综合-综合-综合Ⅲ | B22: 医药生物-医疗服务-其他医疗服务 | D22: 通信-通信设备-通信网络设备及器件 | E22: =COUNTIF(A22:A6020,D22) -> 35
A23: 综合-综合-综合Ⅲ | B23: 医药生物-生物制品-疫苗 | D23: 通信-通信设备-其他通信设备 | E23: =COUNTIF(A23:A6021,D23) -> 13
A24: 综合-综合-综合Ⅲ | B24: 医药生物-生物制品-血液制品 | D24: 通信-通信服务-通信服务Ⅲ | E24: =COUNTIF(A24:A6022,D24) -> 47
A25: 综合-综合-综合Ⅲ | B25: 医药生物-生物制品-其他生物制品 | D25: 食品饮料-饮料制造-软饮料 | E25: =COUNTIF(A25:A6023,D25) -> 11
A26: 综合-综合-综合Ⅲ | B26: 医药生物-化学制药-原料药 | D26: 食品饮料-饮料制造-啤酒 | E26: =COUNTIF(A26:A6024,D26) -> 7
A27: 综合-综合-综合Ⅲ | B27: 医药生物-化学制药-化学制剂 | D27: 食品饮料-饮料制造-白酒 | E27: =COUNTIF(A27:A6025,D27) -> 20
A28: 综合-综合-综合Ⅲ | B28: 通信-通信设备-通信终端及配件 | D28: 食品饮料-食品加工制造-乳品 | E28: =COUNTIF(A28:A6026,D28) -> 18
A29: 综合-综合-综合Ⅲ | B29: 通信-通信设备-通信线缆及配套 | D29: 食品饮料-食品加工制造-肉制品 | E29: =COUNTIF(A29:A6027,D29) -> 9
A30: 有色金属-小金属-稀土 | B30: 通信-通信设备-通信网络设备及器件 | D30: 食品饮料-食品加工制造-其他食品 | E30: =COUNTIF(A30:A6028,D30) -> 19
A31: 有色金属-小金属-稀土 | B31: 通信-通信设备-其他通信设备 | D31: 食品饮料-食品加工制造-调味发酵品 | E31: =COUNTIF(A31:A6029,D31) -> 15
A32: 有色金属-小金属-稀土 | B32: 通信-通信服务-通信服务Ⅲ | D32: 石油石化-油气开采及服务-油气开采 | E32: =COUNTIF(A32:A6030,D32) -> 7
A33: 有色金属-小金属-稀土 | B33: 食品饮料-饮料制造-软饮料 | D33: 石油石化-油气开采及服务-油服工程 | E33: =COUNTIF(A33:A6031,D33) -> 13
A34: 有色金属-小金属-其他小金属 | B34: 食品饮料-饮料制造-其他酒类 | D34: 石油石化-石油加工贸易-油品石化贸易 | E34: =COUNTIF(A34:A6032,D34) -> 6
A35: 有色金属-小金属-其他小金属 | B35: 食品饮料-饮料制造-啤酒 | D35: 石油石化-石油加工贸易-石油加工 | E35: =COUNTIF(A35:A6033,D35) -> 22
A36: 有色金属-小金属-其他小金属 | B36: 食品饮料-饮料制造-白酒 | D36: 社会服务-其他社会服务-专业服务 | E36: =COUNTIF(A36:A6034,D36) -> 30
A37: 有色金属-小金属-其他小金属 | B37: 食品饮料-食品加工制造-休闲食品 | D37: 社会服务-其他社会服务-体育 | E37: =COUNTIF(A37:A6035,D37) -> 3
A38: 有色金属-小金属-其他小金属 | B38: 食品饮料-食品加工制造-乳品 | D38: 社会服务-景点及旅游-人工景点 | E38: =COUNTIF(A38:A6036,D38) -> 5
A39: 有色金属-小金属-其他小金属 | B39: 食品饮料-食品加工制造-肉制品 | D39: 社会服务-教育-教育Ⅲ | E39: =COUNTIF(A39:A6037,D39) -> 19
A40: 有色金属-小金属-其他小金属 | B40: 食品饮料-食品加工制造-其他食品 | D40: 商贸零售-贸易-贸易Ⅲ | E40: =COUNTIF(A40:A6038,D40) -> 16
A41: 有色金属-小金属-其他小金属 | B41: 食品饮料-食品加工制造-调味发酵品 | D41: 商贸零售-零售-商业物业经营 | E41: =COUNTIF(A41:A6039,D41) -> 20
A42: 有色金属-小金属-其他小金属 | B42: 石油石化-油气开采及服务-油气开采 | D42: 商贸零售-零售-百货零售 | E42: =COUNTIF(A42:A6040,D42) -> 43
A43: 有色金属-小金属-其他小金属 | B43: 石油石化-油气开采及服务-油服工程 | D43: 商贸零售-互联网电商-互联网电商Ⅲ | E43: =COUNTIF(A43:A6041,D43) -> 21
A44: 有色金属-小金属-其他小金属 | B44: 石油石化-石油加工贸易-油品石化贸易 | D44: 轻工制造-造纸-造纸Ⅲ | E44: =COUNTIF(A44:A6042,D44) -> 24
A45: 有色金属-小金属-其他小金属 | B45: 石油石化-石油加工贸易-石油加工 | D45: 轻工制造-家用轻工-文娱用品 | E45: =COUNTIF(A45:A6043,D45) -> 20
A46: 有色金属-小金属-其他小金属 | B46: 社会服务-其他社会服务-专业服务 | D46: 轻工制造-家用轻工-饰品 | E46: =COUNTIF(A46:A6044,D46) -> 16
A47: 有色金属-小金属-其他小金属 | B47: 社会服务-其他社会服务-体育 | D47: 轻工制造-家用轻工-其他家用轻工 | E47: =COUNTIF(A47:A6045,D47) -> 32
A48: 有色金属-小金属-其他小金属 | B48: 社会服务-酒店及餐饮-酒店 | D48: 轻工制造-家用轻工-家具 | E48: =COUNTIF(A48:A6046,D48) -> 31
A49: 有色金属-小金属-其他小金属 | B49: 社会服务-酒店及餐饮-餐饮 | D49: 轻工制造-家用轻工-瓷砖地板 | E49: =COUNTIF(A49:A6047,D49) -> 9
A50: 有色金属-小金属-其他小金属 | B50: 社会服务-景点及旅游-自然景点 | D50: 轻工制造-包装印刷-印刷 | E50: =COUNTIF(A50:A6048,D50) -> 5
A51: 有色金属-小金属-其他小金属 | B51: 社会服务-景点及旅游-人工景点 | D51: 轻工制造-包装印刷-包装 | E51: =COUNTIF(A51:A6049,D51) -> 43
A52: 有色金属-小金属-其他小金属 | B52: 社会服务-景点及旅游-旅游综合 | D52: 农林牧渔-种植业与林业-其他种植业 | E52: =COUNTIF(A52:A6050,D52) -> 9
A53: 有色金属-小金属-其他小金属 | B53: 社会服务-教育-教育Ⅲ | D53: 农林牧渔-种植业与林业-林业 | E53: =COUNTIF(A53:A6051,D53) -> 4
A54: 有色金属-小金属-能源金属 | B54: 商贸零售-贸易-贸易Ⅲ | D54: 农林牧渔-养殖业-水产养殖 | E54: =COUNTIF(A54:A6052,D54) -> 4
A55: 有色金属-小金属-能源金属 | B55: 商贸零售-零售-专业连锁 | D55: 农林牧渔-农产品加工-饲料 | E55: =COUNTIF(A55:A6053,D55) -> 18
A56: 有色金属-小金属-能源金属 | B56: 商贸零售-零售-商业物业经营 | D56: 农林牧渔-农产品加工-其他农产品加工 | E56: =COUNTIF(A56:A6054,D56) -> 11
A57: 有色金属-小金属-能源金属 | B57: 商贸零售-零售-旅游零售 | D57: 农林牧渔-农产品加工-果蔬加工 | E57: =COUNTIF(A57:A6055,D57) -> 5
A58: 有色金属-小金属-能源金属 | B58: 商贸零售-零售-百货零售 | D58: 美容护理-美容护理-化妆品 | E58: =COUNTIF(A58:A6056,D58) -> 14
A59: 有色金属-小金属-能源金属 | B59: 商贸零售-互联网电商-互联网电商Ⅲ | D59: 美容护理-美容护理-个护用品 | E59: =COUNTIF(A59:A6057,D59) -> 14
A60: 有色金属-小金属-能源金属 | B60: 轻工制造-造纸-造纸Ⅲ | D60: 煤炭-煤炭开采加工-煤炭开采 | E60: =COUNTIF(A60:A6058,D60) -> 28
A61: 有色金属-小金属-能源金属 | B61: 轻工制造-家用轻工-文娱用品 | D61: 交运设备-汽车整车-商用载货车 | E61: =COUNTIF(A61:A6059,D61) -> 9
A62: 有色金属-小金属-能源金属 | B62: 轻工制造-家用轻工-饰品 | D62: 交运设备-汽车零部件-汽车零部件Ⅲ | E62: =COUNTIF(A62:A6060,D62) -> 229
A63: 有色金属-小金属-能源金属 | B63: 轻工制造-家用轻工-其他家用轻工 | D63: 交运设备-汽车服务-汽车服务Ⅲ | E63: =COUNTIF(A63:A6061,D63) -> 11
A64: 有色金属-小金属-能源金属 | B64: 轻工制造-家用轻工-家具 | D64: 交运设备-非汽车交运-轨交设备 | E64: =COUNTIF(A64:A6062,D64) -> 30
A65: 有色金属-小金属-能源金属 | B65: 轻工制造-家用轻工-瓷砖地板 | D65: 交通运输-物流-物流Ⅲ | E65: =COUNTIF(A65:A6063,D65) -> 47
A66: 有色金属-小金属-能源金属 | B66: 轻工制造-包装印刷-印刷 | D66: 交通运输-公路铁路运输-铁路运输 | E66: =COUNTIF(A66:A6064,D66) -> 7
A67: 有色金属-小金属-能源金属 | B67: 轻工制造-包装印刷-包装 | D67: 交通运输-公路铁路运输-高速公路 | E67: =COUNTIF(A67:A6065,D67) -> 19
A68: 有色金属-小金属-能源金属 | B68: 农林牧渔-种植业与林业-种子生产 | D68: 交通运输-港口航运-航运 | E68: =COUNTIF(A68:A6066,D68) -> 18
A69: 有色金属-小金属-能源金属 | B69: 农林牧渔-种植业与林业-其他种植业 | D69: 建筑装饰-建筑装饰-装饰园林 | E69: =COUNTIF(A69:A6067,D69) -> 42
A70: 有色金属-小金属-能源金属 | B70: 农林牧渔-种植业与林业-林业 | D70: 建筑装饰-建筑装饰-专业工程 | E70: =COUNTIF(A70:A6068,D70) -> 34
A71: 有色金属-小金属-能源金属 | B71: 农林牧渔-种植业与林业-粮食种植 | D71: 建筑装饰-建筑装饰-基础建设 | E71: =COUNTIF(A71:A6069,D71) -> 26
A72: 有色金属-金属新材料-其他金属新材料 | B72: 农林牧渔-养殖业-畜禽养殖 | D72: 建筑装饰-建筑装饰-工程咨询服务 | E72: =COUNTIF(A72:A6070,D72) -> 44
A73: 有色金属-金属新材料-其他金属新材料 | B73: 农林牧渔-养殖业-水产养殖 | D73: 建筑装饰-建筑装饰-房屋建设 | E73: =COUNTIF(A73:A6071,D73) -> 8
A74: 有色金属-金属新材料-其他金属新材料 | B74: 农林牧渔-养殖业-海洋捕捞 | D74: 建筑材料-建筑材料-水泥 | E74: =COUNTIF(A74:A6072,D74) -> 25
A75: 有色金属-金属新材料-其他金属新材料 | B75: 农林牧渔-农业服务-农业综合 | D75: 建筑材料-建筑材料-其他建材 | E75: =COUNTIF(A75:A6073,D75) -> 24
A76: 有色金属-金属新材料-其他金属新材料 | B76: 农林牧渔-农业服务-动物保健 | D76: 建筑材料-建筑材料-管材 | E76: =COUNTIF(A76:A6074,D76) -> 7
A77: 有色金属-金属新材料-其他金属新材料 | B77: 农林牧渔-农产品加工-饲料 | D77: 建筑材料-建筑材料-玻璃玻纤 | E77: =COUNTIF(A77:A6075,D77) -> 13
A78: 有色金属-金属新材料-其他金属新材料 | B78: 农林牧渔-农产品加工-其他农产品加工 | D78: 家用电器-小家电-小家电Ⅲ | E78: =COUNTIF(A78:A6076,D78) -> 26
A79: 有色金属-金属新材料-其他金属新材料 | B79: 农林牧渔-农产品加工-粮油加工 | D79: 家用电器-白色家电-其他白色家电 | E79: =COUNTIF(A79:A6077,D79) -> 27
A80: 有色金属-金属新材料-其他金属新材料 | B80: 农林牧渔-农产品加工-果蔬加工 | D80: 家用电器-白色家电-空调 | E80: =COUNTIF(A80:A6078,D80) -> 3
A81: 有色金属-金属新材料-其他金属新材料 | B81: 美容护理-美容护理-医疗美容 | D81: 计算机-计算机应用-软件开发 | E81: =COUNTIF(A81:A6079,D81) -> 135
A82: 有色金属-金属新材料-其他金属新材料 | B82: 美容护理-美容护理-化妆品 | D82: 计算机-计算机应用-IT服务 | E82: =COUNTIF(A82:A6080,D82) -> 122
A83: 有色金属-金属新材料-其他金属新材料 | B83: 美容护理-美容护理-个护用品 | D83: 计算机-计算机设备-计算机设备Ⅲ | E83: =COUNTIF(A83:A6081,D83) -> 80
A84: 有色金属-金属新材料-其他金属新材料 | B84: 煤炭-煤炭开采加工-煤炭开采 | D84: 基础化工-化学制品-涂料油墨 | E84: =COUNTIF(A84:A6082,D84) -> 14
A85: 有色金属-金属新材料-其他金属新材料 | B85: 煤炭-煤炭开采加工-焦炭加工 | D85: 基础化工-化学制品-食品及饲料添加剂 | E85: =COUNTIF(A85:A6083,D85) -> 21
A86: 有色金属-金属新材料-其他金属新材料 | B86: 交运设备-汽车整车-商用载客车 | D86: 基础化工-化学制品-其他化学制品 | E86: =COUNTIF(A86:A6084,D86) -> 73
A87: 有色金属-金属新材料-其他金属新材料 | B87: 交运设备-汽车整车-商用载货车 | D87: 基础化工-化学制品-聚氨酯 | E87: =COUNTIF(A87:A6085,D87) -> 11
A88: 有色金属-金属新材料-其他金属新材料 | B88: 交运设备-汽车整车-乘用车 | D88: 基础化工-化学制品-复合肥 | E88: =COUNTIF(A88:A6086,D88) -> 8
A89: 有色金属-金属新材料-磁性材料 | B89: 交运设备-汽车零部件-汽车零部件Ⅲ | D89: 基础化工-化学制品-纺织化学用品 | E89: =COUNTIF(A89:A6087,D89) -> 13
A90: 有色金属-金属新材料-磁性材料 | B90: 交运设备-汽车服务-汽车服务Ⅲ | D90: 基础化工-化学原料-无机盐 | E90: =COUNTIF(A90:A6088,D90) -> 10
A91: 有色金属-金属新材料-磁性材料 | B91: 交运设备-非汽车交运-其他交运设备 | D91: 基础化工-化工合成材料-其他橡胶制品 | E91: =COUNTIF(A91:A6089,D91) -> 13
A92: 有色金属-金属新材料-磁性材料 | B92: 交运设备-非汽车交运-轨交设备 | D92: 基础化工-化工合成材料-其他塑料制品 | E92: =COUNTIF(A92:A6090,D92) -> 19
A93: 有色金属-金属新材料-磁性材料 | B93: 交通运输-物流-物流Ⅲ | D93: 基础化工-化工合成材料-膜材料 | E93: =COUNTIF(A93:A6091,D93) -> 18
A94: 有色金属-金属新材料-磁性材料 | B94: 交通运输-机场航运-机场 | D94: 基础化工-化工合成材料-合成树脂 | E94: =COUNTIF(A94:A6092,D94) -> 11
A95: 有色金属-金属新材料-磁性材料 | B95: 交通运输-机场航运-航空运输 | D95: 基础化工-化工合成材料-改性塑料 | E95: =COUNTIF(A95:A6093,D95) -> 18
A96: 有色金属-金属新材料-磁性材料 | B96: 交通运输-公路铁路运输-铁路运输 | D96: 基础化工-化工合成材料-涤纶 | E96: =COUNTIF(A96:A6094,D96) -> 10
A97: 有色金属-金属新材料-磁性材料 | B97: 交通运输-公路铁路运输-公交 | D97: 机械设备-自动化设备-其他自动化设备 | E97: =COUNTIF(A97:A6095,D97) -> 25
A98: 有色金属-金属新材料-磁性材料 | B98: 交通运输-公路铁路运输-高速公路 | D98: 机械设备-自动化设备-机器人 | E98: =COUNTIF(A98:A6096,D98) -> 22
A99: 有色金属-贵金属-贵金属Ⅲ | B99: 交通运输-港口航运-航运 | D99: 机械设备-自动化设备-工控设备 | E99: =COUNTIF(A99:A6097,D99) -> 32
A100: 有色金属-贵金属-贵金属Ⅲ | B100: 交通运输-港口航运-港口 | D100: 机械设备-专用设备-其他专用设备 | E100: =COUNTIF(A100:A6098,D100) -> 77
A101: 有色金属-贵金属-贵金属Ⅲ | B101: 建筑装饰-建筑装饰-装饰园林 | D101: 机械设备-专用设备-农用机械 | E101: =COUNTIF(A101:A6099,D101) -> 10
A102: 有色金属-贵金属-贵金属Ⅲ | B102: 建筑装饰-建筑装饰-专业工程 | D102: 机械设备-专用设备-能源及重型设备 | E102: =COUNTIF(A102:A6100,D102) -> 49
A103: 有色金属-贵金属-贵金属Ⅲ | B103: 建筑装饰-建筑装饰-基础建设 | D103: 机械设备-专用设备-楼宇设备 | E103: =COUNTIF(A103:A6101,D103) -> 13
A104: 有色金属-贵金属-贵金属Ⅲ | B104: 建筑装饰-建筑装饰-工程咨询服务 | D104: 机械设备-专用设备-工程机械 | E104: =COUNTIF(A104:A6102,D104) -> 28
A105: 有色金属-贵金属-贵金属Ⅲ | B105: 建筑装饰-建筑装饰-房屋建设 | D105: 机械设备-专用设备-纺织服装设备 | E105: =COUNTIF(A105:A6103,D105) -> 12
A106: 有色金属-贵金属-贵金属Ⅲ | B106: 建筑材料-建筑材料-水泥 | D106: 机械设备-仪器仪表-仪器仪表Ⅲ | E106: =COUNTIF(A106:A6104,D106) -> 53
A107: 有色金属-贵金属-贵金属Ⅲ | B107: 建筑材料-建筑材料-其他建材 | D107: 机械设备-通用设备-制冷空调设备 | E107: =COUNTIF(A107:A6105,D107) -> 16
A108: 有色金属-贵金属-贵金属Ⅲ | B108: 建筑材料-建筑材料-耐火材料 | D108: 机械设备-通用设备-其他通用设备 | E108: =COUNTIF(A108:A6106,D108) -> 57
A109: 有色金属-贵金属-贵金属Ⅲ | B109: 建筑材料-建筑材料-管材 | D109: 机械设备-通用设备-磨具磨料 | E109: =COUNTIF(A109:A6107,D109) -> 14
A110: 有色金属-工业金属-铜 | B110: 建筑材料-建筑材料-玻璃玻纤 | D110: 机械设备-通用设备-金属制品 | E110: =COUNTIF(A110:A6108,D110) -> 70
A111: 有色金属-工业金属-铜 | B111: 家用电器-小家电-小家电Ⅲ | D111: 机械设备-通用设备-机床工具 | E111: =COUNTIF(A111:A6109,D111) -> 20
A112: 有色金属-工业金属-铜 | B112: 家用电器-黑色家电-其他黑色家电 | D112: 环保-环保-综合环境治理 | E112: =COUNTIF(A112:A6110,D112) -> 29
A113: 有色金属-工业金属-铜 | B113: 家用电器-黑色家电-彩电 | D113: 环保-环保-水务及水治理 | E113: =COUNTIF(A113:A6111,D113) -> 46
A114: 有色金属-工业金属-铜 | B114: 家用电器-厨卫电器-厨卫电器Ⅲ | D114: 环保-环保-环保设备 | E114: =COUNTIF(A114:A6112,D114) -> 28
A115: 有色金属-工业金属-铜 | B115: 家用电器-白色家电-其他白色家电 | D115: 环保-环保-固废治理 | E115: =COUNTIF(A115:A6113,D115) -> 36
A116: 有色金属-工业金属-铜 | B116: 家用电器-白色家电-空调 | D116: 环保-环保-大气治理 | E116: =COUNTIF(A116:A6114,D116) -> 7
A117: 有色金属-工业金属-铜 | B117: 家用电器-白色家电-冰洗 | D117: 黑色金属-钢铁-冶钢原料 | E117: =COUNTIF(A117:A6115,D117) -> 10
A118: 有色金属-工业金属-铜 | B118: 计算机-计算机应用-软件开发 | D118: 黑色金属-钢铁-特钢 | E118: =COUNTIF(A118:A6116,D118) -> 13
A119: 有色金属-工业金属-铜 | B119: 计算机-计算机应用-IT服务 | D119: 黑色金属-钢铁-普钢 | E119: =COUNTIF(A119:A6117,D119) -> 23
A120: 有色金属-工业金属-铜 | B120: 计算机-计算机设备-计算机设备Ⅲ | D120: 国防军工-国防军工-军工电子 | E120: =COUNTIF(A120:A6118,D120) -> 60
A121: 有色金属-工业金属-铜 | B121: 基础化工-化学制品-有机硅 | D121: 国防军工-国防军工-航天装备 | E121: =COUNTIF(A121:A6119,D121) -> 9
A122: 有色金属-工业金属-铜 | B122: 基础化工-化学制品-涂料油墨 | D122: 国防军工-国防军工-航空装备 | E122: =COUNTIF(A122:A6120,D122) -> 48
A123: 有色金属-工业金属-铜 | B123: 基础化工-化学制品-食品及饲料添加剂 | D123: 国防军工-国防军工-地面兵装 | E123: =COUNTIF(A123:A6121,D123) -> 12
A124: 有色金属-工业金属-铜 | B124: 基础化工-化学制品-其他化学制品 | D124: 公用事业-燃气-燃气Ⅲ | E124: =COUNTIF(A124:A6122,D124) -> 29
A125: 有色金属-工业金属-铅锌 | B125: 基础化工-化学制品-农药 | D125: 公用事业-电力-新能源发电 | E125: =COUNTIF(A125:A6123,D125) -> 27
A126: 有色金属-工业金属-铅锌 | B126: 基础化工-化学制品-民爆用品 | D126: 公用事业-电力-水电 | E126: =COUNTIF(A126:A6124,D126) -> 10
A127: 有色金属-工业金属-铅锌 | B127: 基础化工-化学制品-磷肥及磷化工 | D127: 非银金融-证券-证券Ⅲ | E127: =COUNTIF(A127:A6125,D127) -> 50
A128: 有色金属-工业金属-铅锌 | B128: 基础化工-化学制品-聚氨酯 | D128: 非银金融-保险及其他-多元金融 | E128: =COUNTIF(A128:A6126,D128) -> 31
A129: 有色金属-工业金属-铅锌 | B129: 基础化工-化学制品-钾肥 | D129: 非银金融-保险及其他-保险 | E129: =COUNTIF(A129:A6127,D129) -> 6
A130: 有色金属-工业金属-铅锌 | B130: 基础化工-化学制品-复合肥 | D130: 纺织服装-服装家纺-鞋帽及其他 | E130: =COUNTIF(A130:A6128,D130) -> 16
A131: 有色金属-工业金属-铅锌 | B131: 基础化工-化学制品-氟化工 | D131: 纺织服装-服装家纺-家纺 | E131: =COUNTIF(A131:A6129,D131) -> 7
A132: 有色金属-工业金属-铅锌 | B132: 基础化工-化学制品-纺织化学用品 | D132: 纺织服装-服装家纺-服装 | E132: =COUNTIF(A132:A6130,D132) -> 38
A133: 有色金属-工业金属-铅锌 | B133: 基础化工-化学制品-氮肥 | D133: 纺织服装-纺织制造-其他纺织 | E133: =COUNTIF(A133:A6131,D133) -> 19
A134: 有色金属-工业金属-铅锌 | B134: 基础化工-化学原料-无机盐 | D134: 纺织服装-纺织制造-棉纺 | E134: =COUNTIF(A134:A6132,D134) -> 8
A135: 有色金属-工业金属-铅锌 | B135: 基础化工-化学原料-钛白粉 | D135: 房地产-房地产开发-住宅开发 | E135: =COUNTIF(A135:A6133,D135) -> 77
A136: 有色金属-工业金属-铅锌 | B136: 基础化工-化学原料-其他化学原料 | D136: 房地产-房地产开发-商业地产 | E136: =COUNTIF(A136:A6134,D136) -> 9
A137: 有色金属-工业金属-铅锌 | B137: 基础化工-化学原料-氯碱 | D137: 房地产-房地产开发-产业地产 | E137: =COUNTIF(A137:A6135,D137) -> 10
A138: 有色金属-工业金属-铅锌 | B138: 基础化工-化学原料-纯碱 | D138: 电子-消费电子-消费电子零部件及组装 | E138: =COUNTIF(A138:A6136,D138) -> 90
A139: 有色金属-工业金属-铝 | B139: 基础化工-化工合成材料-粘胶 | D139: 电子-消费电子-品牌消费电子 | E139: =COUNTIF(A139:A6137,D139) -> 8
A140: 有色金属-工业金属-铝 | B140: 基础化工-化工合成材料-炭黑 | D140: 电子-其他电子-其他电子Ⅲ | E140: =COUNTIF(A140:A6138,D140) -> 37
A141: 有色金属-工业金属-铝 | B141: 基础化工-化工合成材料-其他橡胶制品 | D141: 电子-光学光电子-面板 | E141: =COUNTIF(A141:A6139,D141) -> 42
A142: 有色金属-工业金属-铝 | B142: 基础化工-化工合成材料-其他纤维 | D142: 电子-光学光电子-光学元件 | E142: =COUNTIF(A142:A6140,D142) -> 22
A143: 有色金属-工业金属-铝 | B143: 基础化工-化工合成材料-其他塑料制品 | D143: 电子-光学光电子-LED | E143: =COUNTIF(A143:A6141,D143) -> 42
A144: 有色金属-工业金属-铝 | B144: 基础化工-化工合成材料-膜材料 | D144: 电子-电子化学品-电子化学品Ⅲ | E144: =COUNTIF(A144:A6142,D144) -> 36
A145: 有色金属-工业金属-铝 | B145: 基础化工-化工合成材料-合成树脂 | D145: 电子-半导体及元件-印制电路板 | E145: =COUNTIF(A145:A6143,D145) -> 41
A146: 有色金属-工业金属-铝 | B146: 基础化工-化工合成材料-改性塑料 | D146: 电子-半导体及元件-集成电路设计 | E146: =COUNTIF(A146:A6144,D146) -> 76
A147: 有色金属-工业金属-铝 | B147: 基础化工-化工合成材料-涤纶 | D147: 电子-半导体及元件-集成电路封测 | E147: =COUNTIF(A147:A6145,D147) -> 13
A148: 有色金属-工业金属-铝 | B148: 基础化工-化工合成材料-氨纶 | D148: 电子-半导体及元件-被动元件 | E148: =COUNTIF(A148:A6146,D148) -> 13
A149: 有色金属-工业金属-铝 | B149: 基础化工-非金属材料-非金属材料Ⅲ | D149: 电子-半导体及元件-半导体设备 | E149: =COUNTIF(A149:A6147,D149) -> 17
A150: 有色金属-工业金属-铝 | B150: 机械设备-自动化设备-其他自动化设备 | D150: 电力设备-电力设备-线缆部件及其他 | E150: =COUNTIF(A150:A6148,D150) -> 36
A151: 有色金属-工业金属-铝 | B151: 机械设备-自动化设备-激光设备 | D151: 电力设备-电力设备-输变电设备 | E151: =COUNTIF(A151:A6149,D151) -> 51
A152: 有色金属-工业金属-铝 | B152: 机械设备-自动化设备-机器人 | D152: 电力设备-电力设备-电气自控设备 | E152: =COUNTIF(A152:A6150,D152) -> 36
A153: 有色金属-工业金属-铝 | B153: 机械设备-自动化设备-工控设备 | D153: 电力设备-电力设备-电机 | E153: =COUNTIF(A153:A6151,D153) -> 20
A154: 有色金属-工业金属-铝 | B154: 机械设备-专用设备-印刷包装机械 | D154: 电力设备-电力设备-电池 | E154: =COUNTIF(A154:A6152,D154) -> 101
A155: 有色金属-工业金属-铝 | B155: 机械设备-专用设备-其他专用设备 | D155: 传媒-传媒-游戏 | E155: =COUNTIF(A155:A6153,D155) -> 26
A156: 有色金属-工业金属-铝 | B156: 机械设备-专用设备-农用机械 | D156: 传媒-传媒-影视院线 | E156: =COUNTIF(A156:A6154,D156) -> 21
A157: 有色金属-工业金属-铝 | B157: 机械设备-专用设备-能源及重型设备 | D157: 传媒-传媒-数字媒体 | E157: =COUNTIF(A157:A6155,D157) -> 15
A158: 有色金属-工业金属-铝 | B158: 机械设备-专用设备-楼宇设备 | D158: 传媒-传媒-广告营销 | E158: =COUNTIF(A158:A6156,D158) -> 31
A159: 有色金属-工业金属-铝 | B159: 机械设备-专用设备-工程机械 | D159: 传媒-传媒-出版 | E159: =COUNTIF(A159:A6157,D159) -> 27
A160: 有色金属-工业金属-铝 | B160: 机械设备-专用设备-纺织服装设备
A161: 有色金属-工业金属-铝 | B161: 机械设备-仪器仪表-仪器仪表Ⅲ
A162: 有色金属-工业金属-铝 | B162: 机械设备-通用设备-制冷空调设备
A163: 有色金属-工业金属-铝 | B163: 机械设备-通用设备-其他通用设备
A164: 有色金属-工业金属-铝 | B164: 机械设备-通用设备-磨具磨料
A165: 有色金属-工业金属-铝 | B165: 机械设备-通用设备-金属制品
A166: 有色金属-工业金属-铝 | B166: 机械设备-通用设备-机床工具
A167: 有色金属-工业金属-铝 | B167: 环保-环保-综合环境治理
A168: 有色金属-工业金属-铝 | B168: 环保-环保-水务及水治理
A169: 有色金属-工业金属-铝 | B169: 环保-环保-环保设备
A170: 银行-银行-农商行 | B170: 环保-环保-固废治理
A171: 银行-银行-农商行 | B171: 环保-环保-大气治理
A172: 银行-银行-农商行 | B172: 黑色金属-钢铁-冶钢原料
A173: 银行-银行-农商行 | B173: 黑色金属-钢铁-特钢
A174: 银行-银行-农商行 | B174: 黑色金属-钢铁-普钢
A175: 银行-银行-农商行 | B175: 国防军工-国防军工-军工电子
A176: 银行-银行-农商行 | B176: 国防军工-国防军工-航天装备
A177: 银行-银行-农商行 | B177: 国防军工-国防军工-航空装备
A178: 银行-银行-农商行 | B178: 国防军工-国防军工-航海装备
A179: 银行-银行-农商行 | B179: 国防军工-国防军工-地面兵装
A180: 银行-银行-国有大型银行 | B180: 公用事业-燃气-燃气Ⅲ
A181: 银行-银行-国有大型银行 | B181: 公用事业-电力-新能源发电
A182: 银行-银行-国有大型银行 | B182: 公用事业-电力-水电
A183: 银行-银行-国有大型银行 | B183: 公用事业-电力-热力
A184: 银行-银行-国有大型银行 | B184: 公用事业-电力-火电
A185: 银行-银行-国有大型银行 | B185: 公用事业-电力-电能综合服务
A186: 银行-银行-股份制银行 | B186: 非银金融-证券-证券Ⅲ
A187: 银行-银行-股份制银行 | B187: 非银金融-保险及其他-多元金融
A188: 银行-银行-股份制银行 | B188: 非银金融-保险及其他-保险
A189: 银行-银行-股份制银行 | B189: 纺织服装-服装家纺-鞋帽及其他
A190: 银行-银行-股份制银行 | B190: 纺织服装-服装家纺-家纺
A191: 银行-银行-股份制银行 | B191: 纺织服装-服装家纺-服装
A192: 银行-银行-股份制银行 | B192: 纺织服装-纺织制造-印染
A193: 银行-银行-股份制银行 | B193: 纺织服装-纺织制造-其他纺织
A194: 银行-银行-股份制银行 | B194: 纺织服装-纺织制造-棉纺
A195: 银行-银行-城商行 | B195: 纺织服装-纺织制造-辅料
A196: 银行-银行-城商行 | B196: 房地产-房地产开发-住宅开发
A197: 银行-银行-城商行 | B197: 房地产-房地产开发-商业地产
A198: 银行-银行-城商行 | B198: 房地产-房地产开发-产业地产
A199: 银行-银行-城商行 | B199: 房地产-房地产服务-房地产服务Ⅲ
A200: 银行-银行-城商行 | B200: 电子-消费电子-消费电子零部件及组装
A201: 银行-银行-城商行 | B201: 电子-消费电子-品牌消费电子
A202: 银行-银行-城商行 | B202: 电子-其他电子-其他电子Ⅲ
A203: 银行-银行-城商行 | B203: 电子-光学光电子-面板
A204: 银行-银行-城商行 | B204: 电子-光学光电子-光学元件
A205: 银行-银行-城商行 | B205: 电子-光学光电子-LED
A206: 银行-银行-城商行 | B206: 电子-电子化学品-电子化学品Ⅲ
A207: 银行-银行-城商行 | B207: 电子-半导体及元件-印制电路板
A208: 银行-银行-城商行 | B208: 电子-半导体及元件-集成电路制造
A209: 银行-银行-城商行 | B209: 电子-半导体及元件-集成电路设计
A210: 银行-银行-城商行 | B210: 电子-半导体及元件-集成电路封测
A211: 银行-银行-城商行 | B211: 电子-半导体及元件-分立器件
A212: 医药生物-中药-中药Ⅲ | B212: 电子-半导体及元件-被动元件
A213: 医药生物-中药-中药Ⅲ | B213: 电子-半导体及元件-半导体设备
A214: 医药生物-中药-中药Ⅲ | B214: 电子-半导体及元件-半导体材料
A215: 医药生物-中药-中药Ⅲ | B215: 电力设备-电力设备-线缆部件及其他
A216: 医药生物-中药-中药Ⅲ | B216: 电力设备-电力设备-输变电设备
A217: 医药生物-中药-中药Ⅲ | B217: 电力设备-电力设备-其他电源设备
A218: 医药生物-中药-中药Ⅲ | B218: 电力设备-电力设备-光伏设备
A219: 医药生物-中药-中药Ⅲ | B219: 电力设备-电力设备-风电设备
A220: 医药生物-中药-中药Ⅲ | B220: 电力设备-电力设备-电气自控设备
A221: 医药生物-中药-中药Ⅲ | B221: 电力设备-电力设备-电机
A222: 医药生物-中药-中药Ⅲ | B222: 电力设备-电力设备-电池
A223: 医药生物-中药-中药Ⅲ | B223: 传媒-传媒-有线电视网络
A224: 医药生物-中药-中药Ⅲ | B224: 传媒-传媒-游戏
A225: 医药生物-中药-中药Ⅲ | B225: 传媒-传媒-影视院线
A226: 医药生物-中药-中药Ⅲ | B226: 传媒-传媒-数字媒体
A227: 医药生物-中药-中药Ⅲ | B227: 传媒-传媒-广告营销
A228: 医药生物-中药-中药Ⅲ | B228: 传媒-传媒-出版
A229: 医药生物-中药-中药Ⅲ
A230: 医药生物-中药-中药Ⅲ
A231: 医药生物-中药-中药Ⅲ
A232: 医药生物-中药-中药Ⅲ
A233: 医药生物-中药-中药Ⅲ
A234: 医药生物-中药-中药Ⅲ
A235: 医药生物-中药-中药Ⅲ
A236: 医药生物-中药-中药Ⅲ
A237: 医药生物-中药-中药Ⅲ
A238: 医药生物-中药-中药Ⅲ
A239: 医药生物-中药-中药Ⅲ
A240: 医药生物-中药-中药Ⅲ
A241: 医药生物-中药-中药Ⅲ
A242: 医药生物-中药-中药Ⅲ
A243: 医药生物-中药-中药Ⅲ
A244: 医药生物-中药-中药Ⅲ
A245: 医药生物-中药-中药Ⅲ
A246: 医药生物-中药-中药Ⅲ
A247: 医药生物-中药-中药Ⅲ
A248: 医药生物-中药-中药Ⅲ
A249: 医药生物-中药-中药Ⅲ
A250: 医药生物-中药-中药Ⅲ
A251: 医药生物-中药-中药Ⅲ
A252: 医药生物-中药-中药Ⅲ
A253: 医药生物-中药-中药Ⅲ
A254: 医药生物-中药-中药Ⅲ
A255: 医药生物-中药-中药Ⅲ
A256: 医药生物-中药-中药Ⅲ
A257: 医药生物-中药-中药Ⅲ
A258: 医药生物-中药-中药Ⅲ
A259: 医药生物-中药-中药Ⅲ
A260: 医药生物-中药-中药Ⅲ
A261: 医药生物-中药-中药Ⅲ
A262: 医药生物-中药-中药Ⅲ
A263: 医药生物-中药-中药Ⅲ
A264: 医药生物-中药-中药Ⅲ
A265: 医药生物-中药-中药Ⅲ
A266: 医药生物-中药-中药Ⅲ
A267: 医药生物-中药-中药Ⅲ
A268: 医药生物-中药-中药Ⅲ
A269: 医药生物-中药-中药Ⅲ
A270: 医药生物-中药-中药Ⅲ
A271: 医药生物-中药-中药Ⅲ
A272: 医药生物-中药-中药Ⅲ
A273: 医药生物-中药-中药Ⅲ
A274: 医药生物-中药-中药Ⅲ
A275: 医药生物-中药-中药Ⅲ
A276: 医药生物-中药-中药Ⅲ
A277: 医药生物-中药-中药Ⅲ
A278: 医药生物-中药-中药Ⅲ
A279: 医药生物-中药-中药Ⅲ
A280: 医药生物-中药-中药Ⅲ
A281: 医药生物-中药-中药Ⅲ
A282: 医药生物-中药-中药Ⅲ
A283: 医药生物-中药-中药Ⅲ
A284: 医药生物-中药-中药Ⅲ
A285: 医药生物-医药商业-医药商业Ⅲ
A286: 医药生物-医药商业-医药商业Ⅲ
A287: 医药生物-医药商业-医药商业Ⅲ
A288: 医药生物-医药商业-医药商业Ⅲ
A289: 医药生物-医药商业-医药商业Ⅲ
A290: 医药生物-医药商业-医药商业Ⅲ
A291: 医药生物-医药商业-医药商业Ⅲ
A292: 医药生物-医药商业-医药商业Ⅲ
A293: 医药生物-医药商业-医药商业Ⅲ
A294: 医药生物-医药商业-医药商业Ⅲ
A295: 医药生物-医药商业-医药商业Ⅲ
A296: 医药生物-医药商业-医药商业Ⅲ
A297: 医药生物-医药商业-医药商业Ⅲ
A298: 医药生物-医药商业-医药商业Ⅲ
A299: 医药生物-医药商业-医药商业Ⅲ
A300: 医药生物-医药商业-医药商业Ⅲ
A301: 医药生物-医药商业-医药商业Ⅲ
A302: 医药生物-医药商业-医药商业Ⅲ
A303: 医药生物-医药商业-医药商业Ⅲ
A304: 医药生物-医药商业-医药商业Ⅲ
A305: 医药生物-医药商业-医药商业Ⅲ
A306: 医药生物-医药商业-医药商业Ⅲ
A307: 医药生物-医药商业-医药商业Ⅲ
A308: 医药生物-医药商业-医药商业Ⅲ
A309: 医药生物-医药商业-医药商业Ⅲ
A310: 医药生物-医药商业-医药商业Ⅲ
A311: 医药生物-医药商业-医药商业Ⅲ
A312: 医药生物-医药商业-医药商业Ⅲ
A313: 医药生物-医药商业-医药商业Ⅲ
A314: 医药生物-医药商业-医药商业Ⅲ
A315: 医药生物-医药商业-医药商业Ⅲ
A316: 医药生物-医疗器械-医疗设备
A317: 医药生物-医疗器械-医疗设备
A318: 医药生物-医疗器械-医疗设备
A319: 医药生物-医疗器械-医疗设备
A320: 医药生物-医疗器械-医疗设备
A321: 医药生物-医疗器械-医疗设备
A322: 医药生物-医疗器械-医疗设备
A323: 医药生物-医疗器械-医疗设备
A324: 医药生物-医疗器械-医疗设备
A325: 医药生物-医疗器械-医疗设备
A326: 医药生物-医疗器械-医疗设备
A327: 医药生物-医疗器械-医疗设备
A328: 医药生物-医疗器械-医疗设备
A329: 医药生物-医疗器械-医疗设备
A330: 医药生物-医疗器械-医疗设备
A331: 医药生物-医疗器械-医疗设备
A332: 医药生物-医疗器械-医疗设备
A333: 医药生物-医疗器械-医疗设备
A334: 医药生物-医疗器械-医疗设备
A335: 医药生物-医疗器械-医疗设备
A336: 医药生物-医疗器械-医疗设备
A337: 医药生物-医疗器械-医疗设备
A338: 医药生物-医疗器械-医疗设备
A339: 医药生物-医疗器械-医疗设备
A340: 医药生物-医疗器械-医疗设备
A341: 医药生物-医疗器械-医疗设备
A342: 医药生物-医疗器械-医疗设备
A343: 医药生物-医疗器械-医疗设备
A344: 医药生物-医疗器械-医疗设备
A345: 医药生物-医疗器械-医疗设备
A346: 医药生物-医疗器械-医疗设备
A347: 医药生物-医疗器械-医疗设备
A348: 医药生物-医疗器械-医疗设备
A349: 医药生物-医疗器械-医疗设备
A350: 医药生物-医疗器械-医疗设备
A351: 医药生物-医疗器械-医疗设备
A352: 医药生物-医疗器械-医疗设备
A353: 医药生物-医疗器械-医疗设备
A354: 医药生物-医疗器械-医疗设备
A355: 医药生物-医疗器械-医疗设备
A356: 医药生物-医疗器械-医疗设备
A357: 医药生物-医疗器械-医疗耗材
A358: 医药生物-医疗器械-医疗耗材
A359: 医药生物-医疗器械-医疗耗材
A360: 医药生物-医疗器械-医疗耗材
A361: 医药生物-医疗器械-医疗耗材
A362: 医药生物-医疗器械-医疗耗材
A363: 医药生物-医疗器械-医疗耗材
A364: 医药生物-医疗器械-医疗耗材
A365: 医药生物-医疗器械-医疗耗材
A366: 医药生物-医疗器械-医疗耗材
A367: 医药生物-医疗器械-医疗耗材
A368: 医药生物-医疗器械-医疗耗材
A369: 医药生物-医疗器械-医疗耗材
A370: 医药生物-医疗器械-医疗耗材
A371: 医药生物-医疗器械-医疗耗材
A372: 医药生物-医疗器械-医疗耗材
A373: 医药生物-医疗器械-医疗耗材
A374: 医药生物-医疗器械-医疗耗材
A375: 医药生物-医疗器械-医疗耗材
A376: 医药生物-医疗器械-医疗耗材
A377: 医药生物-医疗器械-医疗耗材
A378: 医药生物-医疗器械-医疗耗材
A379: 医药生物-医疗器械-医疗耗材
A380: 医药生物-医疗器械-医疗耗材
A381: 医药生物-医疗器械-医疗耗材
A382: 医药生物-医疗器械-医疗耗材
A383: 医药生物-医疗器械-医疗耗材
A384: 医药生物-医疗器械-医疗耗材
A385: 医药生物-医疗器械-医疗耗材
A386: 医药生物-医疗器械-医疗耗材
A387: 医药生物-医疗器械-医疗耗材
A388: 医药生物-医疗器械-医疗耗材
A389: 医药生物-医疗器械-医疗耗材
A390: 医药生物-医疗器械-医疗耗材
A391: 医药生物-医疗器械-医疗耗材
A392: 医药生物-医疗器械-医疗耗材
A393: 医药生物-医疗器械-医疗耗材
A394: 医药生物-医疗器械-医疗耗材
A395: 医药生物-医疗器械-医疗耗材
A396: 医药生物-医疗器械-医疗耗材
A397: 医药生物-医疗器械-医疗耗材
A398: 医药生物-医疗器械-医疗耗材
A399: 医药生物-医疗器械-医疗耗材
A400: 医药生物-医疗器械-医疗耗材
A401: 医药生物-医疗器械-医疗耗材
A402: 医药生物-医疗器械-体外诊断
A403: 医药生物-医疗器械-体外诊断
A404: 医药生物-医疗器械-体外诊断
A405: 医药生物-医疗器械-体外诊断
A406: 医药生物-医疗器械-体外诊断
A407: 医药生物-医疗器械-体外诊断
A408: 医药生物-医疗器械-体外诊断
A409: 医药生物-医疗器械-体外诊断
A410: 医药生物-医疗器械-体外诊断
A411: 医药生物-医疗器械-体外诊断
A412: 医药生物-医疗器械-体外诊断
A413: 医药生物-医疗器械-体外诊断
A414: 医药生物-医疗器械-体外诊断
A415: 医药生物-医疗器械-体外诊断
A416: 医药生物-医疗器械-体外诊断
A417: 医药生物-医疗器械-体外诊断
A418: 医药生物-医疗器械-体外诊断
A419: 医药生物-医疗器械-体外诊断
A420: 医药生物-医疗器械-体外诊断
A421: 医药生物-医疗器械-体外诊断
A422: 医药生物-医疗器械-体外诊断
A423: 医药生物-医疗器械-体外诊断
A424: 医药生物-医疗器械-体外诊断
A425: 医药生物-医疗器械-体外诊断
A426: 医药生物-医疗器械-体外诊断
A427: 医药生物-医疗器械-体外诊断
A428: 医药生物-医疗器械-体外诊断
A429: 医药生物-医疗器械-体外诊断
A430: 医药生物-医疗器械-体外诊断
A431: 医药生物-医疗器械-体外诊断
A432: 医药生物-医疗器械-体外诊断
A433: 医药生物-医疗器械-体外诊断
A434: 医药生物-医疗器械-体外诊断
A435: 医药生物-医疗器械-体外诊断
A436: 医药生物-医疗器械-体外诊断
A437: 医药生物-医疗器械-体外诊断
A438: 医药生物-医疗器械-体外诊断
A439: 医药生物-医疗器械-体外诊断
A440: 医药生物-医疗器械-体外诊断
A441: 医药生物-医疗器械-体外诊断
A442: 医药生物-医疗服务-医疗研发外包
A443: 医药生物-医疗服务-医疗研发外包
A444: 医药生物-医疗服务-医疗研发外包
A445: 医药生物-医疗服务-医疗研发外包
A446: 医药生物-医疗服务-医疗研发外包
A447: 医药生物-医疗服务-医疗研发外包
A448: 医药生物-医疗服务-医疗研发外包
A449: 医药生物-医疗服务-医疗研发外包
A450: 医药生物-医疗服务-医疗研发外包
A451: 医药生物-医疗服务-医疗研发外包
A452: 医药生物-医疗服务-医疗研发外包
A453: 医药生物-医疗服务-医疗研发外包
A454: 医药生物-医疗服务-医疗研发外包
A455: 医药生物-医疗服务-医疗研发外包
A456: 医药生物-医疗服务-医疗研发外包
A457: 医药生物-医疗服务-医疗研发外包
A458: 医药生物-医疗服务-医疗研发外包
A459: 医药生物-医疗服务-医疗研发外包
A460: 医药生物-医疗服务-医疗研发外包
A461: 医药生物-医疗服务-医疗研发外包
A462: 医药生物-医疗服务-医疗研发外包
A463: 医药生物-医疗服务-医疗研发外包
A464: 医药生物-医疗服务-医疗研发外包
A465: 医药生物-医疗服务-医疗研发外包
A466: 医药生物-医疗服务-医疗研发外包
A467: 医药生物-医疗服务-医疗研发外包
A468: 医药生物-医疗服务-医疗研发外包
A469: 医药生物-医疗服务-其他医疗服务
A470: 医药生物-医疗服务-其他医疗服务
A471: 医药生物-医疗服务-其他医疗服务
A472: 医药生物-医疗服务-其他医疗服务
A473: 医药生物-医疗服务-其他医疗服务
A474: 医药生物-医疗服务-其他医疗服务
A475: 医药生物-医疗服务-其他医疗服务
A476: 医药生物-医疗服务-其他医疗服务
A477: 医药生物-医疗服务-其他医疗服务
A478: 医药生物-医疗服务-其他医疗服务
A479: 医药生物-医疗服务-其他医疗服务
A480: 医药生物-医疗服务-其他医疗服务
A481: 医药生物-医疗服务-其他医疗服务
A482: 医药生物-医疗服务-其他医疗服务
A483: 医药生物-医疗服务-其他医疗服务
A484: 医药生物-医疗服务-其他医疗服务
A485: 医药生物-医疗服务-其他医疗服务
A486: 医药生物-医疗服务-其他医疗服务
A487: 医药生物-医疗服务-其他医疗服务
A488: 医药生物-医疗服务-其他医疗服务
A489: 医药生物-医疗服务-其他医疗服务
A490: 医药生物-医疗服务-其他医疗服务
A491: 医药生物-医疗服务-其他医疗服务
A492: 医药生物-医疗服务-其他医疗服务
A493: 医药生物-生物制品-疫苗
A494: 医药生物-生物制品-疫苗
A495: 医药生物-生物制品-疫苗
A496: 医药生物-生物制品-疫苗
A497: 医药生物-生物制品-疫苗
A498: 医药生物-生物制品-疫苗
A499: 医药生物-生物制品-疫苗
A500: 医药生物-生物制品-疫苗
A501: 医药生物-生物制品-疫苗
A502: 医药生物-生物制品-疫苗
A503: 医药生物-生物制品-疫苗
A504: 医药生物-生物制品-疫苗
A505: 医药生物-生物制品-疫苗
A506: 医药生物-生物制品-疫苗
A507: 医药生物-生物制品-血液制品
A508: 医药生物-生物制品-血液制品
A509: 医药生物-生物制品-血液制品
A510: 医药生物-生物制品-血液制品
A511: 医药生物-生物制品-血液制品
A512: 医药生物-生物制品-血液制品
A513: 医药生物-生物制品-其他生物制品
A514: 医药生物-生物制品-其他生物制品
A515: 医药生物-生物制品-其他生物制品
A516: 医药生物-生物制品-其他生物制品
A517: 医药生物-生物制品-其他生物制品
A518: 医药生物-生物制品-其他生物制品
A519: 医药生物-生物制品-其他生物制品
A520: 医药生物-生物制品-其他生物制品
A521: 医药生物-生物制品-其他生物制品
A522: 医药生物-生物制品-其他生物制品
A523: 医药生物-生物制品-其他生物制品
A524: 医药生物-生物制品-其他生物制品
A525: 医药生物-生物制品-其他生物制品
A526: 医药生物-生物制品-其他生物制品
A527: 医药生物-生物制品-其他生物制品
A528: 医药生物-生物制品-其他生物制品
A529: 医药生物-生物制品-其他生物制品
A530: 医药生物-生物制品-其他生物制品
A531: 医药生物-生物制品-其他生物制品
A532: 医药生物-生物制品-其他生物制品
A533: 医药生物-生物制品-其他生物制品
A534: 医药生物-生物制品-其他生物制品
A535: 医药生物-生物制品-其他生物制品
A536: 医药生物-生物制品-其他生物制品
A537: 医药生物-生物制品-其他生物制品
A538: 医药生物-生物制品-其他生物制品
A539: 医药生物-生物制品-其他生物制品
A540: 医药生物-生物制品-其他生物制品
A541: 医药生物-生物制品-其他生物制品
A542: 医药生物-生物制品-其他生物制品
A543: 医药生物-生物制品-其他生物制品
A544: 医药生物-生物制品-其他生物制品
A545: 医药生物-生物制品-其他生物制品
A546: 医药生物-生物制品-其他生物制品
A547: 医药生物-生物制品-其他生物制品
A548: 医药生物-化学制药-原料药
A549: 医药生物-化学制药-原料药
A550: 医药生物-化学制药-原料药
A551: 医药生物-化学制药-原料药
A552: 医药生物-化学制药-原料药
A553: 医药生物-化学制药-原料药
A554: 医药生物-化学制药-原料药
A555: 医药生物-化学制药-原料药
A556: 医药生物-化学制药-原料药
A557: 医药生物-化学制药-原料药
A558: 医药生物-化学制药-原料药
A559: 医药生物-化学制药-原料药
A560: 医药生物-化学制药-原料药
A561: 医药生物-化学制药-原料药
A562: 医药生物-化学制药-原料药
A563: 医药生物-化学制药-原料药
A564: 医药生物-化学制药-原料药
A565: 医药生物-化学制药-原料药
A566: 医药生物-化学制药-原料药
A567: 医药生物-化学制药-原料药
A568: 医药生物-化学制药-原料药
A569: 医药生物-化学制药-原料药
A570: 医药生物-化学制药-原料药
A571: 医药生物-化学制药-原料药
A572: 医药生物-化学制药-原料药
A573: 医药生物-化学制药-原料药
A574: 医药生物-化学制药-原料药
A575: 医药生物-化学制药-原料药
A576: 医药生物-化学制药-原料药
A577: 医药生物-化学制药-原料药
A578: 医药生物-化学制药-原料药
A579: 医药生物-化学制药-原料药
A580: 医药生物-化学制药-原料药
A581: 医药生物-化学制药-原料药
A582: 医药生物-化学制药-原料药
A583: 医药生物-化学制药-原料药
A584: 医药生物-化学制药-原料药
A585: 医药生物-化学制药-原料药
A586: 医药生物-化学制药-原料药
A587: 医药生物-化学制药-原料药
A588: 医药生物-化学制药-原料药
A589: 医药生物-化学制药-原料药
A590: 医药生物-化学制药-化学制剂
A591: 医药生物-化学制药-化学制剂
A592: 医药生物-化学制药-化学制剂
A593: 医药生物-化学制药-化学制剂
A594: 医药生物-化学制药-化学制剂
A595: 医药生物-化学制药-化学制剂
A596: 医药生物-化学制药-化学制剂
A597: 医药生物-化学制药-化学制剂
A598: 医药生物-化学制药-化学制剂
A599: 医药生物-化学制药-化学制剂
A600: 医药生物-化学制药-化学制剂
A601: 医药生物-化学制药-化学制剂
A602: 医药生物-化学制药-化学制剂
A603: 医药生物-化学制药-化学制剂
A604: 医药生物-化学制药-化学制剂
A605: 医药生物-化学制药-化学制剂
A606: 医药生物-化学制药-化学制剂
A607: 医药生物-化学制药-化学制剂
A608: 医药生物-化学制药-化学制剂
A609: 医药生物-化学制药-化学制剂
A610: 医药生物-化学制药-化学制剂
A611: 医药生物-化学制药-化学制剂
A612: 医药生物-化学制药-化学制剂
A613: 医药生物-化学制药-化学制剂
A614: 医药生物-化学制药-化学制剂
A615: 医药生物-化学制药-化学制剂
A616: 医药生物-化学制药-化学制剂
A617: 医药生物-化学制药-化学制剂
A618: 医药生物-化学制药-化学制剂
A619: 医药生物-化学制药-化学制剂
A620: 医药生物-化学制药-化学制剂
A621: 医药生物-化学制药-化学制剂
A622: 医药生物-化学制药-化学制剂
A623: 医药生物-化学制药-化学制剂
A624: 医药生物-化学制药-化学制剂
A625: 医药生物-化学制药-化学制剂
A626: 医药生物-化学制药-化学制剂
A627: 医药生物-化学制药-化学制剂
A628: 医药生物-化学制药-化学制剂
A629: 医药生物-化学制药-化学制剂
A630: 医药生物-化学制药-化学制剂
A631: 医药生物-化学制药-化学制剂
A632: 医药生物-化学制药-化学制剂
A633: 医药生物-化学制药-化学制剂
A634: 医药生物-化学制药-化学制剂
A635: 医药生物-化学制药-化学制剂
A636: 医药生物-化学制药-化学制剂
A637: 医药生物-化学制药-化学制剂
A638: 医药生物-化学制药-化学制剂
A639: 医药生物-化学制药-化学制剂
A640: 医药生物-化学制药-化学制剂
A641: 医药生物-化学制药-化学制剂
A642: 医药生物-化学制药-化学制剂
A643: 医药生物-化学制药-化学制剂
A644: 医药生物-化学制药-化学制剂
A645: 医药生物-化学制药-化学制剂
A646: 医药生物-化学制药-化学制剂
A647: 医药生物-化学制药-化学制剂
A648: 医药生物-化学制药-化学制剂
A649: 医药生物-化学制药-化学制剂
A650: 医药生物-化学制药-化学制剂
A651: 医药生物-化学制药-化学制剂
A652: 医药生物-化学制药-化学制剂
A653: 医药生物-化学制药-化学制剂
A654: 医药生物-化学制药-化学制剂
A655: 医药生物-化学制药-化学制剂
A656: 医药生物-化学制药-化学制剂
A657: 医药生物-化学制药-化学制剂
A658: 医药生物-化学制药-化学制剂
A659: 医药生物-化学制药-化学制剂
A660: 医药生物-化学制药-化学制剂
A661: 医药生物-化学制药-化学制剂
A662: 医药生物-化学制药-化学制剂
A663: 医药生物-化学制药-化学制剂
A664: 医药生物-化学制药-化学制剂
A665: 医药生物-化学制药-化学制剂
A666: 医药生物-化学制药-化学制剂
A667: 医药生物-化学制药-化学制剂
A668: 医药生物-化学制药-化学制剂
A669: 医药生物-化学制药-化学制剂
A670: 医药生物-化学制药-化学制剂
A671: 医药生物-化学制药-化学制剂
A672: 医药生物-化学制药-化学制剂
A673: 医药生物-化学制药-化学制剂
A674: 医药生物-化学制药-化学制剂
A675: 医药生物-化学制药-化学制剂
A676: 医药生物-化学制药-化学制剂
A677: 医药生物-化学制药-化学制剂
A678: 医药生物-化学制药-化学制剂
A679: 医药生物-化学制药-化学制剂
A680: 医药生物-化学制药-化学制剂
A681: 医药生物-化学制药-化学制剂
A682: 医药生物-化学制药-化学制剂
A683: 医药生物-化学制药-化学制剂
A684: 医药生物-化学制药-化学制剂
A685: 医药生物-化学制药-化学制剂
A686: 医药生物-化学制药-化学制剂
A687: 医药生物-化学制药-化学制剂
A688: 医药生物-化学制药-化学制剂
A689: 医药生物-化学制药-化学制剂
A690: 医药生物-化学制药-化学制剂
A691: 医药生物-化学制药-化学制剂
A692: 医药生物-化学制药-化学制剂
A693: 医药生物-化学制药-化学制剂
A694: 医药生物-化学制药-化学制剂
A695: 医药生物-化学制药-化学制剂
A696: 医药生物-化学制药-化学制剂
A697: 医药生物-化学制药-化学制剂
A698: 医药生物-化学制药-化学制剂
A699: 医药生物-化学制药-化学制剂
A700: 医药生物-化学制药-化学制剂
A701: 医药生物-化学制药-化学制剂
A702: 医药生物-化学制药-化学制剂
A703: 通信-通信设备-通信终端及配件
A704: 通信-通信设备-通信终端及配件
A705: 通信-通信设备-通信终端及配件
A706: 通信-通信设备-通信终端及配件
A707: 通信-通信设备-通信终端及配件
A708: 通信-通信设备-通信终端及配件
A709: 通信-通信设备-通信终端及配件
A710: 通信-通信设备-通信终端及配件
A711: 通信-通信设备-通信终端及配件
A712: 通信-通信设备-通信终端及配件
A713: 通信-通信设备-通信终端及配件
A714: 通信-通信设备-通信终端及配件
A715: 通信-通信设备-通信终端及配件
A716: 通信-通信设备-通信终端及配件
A717: 通信-通信设备-通信终端及配件
A718: 通信-通信设备-通信终端及配件
A719: 通信-通信设备-通信终端及配件
A720: 通信-通信设备-通信终端及配件
A721: 通信-通信设备-通信终端及配件
A722: 通信-通信设备-通信终端及配件
A723: 通信-通信设备-通信终端及配件
A724: 通信-通信设备-通信终端及配件
A725: 通信-通信设备-通信终端及配件
A726: 通信-通信设备-通信终端及配件
A727: 通信-通信设备-通信终端及配件
A728: 通信-通信设备-通信终端及配件
A729: 通信-通信设备-通信终端及配件
A730: 通信-通信设备-通信线缆及配套
A731: 通信-通信设备-通信线缆及配套
A732: 通信-通信设备-通信线缆及配套
A733: 通信-通信设备-通信线缆及配套
A734: 通信-通信设备-通信线缆及配套
A735: 通信-通信设备-通信线缆及配套
A736: 通信-通信设备-通信线缆及配套
A737: 通信-通信设备-通信线缆及配套
A738: 通信-通信设备-通信线缆及配套
A739: 通信-通信设备-通信线缆及配套
A740: 通信-通信设备-通信线缆及配套
A741: 通信-通信设备-通信线缆及配套
A742: 通信-通信设备-通信网络设备及器件
A743: 通信-通信设备-通信网络设备及器件
A744: 通信-通信设备-通信网络设备及器件
A745: 通信-通信设备-通信网络设备及器件
A746: 通信-通信设备-通信网络设备及器件
A747: 通信-通信设备-通信网络设备及器件
A748: 通信-通信设备-通信网络设备及器件
A749: 通信-通信设备-通信网络设备及器件
A750: 通信-通信设备-通信网络设备及器件
A751: 通信-通信设备-通信网络设备及器件
A752: 通信-通信设备-通信网络设备及器件
A753: 通信-通信设备-通信网络设备及器件
A754: 通信-通信设备-通信网络设备及器件
A755: 通信-通信设备-通信网络设备及器件
A756: 通信-通信设备-通信网络设备及器件
A757: 通信-通信设备-通信网络设备及器件
A758: 通信-通信设备-通信网络设备及器件
A759: 通信-通信设备-通信网络设备及器件
A760: 通信-通信设备-通信网络设备及器件
A761: 通信-通信设备-通信网络设备及器件
A762: 通信-通信设备-通信网络设备及器件
A763: 通信-通信设备-通信网络设备及器件
A764: 通信-通信设备-通信网络设备及器件
A765: 通信-通信设备-通信网络设备及器件
A766: 通信-通信设备-通信网络设备及器件
A767: 通信-通信设备-通信网络设备及器件
A768: 通信-通信设备-通信网络设备及器件
A769: 通信-通信设备-通信网络设备及器件
A770: 通信-通信设备-通信网络设备及器件
A771: 通信-通信设备-通信网络设备及器件
A772: 通信-通信设备-通信网络设备及器件
A773: 通信-通信设备-通信网络设备及器件
A774: 通信-通信设备-通信网络设备及器件
A775: 通信-通信设备-通信网络设备及器件
A776: 通信-通信设备-通信网络设备及器件
A777: 通信-通信设备-其他通信设备
A778: 通信-通信设备-其他通信设备
A779: 通信-通信设备-其他通信设备
A780: 通信-通信设备-其他通信设备
A781: 通信-通信设备-其他通信设备
A782: 通信-通信设备-其他通信设备
A783: 通信-通信设备-其他通信设备
A784: 通信-通信设备-其他通信设备
A785: 通信-通信设备-其他通信设备
A786: 通信-通信设备-其他通信设备
A787: 通信-通信设备-其他通信设备
A788: 通信-通信设备-其他通信设备
A789: 通信-通信设备-其他通信设备
A790: 通信-通信服务-通信服务Ⅲ
A791: 通信-通信服务-通信服务Ⅲ
A792: 通信-通信服务-通信服务Ⅲ
A793: 通信-通信服务-通信服务Ⅲ
A794: 通信-通信服务-通信服务Ⅲ
A795: 通信-通信服务-通信服务Ⅲ
A796: 通信-通信服务-通信服务Ⅲ
A797: 通信-通信服务-通信服务Ⅲ
A798: 通信-通信服务-通信服务Ⅲ
A799: 通信-通信服务-通信服务Ⅲ
A800: 通信-通信服务-通信服务Ⅲ
A801: 通信-通信服务-通信服务Ⅲ
A802: 通信-通信服务-通信服务Ⅲ
A803: 通信-通信服务-通信服务Ⅲ
A804: 通信-通信服务-通信服务Ⅲ
A805: 通信-通信服务-通信服务Ⅲ
A806: 通信-通信服务-通信服务Ⅲ
A807: 通信-通信服务-通信服务Ⅲ
A808: 通信-通信服务-通信服务Ⅲ
A809: 通信-通信服务-通信服务Ⅲ
A810: 通信-通信服务-通信服务Ⅲ
A811: 通信-通信服务-通信服务Ⅲ
A812: 通信-通信服务-通信服务Ⅲ
A813: 通信-通信服务-通信服务Ⅲ
A814: 通信-通信服务-通信服务Ⅲ
A815: 通信-通信服务-通信服务Ⅲ
A816: 通信-通信服务-通信服务Ⅲ
A817: 通信-通信服务-通信服务Ⅲ
A818: 通信-通信服务-通信服务Ⅲ
A819: 通信-通信服务-通信服务Ⅲ
A820: 通信-通信服务-通信服务Ⅲ
A821: 通信-通信服务-通信服务Ⅲ
A822: 通信-通信服务-通信服务Ⅲ
A823: 通信-通信服务-通信服务Ⅲ
A824: 通信-通信服务-通信服务Ⅲ
A825: 通信-通信服务-通信服务Ⅲ
A826: 通信-通信服务-通信服务Ⅲ
A827: 通信-通信服务-通信服务Ⅲ
A828: 通信-通信服务-通信服务Ⅲ
A829: 通信-通信服务-通信服务Ⅲ
A830: 通信-通信服务-通信服务Ⅲ
A831: 通信-通信服务-通信服务Ⅲ
A832: 通信-通信服务-通信服务Ⅲ
A833: 通信-通信服务-通信服务Ⅲ
A834: 通信-通信服务-通信服务Ⅲ
A835: 通信-通信服务-通信服务Ⅲ
A836: 通信-通信服务-通信服务Ⅲ
A837: 食品饮料-饮料制造-软饮料
A838: 食品饮料-饮料制造-软饮料
A839: 食品饮料-饮料制造-软饮料
A840: 食品饮料-饮料制造-软饮料
A841: 食品饮料-饮料制造-软饮料
A842: 食品饮料-饮料制造-软饮料
A843: 食品饮料-饮料制造-软饮料
A844: 食品饮料-饮料制造-软饮料
A845: 食品饮料-饮料制造-软饮料
A846: 食品饮料-饮料制造-软饮料
A847: 食品饮料-饮料制造-软饮料
A848: 食品饮料-饮料制造-其他酒类
A849: 食品饮料-饮料制造-其他酒类
A850: 食品饮料-饮料制造-其他酒类
A851: 食品饮料-饮料制造-其他酒类
A852: 食品饮料-饮料制造-其他酒类
A853: 食品饮料-饮料制造-其他酒类
A854: 食品饮料-饮料制造-其他酒类
A855: 食品饮料-饮料制造-其他酒类
A856: 食品饮料-饮料制造-其他酒类
A857: 食品饮料-饮料制造-啤酒
A858: 食品饮料-饮料制造-啤酒
A859: 食品饮料-饮料制造-啤酒
A860: 食品饮料-饮料制造-啤酒
A861: 食品饮料-饮料制造-啤酒
A862: 食品饮料-饮料制造-啤酒
A863: 食品饮料-饮料制造-啤酒
A864: 食品饮料-饮料制造-白酒
A865: 食品饮料-饮料制造-白酒
A866: 食品饮料-饮料制造-白酒
A867: 食品饮料-饮料制造-白酒
A868: 食品饮料-饮料制造-白酒
A869: 食品饮料-饮料制造-白酒
A870: 食品饮料-饮料制造-白酒
A871: 食品饮料-饮料制造-白酒
A872: 食品饮料-饮料制造-白酒
A873: 食品饮料-饮料制造-白酒
A874: 食品饮料-饮料制造-白酒
A875: 食品饮料-饮料制造-白酒
A876: 食品饮料-饮料制造-白酒
A877: 食品饮料-饮料制造-白酒
A878: 食品饮料-饮料制造-白酒
A879: 食品饮料-饮料制造-白酒
A880: 食品饮料-饮料制造-白酒
A881: 食品饮料-饮料制造-白酒
A882: 食品饮料-饮料制造-白酒
A883: 食品饮料-饮料制造-白酒
A884: 食品饮料-食品加工制造-休闲食品
A885: 食品饮料-食品加工制造-休闲食品
A886: 食品饮料-食品加工制造-休闲食品
A887: 食品饮料-食品加工制造-休闲食品
A888: 食品饮料-食品加工制造-休闲食品
A889: 食品饮料-食品加工制造-休闲食品
A890: 食品饮料-食品加工制造-休闲食品
A891: 食品饮料-食品加工制造-休闲食品
A892: 食品饮料-食品加工制造-休闲食品
A893: 食品饮料-食品加工制造-休闲食品
A894: 食品饮料-食品加工制造-休闲食品
A895: 食品饮料-食品加工制造-休闲食品
A896: 食品饮料-食品加工制造-休闲食品
A897: 食品饮料-食品加工制造-休闲食品
A898: 食品饮料-食品加工制造-休闲食品
A899: 食品饮料-食品加工制造-休闲食品
A900: 食品饮料-食品加工制造-休闲食品
A901: 食品饮料-食品加工制造-休闲食品
A902: 食品饮料-食品加工制造-休闲食品
A903: 食品饮料-食品加工制造-休闲食品
A904: 食品饮料-食品加工制造-休闲食品
A905: 食品饮料-食品加工制造-乳品
A906: 食品饮料-食品加工制造-乳品
A907: 食品饮料-食品加工制造-乳品
A908: 食品饮料-食品加工制造-乳品
A909: 食品饮料-食品加工制造-乳品
A910: 食品饮料-食品加工制造-乳品
A911: 食品饮料-食品加工制造-乳品
A912: 食品饮料-食品加工制造-乳品
A913: 食品饮料-食品加工制造-乳品
A914: 食品饮料-食品加工制造-乳品
A915: 食品饮料-食品加工制造-乳品
A916: 食品饮料-食品加工制造-乳品
A917: 食品饮料-食品加工制造-乳品
A918: 食品饮料-食品加工制造-乳品
A919: 食品饮料-食品加工制造-乳品
A920: 食品饮料-食品加工制造-乳品
A921: 食品饮料-食品加工制造-乳品
A922: 食品饮料-食品加工制造-乳品
A923: 食品饮料-食品加工制造-肉制品
A924: 食品饮料-食品加工制造-肉制品
A925: 食品饮料-食品加工制造-肉制品
A926: 食品饮料-食品加工制造-肉制品
A927: 食品饮料-食品加工制造-肉制品
A928: 食品饮料-食品加工制造-肉制品
A929: 食品饮料-食品加工制造-肉制品
A930: 食品饮料-食品加工制造-肉制品
A931: 食品饮料-食品加工制造-肉制品
A932: 食品饮料-食品加工制造-其他食品
A933: 食品饮料-食品加工制造-其他食品
A934: 食品饮料-食品加工制造-其他食品
A935: 食品饮料-食品加工制造-其他食品
A936: 食品饮料-食品加工制造-其他食品
A937: 食品饮料-食品加工制造-其他食品
A938: 食品饮料-食品加工制造-其他食品
A939: 食品饮料-食品加工制造-其他食品
A940: 食品饮料-食品加工制造-其他食品
A941: 食品饮料-食品加工制造-其他食品
A942: 食品饮料-食品加工制造-其他食品
A943: 食品饮料-食品加工制造-其他食品
A944: 食品饮料-食品加工制造-其他食品
A945: 食品饮料-食品加工制造-其他食品
A946: 食品饮料-食品加工制造-其他食品
A947: 食品饮料-食品加工制造-其他食品
A948: 食品饮料-食品加工制造-其他食品
A949: 食品饮料-食品加工制造-其他食品
A950: 食品饮料-食品加工制造-其他食品
A951: 食品饮料-食品加工制造-调味发酵品
A952: 食品饮料-食品加工制造-调味发酵品
A953: 食品饮料-食品加工制造-调味发酵品
A954: 食品饮料-食品加工制造-调味发酵品
A955: 食品饮料-食品加工制造-调味发酵品
A956: 食品饮料-食品加工制造-调味发酵品
A957: 食品饮料-食品加工制造-调味发酵品
A958: 食品饮料-食品加工制造-调味发酵品
A959: 食品饮料-食品加工制造-调味发酵品
A960: 食品饮料-食品加工制造-调味发酵品
A961: 食品饮料-食品加工制造-调味发酵品
A962: 食品饮料-食品加工制造-调味发酵品
A963: 食品饮料-食品加工制造-调味发酵品
A964: 食品饮料-食品加工制造-调味发酵品
A965: 食品饮料-食品加工制造-调味发酵品
A966: 石油石化-油气开采及服务-油气开采
A967: 石油石化-油气开采及服务-油气开采
A968: 石油石化-油气开采及服务-油气开采
A969: 石油石化-油气开采及服务-油气开采
A970: 石油石化-油气开采及服务-油气开采
A971: 石油石化-油气开采及服务-油气开采
A972: 石油石化-油气开采及服务-油气开采
A973: 石油石化-油气开采及服务-油服工程
A974: 石油石化-油气开采及服务-油服工程
A975: 石油石化-油气开采及服务-油服工程
A976: 石油石化-油气开采及服务-油服工程
A977: 石油石化-油气开采及服务-油服工程
A978: 石油石化-油气开采及服务-油服工程
A979: 石油石化-油气开采及服务-油服工程
A980: 石油石化-油气开采及服务-油服工程
A981: 石油石化-油气开采及服务-油服工程
A982: 石油石化-油气开采及服务-油服工程
A983: 石油石化-油气开采及服务-油服工程
A984: 石油石化-油气开采及服务-油服工程
A985: 石油石化-油气开采及服务-油服工程
A986: 石油石化-石油加工贸易-油品石化贸易
A987: 石油石化-石油加工贸易-油品石化贸易
A988: 石油石化-石油加工贸易-油品石化贸易
A989: 石油石化-石油加工贸易-油品石化贸易
A990: 石油石化-石油加工贸易-油品石化贸易
A991: 石油石化-石油加工贸易-油品石化贸易
A992: 石油石化-石油加工贸易-石油加工
A993: 石油石化-石油加工贸易-石油加工
A994: 石油石化-石油加工贸易-石油加工
A995: 石油石化-石油加工贸易-石油加工
A996: 石油石化-石油加工贸易-石油加工
A997: 石油石化-石油加工贸易-石油加工
A998: 石油石化-石油加工贸易-石油加工
A999: 石油石化-石油加工贸易-石油加工
A1000: 石油石化-石油加工贸易-石油加工
A1001: 石油石化-石油加工贸易-石油加工
A1002: 石油石化-石油加工贸易-石油加工
A1003: 石油石化-石油加工贸易-石油加工
A1004: 石油石化-石油加工贸易-石油加工
A1005: 石油石化-石油加工贸易-石油加工
A1006: 石油石化-石油加工贸易-石油加工
A1007: 石油石化-石油加工贸易-石油加工
A1008: 石油石化-石油加工贸易-石油加工
A1009: 石油石化-石油加工贸易-石油加工
A1010: 石油石化-石油加工贸易-石油加工
A1011: 石油石化-石油加工贸易-石油加工
A1012: 石油石化-石油加工贸易-石油加工
A1013: 石油石化-石油加工贸易-石油加工
A1014: 社会服务-其他社会服务-专业服务
A1015: 社会服务-其他社会服务-专业服务
A1016: 社会服务-其他社会服务-专业服务
A1017: 社会服务-其他社会服务-专业服务
A1018: 社会服务-其他社会服务-专业服务
A1019: 社会服务-其他社会服务-专业服务
A1020: 社会服务-其他社会服务-专业服务
A1021: 社会服务-其他社会服务-专业服务
A1022: 社会服务-其他社会服务-专业服务
A1023: 社会服务-其他社会服务-专业服务
A1024: 社会服务-其他社会服务-专业服务
A1025: 社会服务-其他社会服务-专业服务
A1026: 社会服务-其他社会服务-专业服务
A1027: 社会服务-其他社会服务-专业服务
A1028: 社会服务-其他社会服务-专业服务
A1029: 社会服务-其他社会服务-专业服务
A1030: 社会服务-其他社会服务-专业服务
A1031: 社会服务-其他社会服务-专业服务
A1032: 社会服务-其他社会服务-专业服务
A1033: 社会服务-其他社会服务-专业服务
A1034: 社会服务-其他社会服务-专业服务
A1035: 社会服务-其他社会服务-专业服务
A1036: 社会服务-其他社会服务-专业服务
A1037: 社会服务-其他社会服务-专业服务
A1038: 社会服务-其他社会服务-专业服务
A1039: 社会服务-其他社会服务-专业服务
A1040: 社会服务-其他社会服务-专业服务
A1041: 社会服务-其他社会服务-专业服务
A1042: 社会服务-其他社会服务-专业服务
A1043: 社会服务-其他社会服务-专业服务
A1044: 社会服务-其他社会服务-体育
A1045: 社会服务-其他社会服务-体育
A1046: 社会服务-其他社会服务-体育
A1047: 社会服务-酒店及餐饮-酒店
A1048: 社会服务-酒店及餐饮-酒店
A1049: 社会服务-酒店及餐饮-酒店
A1050: 社会服务-酒店及餐饮-酒店
A1051: 社会服务-酒店及餐饮-酒店
A1052: 社会服务-酒店及餐饮-酒店
A1053: 社会服务-酒店及餐饮-餐饮
A1054: 社会服务-酒店及餐饮-餐饮
A1055: 社会服务-酒店及餐饮-餐饮
A1056: 社会服务-景点及旅游-自然景点
A1057: 社会服务-景点及旅游-自然景点
A1058: 社会服务-景点及旅游-自然景点
A1059: 社会服务-景点及旅游-自然景点
A1060: 社会服务-景点及旅游-自然景点
A1061: 社会服务-景点及旅游-自然景点
A1062: 社会服务-景点及旅游-自然景点
A1063: 社会服务-景点及旅游-自然景点
A1064: 社会服务-景点及旅游-自然景点
A1065: 社会服务-景点及旅游-自然景点
A1066: 社会服务-景点及旅游-自然景点
A1067: 社会服务-景点及旅游-自然景点
A1068: 社会服务-景点及旅游-人工景点
A1069: 社会服务-景点及旅游-人工景点
A1070: 社会服务-景点及旅游-人工景点
A1071: 社会服务-景点及旅游-人工景点
A1072: 社会服务-景点及旅游-人工景点
A1073: 社会服务-景点及旅游-旅游综合
A1074: 社会服务-景点及旅游-旅游综合
A1075: 社会服务-景点及旅游-旅游综合
A1076: 社会服务-景点及旅游-旅游综合
A1077: 社会服务-教育-教育Ⅲ
A1078: 社会服务-教育-教育Ⅲ
A1079: 社会服务-教育-教育Ⅲ
A1080: 社会服务-教育-教育Ⅲ
A1081: 社会服务-教育-教育Ⅲ
A1082: 社会服务-教育-教育Ⅲ
A1083: 社会服务-教育-教育Ⅲ
A1084: 社会服务-教育-教育Ⅲ
A1085: 社会服务-教育-教育Ⅲ
A1086: 社会服务-教育-教育Ⅲ
A1087: 社会服务-教育-教育Ⅲ
A1088: 社会服务-教育-教育Ⅲ
A1089: 社会服务-教育-教育Ⅲ
A1090: 社会服务-教育-教育Ⅲ
A1091: 社会服务-教育-教育Ⅲ
A1092: 社会服务-教育-教育Ⅲ
A1093: 社会服务-教育-教育Ⅲ
A1094: 社会服务-教育-教育Ⅲ
A1095: 社会服务-教育-教育Ⅲ
A1096: 商贸零售-贸易-贸易Ⅲ
A1097: 商贸零售-贸易-贸易Ⅲ
A1098: 商贸零售-贸易-贸易Ⅲ
A1099: 商贸零售-贸易-贸易Ⅲ
A1100: 商贸零售-贸易-贸易Ⅲ
A1101: 商贸零售-贸易-贸易Ⅲ
A1102: 商贸零售-贸易-贸易Ⅲ
A1103: 商贸零售-贸易-贸易Ⅲ
A1104: 商贸零售-贸易-贸易Ⅲ
A1105: 商贸零售-贸易-贸易Ⅲ
A1106: 商贸零售-贸易-贸易Ⅲ
A1107: 商贸零售-贸易-贸易Ⅲ
A1108: 商贸零售-贸易-贸易Ⅲ
A1109: 商贸零售-贸易-贸易Ⅲ
A1110: 商贸零售-贸易-贸易Ⅲ
A1111: 商贸零售-贸易-贸易Ⅲ
A1112: 商贸零售-零售-专业连锁
A1113: 商贸零售-零售-专业连锁
A1114: 商贸零售-零售-专业连锁
A1115: 商贸零售-零售-专业连锁
A1116: 商贸零售-零售-专业连锁
A1117: 商贸零售-零售-专业连锁
A1118: 商贸零售-零售-专业连锁
A1119: 商贸零售-零售-商业物业经营
A1120: 商贸零售-零售-商业物业经营
A1121: 商贸零售-零售-商业物业经营
A1122: 商贸零售-零售-商业物业经营
A1123: 商贸零售-零售-商业物业经营
A1124: 商贸零售-零售-商业物业经营
A1125: 商贸零售-零售-商业物业经营
A1126: 商贸零售-零售-商业物业经营
A1127: 商贸零售-零售-商业物业经营
A1128: 商贸零售-零售-商业物业经营
A1129: 商贸零售-零售-商业物业经营
A1130: 商贸零售-零售-商业物业经营
A1131: 商贸零售-零售-商业物业经营
A1132: 商贸零售-零售-商业物业经营
A1133: 商贸零售-零售-商业物业经营
A1134: 商贸零售-零售-商业物业经营
A1135: 商贸零售-零售-商业物业经营
A1136: 商贸零售-零售-商业物业经营
A1137: 商贸零售-零售-商业物业经营
A1138: 商贸零售-零售-商业物业经营
A1139: 商贸零售-零售-旅游零售
A1140: 商贸零售-零售-百货零售
A1141: 商贸零售-零售-百货零售
A1142: 商贸零售-零售-百货零售
A1143: 商贸零售-零售-百货零售
A1144: 商贸零售-零售-百货零售
A1145: 商贸零售-零售-百货零售
A1146: 商贸零售-零售-百货零售
A1147: 商贸零售-零售-百货零售
A1148: 商贸零售-零售-百货零售
A1149: 商贸零售-零售-百货零售
A1150: 商贸零售-零售-百货零售
A1151: 商贸零售-零售-百货零售
A1152: 商贸零售-零售-百货零售
A1153: 商贸零售-零售-百货零售
A1154: 商贸零售-零售-百货零售
A1155: 商贸零售-零售-百货零售
A1156: 商贸零售-零售-百货零售
A1157: 商贸零售-零售-百货零售
A1158: 商贸零售-零售-百货零售
A1159: 商贸零售-零售-百货零售
A1160: 商贸零售-零售-百货零售
A1161: 商贸零售-零售-百货零售
A1162: 商贸零售-零售-百货零售
A1163: 商贸零售-零售-百货零售
A1164: 商贸零售-零售-百货零售
A1165: 商贸零售-零售-百货零售
A1166: 商贸零售-零售-百货零售
A1167: 商贸零售-零售-百货零售
A1168: 商贸零售-零售-百货零售
A1169: 商贸零售-零售-百货零售
A1170: 商贸零售-零售-百货零售
A1171: 商贸零售-零售-百货零售
A1172: 商贸零售-零售-百货零售
A1173: 商贸零售-零售-百货零售
A1174: 商贸零售-零售-百货零售
A1175: 商贸零售-零售-百货零售
A1176: 商贸零售-零售-百货零售
A1177: 商贸零售-零售-百货零售
A1178: 商贸零售-零售-百货零售
A1179: 商贸零售-零售-百货零售
A1180: 商贸零售-零售-百货零售
A1181: 商贸零售-零售-百货零售
A1182: 商贸零售-零售-百货零售
A1183: 商贸零售-互联网电商-互联网电商Ⅲ
A1184: 商贸零售-互联网电商-互联网电商Ⅲ
A1185: 商贸零售-互联网电商-互联网电商Ⅲ
A1186: 商贸零售-互联网电商-互联网电商Ⅲ
A1187: 商贸零售-互联网电商-互联网电商Ⅲ
A1188: 商贸零售-互联网电商-互联网电商Ⅲ
A1189: 商贸零售-互联网电商-互联网电商Ⅲ
A1190: 商贸零售-互联网电商-互联网电商Ⅲ
A1191: 商贸零售-互联网电商-互联网电商Ⅲ
A1192: 商贸零售-互联网电商-互联网电商Ⅲ
A1193: 商贸零售-互联网电商-互联网电商Ⅲ
A1194: 商贸零售-互联网电商-互联网电商Ⅲ
A1195: 商贸零售-互联网电商-互联网电商Ⅲ
A1196: 商贸零售-互联网电商-互联网电商Ⅲ
A1197: 商贸零售-互联网电商-互联网电商Ⅲ
A1198: 商贸零售-互联网电商-互联网电商Ⅲ
A1199: 商贸零售-互联网电商-互联网电商Ⅲ
A1200: 商贸零售-互联网电商-互联网电商Ⅲ
A1201: 商贸零售-互联网电商-互联网电商Ⅲ
A1202: 商贸零售-互联网电商-互联网电商Ⅲ
A1203: 商贸零售-互联网电商-互联网电商Ⅲ
A1204: 轻工制造-造纸-造纸Ⅲ
A1205: 轻工制造-造纸-造纸Ⅲ
A1206: 轻工制造-造纸-造纸Ⅲ
A1207: 轻工制造-造纸-造纸Ⅲ
A1208: 轻工制造-造纸-造纸Ⅲ
A1209: 轻工制造-造纸-造纸Ⅲ
A1210: 轻工制造-造纸-造纸Ⅲ
A1211: 轻工制造-造纸-造纸Ⅲ
A1212: 轻工制造-造纸-造纸Ⅲ
A1213: 轻工制造-造纸-造纸Ⅲ
A1214: 轻工制造-造纸-造纸Ⅲ
A1215: 轻工制造-造纸-造纸Ⅲ
A1216: 轻工制造-造纸-造纸Ⅲ
A1217: 轻工制造-造纸-造纸Ⅲ
A1218: 轻工制造-造纸-造纸Ⅲ
A1219: 轻工制造-造纸-造纸Ⅲ
A1220: 轻工制造-造纸-造纸Ⅲ
A1221: 轻工制造-造纸-造纸Ⅲ
A1222: 轻工制造-造纸-造纸Ⅲ
A1223: 轻工制造-造纸-造纸Ⅲ
A1224: 轻工制造-造纸-造纸Ⅲ
A1225: 轻工制造-造纸-造纸Ⅲ
A1226: 轻工制造-造纸-造纸Ⅲ
A1227: 轻工制造-造纸-造纸Ⅲ
A1228: 轻工制造-家用轻工-文娱用品
A1229: 轻工制造-家用轻工-文娱用品
A1230: 轻工制造-家用轻工-文娱用品
A1231: 轻工制造-家用轻工-文娱用品
A1232: 轻工制造-家用轻工-文娱用品
A1233: 轻工制造-家用轻工-文娱用品
A1234: 轻工制造-家用轻工-文娱用品
A1235: 轻工制造-家用轻工-文娱用品
A1236: 轻工制造-家用轻工-文娱用品
A1237: 轻工制造-家用轻工-文娱用品
A1238: 轻工制造-家用轻工-文娱用品
A1239: 轻工制造-家用轻工-文娱用品
A1240: 轻工制造-家用轻工-文娱用品
A1241: 轻工制造-家用轻工-文娱用品
A1242: 轻工制造-家用轻工-文娱用品
A1243: 轻工制造-家用轻工-文娱用品
A1244: 轻工制造-家用轻工-文娱用品
A1245: 轻工制造-家用轻工-文娱用品
A1246: 轻工制造-家用轻工-文娱用品
A1247: 轻工制造-家用轻工-文娱用品
A1248: 轻工制造-家用轻工-饰品
A1249: 轻工制造-家用轻工-饰品
A1250: 轻工制造-家用轻工-饰品
A1251: 轻工制造-家用轻工-饰品
A1252: 轻工制造-家用轻工-饰品
A1253: 轻工制造-家用轻工-饰品
A1254: 轻工制造-家用轻工-饰品
A1255: 轻工制造-家用轻工-饰品
A1256: 轻工制造-家用轻工-饰品
A1257: 轻工制造-家用轻工-饰品
A1258: 轻工制造-家用轻工-饰品
A1259: 轻工制造-家用轻工-饰品
A1260: 轻工制造-家用轻工-饰品
A1261: 轻工制造-家用轻工-饰品
A1262: 轻工制造-家用轻工-饰品
A1263: 轻工制造-家用轻工-饰品
A1264: 轻工制造-家用轻工-其他家用轻工
A1265: 轻工制造-家用轻工-其他家用轻工
A1266: 轻工制造-家用轻工-其他家用轻工
A1267: 轻工制造-家用轻工-其他家用轻工
A1268: 轻工制造-家用轻工-其他家用轻工
A1269: 轻工制造-家用轻工-其他家用轻工
A1270: 轻工制造-家用轻工-其他家用轻工
A1271: 轻工制造-家用轻工-其他家用轻工
A1272: 轻工制造-家用轻工-其他家用轻工
A1273: 轻工制造-家用轻工-其他家用轻工
A1274: 轻工制造-家用轻工-其他家用轻工
A1275: 轻工制造-家用轻工-其他家用轻工
A1276: 轻工制造-家用轻工-其他家用轻工
A1277: 轻工制造-家用轻工-其他家用轻工
A1278: 轻工制造-家用轻工-其他家用轻工
A1279: 轻工制造-家用轻工-其他家用轻工
A1280: 轻工制造-家用轻工-其他家用轻工
A1281: 轻工制造-家用轻工-其他家用轻工
A1282: 轻工制造-家用轻工-其他家用轻工
A1283: 轻工制造-家用轻工-其他家用轻工
A1284: 轻工制造-家用轻工-其他家用轻工
A1285: 轻工制造-家用轻工-其他家用轻工
A1286: 轻工制造-家用轻工-其他家用轻工
A1287: 轻工制造-家用轻工-其他家用轻工
A1288: 轻工制造-家用轻工-其他家用轻工
A1289: 轻工制造-家用轻工-其他家用轻工
A1290: 轻工制造-家用轻工-其他家用轻工
A1291: 轻工制造-家用轻工-其他家用轻工
A1292: 轻工制造-家用轻工-其他家用轻工
A1293: 轻工制造-家用轻工-其他家用轻工
A1294: 轻工制造-家用轻工-其他家用轻工
A1295: 轻工制造-家用轻工-其他家用轻工
A1296: 轻工制造-家用轻工-家具
A1297: 轻工制造-家用轻工-家具
A1298: 轻工制造-家用轻工-家具
A1299: 轻工制造-家用轻工-家具
A1300: 轻工制造-家用轻工-家具
A1301: 轻工制造-家用轻工-家具
A1302: 轻工制造-家用轻工-家具
A1303: 轻工制造-家用轻工-家具
A1304: 轻工制造-家用轻工-家具
A1305: 轻工制造-家用轻工-家具
A1306: 轻工制造-家用轻工-家具
A1307: 轻工制造-家用轻工-家具
A1308: 轻工制造-家用轻工-家具
A1309: 轻工制造-家用轻工-家具
A1310: 轻工制造-家用轻工-家具
A1311: 轻工制造-家用轻工-家具
A1312: 轻工制造-家用轻工-家具
A1313: 轻工制造-家用轻工-家具
A1314: 轻工制造-家用轻工-家具
A1315: 轻工制造-家用轻工-家具
A1316: 轻工制造-家用轻工-家具
A1317: 轻工制造-家用轻工-家具
A1318: 轻工制造-家用轻工-家具
A1319: 轻工制造-家用轻工-家具
A1320: 轻工制造-家用轻工-家具
A1321: 轻工制造-家用轻工-家具
A1322: 轻工制造-家用轻工-家具
A1323: 轻工制造-家用轻工-家具
A1324: 轻工制造-家用轻工-家具
A1325: 轻工制造-家用轻工-家具
A1326: 轻工制造-家用轻工-家具
A1327: 轻工制造-家用轻工-瓷砖地板
A1328: 轻工制造-家用轻工-瓷砖地板
A1329: 轻工制造-家用轻工-瓷砖地板
A1330: 轻工制造-家用轻工-瓷砖地板
A1331: 轻工制造-家用轻工-瓷砖地板
A1332: 轻工制造-家用轻工-瓷砖地板
A1333: 轻工制造-家用轻工-瓷砖地板
A1334: 轻工制造-家用轻工-瓷砖地板
A1335: 轻工制造-家用轻工-瓷砖地板
A1336: 轻工制造-包装印刷-印刷
A1337: 轻工制造-包装印刷-印刷
A1338: 轻工制造-包装印刷-印刷
A1339: 轻工制造-包装印刷-印刷
A1340: 轻工制造-包装印刷-印刷
A1341: 轻工制造-包装印刷-包装
A1342: 轻工制造-包装印刷-包装
A1343: 轻工制造-包装印刷-包装
A1344: 轻工制造-包装印刷-包装
A1345: 轻工制造-包装印刷-包装
A1346: 轻工制造-包装印刷-包装
A1347: 轻工制造-包装印刷-包装
A1348: 轻工制造-包装印刷-包装
A1349: 轻工制造-包装印刷-包装
A1350: 轻工制造-包装印刷-包装
A1351: 轻工制造-包装印刷-包装
A1352: 轻工制造-包装印刷-包装
A1353: 轻工制造-包装印刷-包装
A1354: 轻工制造-包装印刷-包装
A1355: 轻工制造-包装印刷-包装
A1356: 轻工制造-包装印刷-包装
A1357: 轻工制造-包装印刷-包装
A1358: 轻工制造-包装印刷-包装
A1359: 轻工制造-包装印刷-包装
A1360: 轻工制造-包装印刷-包装
A1361: 轻工制造-包装印刷-包装
A1362: 轻工制造-包装印刷-包装
A1363: 轻工制造-包装印刷-包装
A1364: 轻工制造-包装印刷-包装
A1365: 轻工制造-包装印刷-包装
A1366: 轻工制造-包装印刷-包装
A1367: 轻工制造-包装印刷-包装
A1368: 轻工制造-包装印刷-包装
A1369: 轻工制造-包装印刷-包装
A1370: 轻工制造-包装印刷-包装
A1371: 轻工制造-包装印刷-包装
A1372: 轻工制造-包装印刷-包装
A1373: 轻工制造-包装印刷-包装
A1374: 轻工制造-包装印刷-包装
A1375: 轻工制造-包装印刷-包装
A1376: 轻工制造-包装印刷-包装
A1377: 轻工制造-包装印刷-包装
A1378: 轻工制造-包装印刷-包装
A1379: 轻工制造-包装印刷-包装
A1380: 轻工制造-包装印刷-包装
A1381: 轻工制造-包装印刷-包装
A1382: 轻工制造-包装印刷-包装
A1383: 轻工制造-包装印刷-包装
A1384: 农林牧渔-种植业与林业-种子生产
A1385: 农林牧渔-种植业与林业-种子生产
A1386: 农林牧渔-种植业与林业-种子生产
A1387: 农林牧渔-种植业与林业-种子生产
A1388: 农林牧渔-种植业与林业-种子生产
A1389: 农林牧渔-种植业与林业-种子生产
A1390: 农林牧渔-种植业与林业-种子生产
A1391: 农林牧渔-种植业与林业-种子生产
A1392: 农林牧渔-种植业与林业-种子生产
A1393: 农林牧渔-种植业与林业-其他种植业
A1394: 农林牧渔-种植业与林业-其他种植业
A1395: 农林牧渔-种植业与林业-其他种植业
A1396: 农林牧渔-种植业与林业-其他种植业
A1397: 农林牧渔-种植业与林业-其他种植业
A1398: 农林牧渔-种植业与林业-其他种植业
A1399: 农林牧渔-种植业与林业-其他种植业
A1400: 农林牧渔-种植业与林业-其他种植业
A1401: 农林牧渔-种植业与林业-其他种植业
A1402: 农林牧渔-种植业与林业-林业
A1403: 农林牧渔-种植业与林业-林业
A1404: 农林牧渔-种植业与林业-林业
A1405: 农林牧渔-种植业与林业-林业
A1406: 农林牧渔-种植业与林业-粮食种植
A1407: 农林牧渔-种植业与林业-粮食种植
A1408: 农林牧渔-养殖业-畜禽养殖
A1409: 农林牧渔-养殖业-畜禽养殖
A1410: 农林牧渔-养殖业-畜禽养殖
A1411: 农林牧渔-养殖业-畜禽养殖
A1412: 农林牧渔-养殖业-畜禽养殖
A1413: 农林牧渔-养殖业-畜禽养殖
A1414: 农林牧渔-养殖业-畜禽养殖
A1415: 农林牧渔-养殖业-畜禽养殖
A1416: 农林牧渔-养殖业-畜禽养殖
A1417: 农林牧渔-养殖业-畜禽养殖
A1418: 农林牧渔-养殖业-畜禽养殖
A1419: 农林牧渔-养殖业-畜禽养殖
A1420: 农林牧渔-养殖业-畜禽养殖
A1421: 农林牧渔-养殖业-畜禽养殖
A1422: 农林牧渔-养殖业-畜禽养殖
A1423: 农林牧渔-养殖业-畜禽养殖
A1424: 农林牧渔-养殖业-畜禽养殖
A1425: 农林牧渔-养殖业-畜禽养殖
A1426: 农林牧渔-养殖业-畜禽养殖
A1427: 农林牧渔-养殖业-畜禽养殖
A1428: 农林牧渔-养殖业-畜禽养殖
A1429: 农林牧渔-养殖业-水产养殖
A1430: 农林牧渔-养殖业-水产养殖
A1431: 农林牧渔-养殖业-水产养殖
A1432: 农林牧渔-养殖业-水产养殖
A1433: 农林牧渔-养殖业-海洋捕捞
A1434: 农林牧渔-养殖业-海洋捕捞
A1435: 农林牧渔-农业服务-农业综合
A1436: 农林牧渔-农业服务-农业综合
A1437: 农林牧渔-农业服务-农业综合
A1438: 农林牧渔-农业服务-动物保健
A1439: 农林牧渔-农业服务-动物保健
A1440: 农林牧渔-农业服务-动物保健
A1441: 农林牧渔-农业服务-动物保健
A1442: 农林牧渔-农业服务-动物保健
A1443: 农林牧渔-农业服务-动物保健
A1444: 农林牧渔-农业服务-动物保健
A1445: 农林牧渔-农业服务-动物保健
A1446: 农林牧渔-农业服务-动物保健
A1447: 农林牧渔-农业服务-动物保健
A1448: 农林牧渔-农业服务-动物保健
A1449: 农林牧渔-农业服务-动物保健
A1450: 农林牧渔-农业服务-动物保健
A1451: 农林牧渔-农产品加工-饲料
A1452: 农林牧渔-农产品加工-饲料
A1453: 农林牧渔-农产品加工-饲料
A1454: 农林牧渔-农产品加工-饲料
A1455: 农林牧渔-农产品加工-饲料
A1456: 农林牧渔-农产品加工-饲料
A1457: 农林牧渔-农产品加工-饲料
A1458: 农林牧渔-农产品加工-饲料
A1459: 农林牧渔-农产品加工-饲料
A1460: 农林牧渔-农产品加工-饲料
A1461: 农林牧渔-农产品加工-饲料
A1462: 农林牧渔-农产品加工-饲料
A1463: 农林牧渔-农产品加工-饲料
A1464: 农林牧渔-农产品加工-饲料
A1465: 农林牧渔-农产品加工-饲料
A1466: 农林牧渔-农产品加工-饲料
A1467: 农林牧渔-农产品加工-饲料
A1468: 农林牧渔-农产品加工-饲料
A1469: 农林牧渔-农产品加工-其他农产品加工
A1470: 农林牧渔-农产品加工-其他农产品加工
A1471: 农林牧渔-农产品加工-其他农产品加工
A1472: 农林牧渔-农产品加工-其他农产品加工
A1473: 农林牧渔-农产品加工-其他农产品加工
A1474: 农林牧渔-农产品加工-其他农产品加工
A1475: 农林牧渔-农产品加工-其他农产品加工
A1476: 农林牧渔-农产品加工-其他农产品加工
A1477: 农林牧渔-农产品加工-其他农产品加工
A1478: 农林牧渔-农产品加工-其他农产品加工
A1479: 农林牧渔-农产品加工-其他农产品加工
A1480: 农林牧渔-农产品加工-粮油加工
A1481: 农林牧渔-农产品加工-粮油加工
A1482: 农林牧渔-农产品加工-粮油加工
A1483: 农林牧渔-农产品加工-粮油加工
A1484: 农林牧渔-农产品加工-粮油加工
A1485: 农林牧渔-农产品加工-粮油加工
A1486: 农林牧渔-农产品加工-粮油加工
A1487: 农林牧渔-农产品加工-果蔬加工
A1488: 农林牧渔-农产品加工-果蔬加工
A1489: 农林牧渔-农产品加工-果蔬加工
A1490: 农林牧渔-农产品加工-果蔬加工
A1491: 农林牧渔-农产品加工-果蔬加工
A1492: 美容护理-美容护理-医疗美容
A1493: 美容护理-美容护理-医疗美容
A1494: 美容护理-美容护理-医疗美容
A1495: 美容护理-美容护理-医疗美容
A1496: 美容护理-美容护理-化妆品
A1497: 美容护理-美容护理-化妆品
A1498: 美容护理-美容护理-化妆品
A1499: 美容护理-美容护理-化妆品
A1500: 美容护理-美容护理-化妆品
A1501: 美容护理-美容护理-化妆品
A1502: 美容护理-美容护理-化妆品
A1503: 美容护理-美容护理-化妆品
A1504: 美容护理-美容护理-化妆品
A1505: 美容护理-美容护理-化妆品
A1506: 美容护理-美容护理-化妆品
A1507: 美容护理-美容护理-化妆品
A1508: 美容护理-美容护理-化妆品
A1509: 美容护理-美容护理-化妆品
A1510: 美容护理-美容护理-个护用品
A1511: 美容护理-美容护理-个护用品
A1512: 美容护理-美容护理-个护用品
A1513: 美容护理-美容护理-个护用品
A1514: 美容护理-美容护理-个护用品
A1515: 美容护理-美容护理-个护用品
A1516: 美容护理-美容护理-个护用品
A1517: 美容护理-美容护理-个护用品
A1518: 美容护理-美容护理-个护用品
A1519: 美容护理-美容护理-个护用品
A1520: 美容护理-美容护理-个护用品
A1521: 美容护理-美容护理-个护用品
A1522: 美容护理-美容护理-个护用品
A1523: 美容护理-美容护理-个护用品
A1524: 煤炭-煤炭开采加工-煤炭开采
A1525: 煤炭-煤炭开采加工-煤炭开采
A1526: 煤炭-煤炭开采加工-煤炭开采
A1527: 煤炭-煤炭开采加工-煤炭开采
A1528: 煤炭-煤炭开采加工-煤炭开采
A1529: 煤炭-煤炭开采加工-煤炭开采
A1530: 煤炭-煤炭开采加工-煤炭开采
A1531: 煤炭-煤炭开采加工-煤炭开采
A1532: 煤炭-煤炭开采加工-煤炭开采
A1533: 煤炭-煤炭开采加工-煤炭开采
A1534: 煤炭-煤炭开采加工-煤炭开采
A1535: 煤炭-煤炭开采加工-煤炭开采
A1536: 煤炭-煤炭开采加工-煤炭开采
A1537: 煤炭-煤炭开采加工-煤炭开采
A1538: 煤炭-煤炭开采加工-煤炭开采
A1539: 煤炭-煤炭开采加工-煤炭开采
A1540: 煤炭-煤炭开采加工-煤炭开采
A1541: 煤炭-煤炭开采加工-煤炭开采
A1542: 煤炭-煤炭开采加工-煤炭开采
A1543: 煤炭-煤炭开采加工-煤炭开采
A1544: 煤炭-煤炭开采加工-煤炭开采
A1545: 煤炭-煤炭开采加工-煤炭开采
A1546: 煤炭-煤炭开采加工-煤炭开采
A1547: 煤炭-煤炭开采加工-煤炭开采
A1548: 煤炭-煤炭开采加工-煤炭开采
A1549: 煤炭-煤炭开采加工-煤炭开采
A1550: 煤炭-煤炭开采加工-煤炭开采
A1551: 煤炭-煤炭开采加工-煤炭开采
A1552: 煤炭-煤炭开采加工-焦炭加工
A1553: 煤炭-煤炭开采加工-焦炭加工
A1554: 煤炭-煤炭开采加工-焦炭加工
A1555: 煤炭-煤炭开采加工-焦炭加工
A1556: 煤炭-煤炭开采加工-焦炭加工
A1557: 煤炭-煤炭开采加工-焦炭加工
A1558: 煤炭-煤炭开采加工-焦炭加工
A1559: 交运设备-汽车整车-商用载客车
A1560: 交运设备-汽车整车-商用载客车
A1561: 交运设备-汽车整车-商用载客车
A1562: 交运设备-汽车整车-商用载客车
A1563: 交运设备-汽车整车-商用载客车
A1564: 交运设备-汽车整车-商用载客车
A1565: 交运设备-汽车整车-商用载货车
A1566: 交运设备-汽车整车-商用载货车
A1567: 交运设备-汽车整车-商用载货车
A1568: 交运设备-汽车整车-商用载货车
A1569: 交运设备-汽车整车-商用载货车
A1570: 交运设备-汽车整车-商用载货车
A1571: 交运设备-汽车整车-商用载货车
A1572: 交运设备-汽车整车-商用载货车
A1573: 交运设备-汽车整车-商用载货车
A1574: 交运设备-汽车整车-乘用车
A1575: 交运设备-汽车整车-乘用车
A1576: 交运设备-汽车整车-乘用车
A1577: 交运设备-汽车整车-乘用车
A1578: 交运设备-汽车整车-乘用车
A1579: 交运设备-汽车整车-乘用车
A1580: 交运设备-汽车整车-乘用车
A1581: 交运设备-汽车整车-乘用车
A1582: 交运设备-汽车整车-乘用车
A1583: 交运设备-汽车整车-乘用车
A1584: 交运设备-汽车零部件-汽车零部件Ⅲ
A1585: 交运设备-汽车零部件-汽车零部件Ⅲ
A1586: 交运设备-汽车零部件-汽车零部件Ⅲ
A1587: 交运设备-汽车零部件-汽车零部件Ⅲ
A1588: 交运设备-汽车零部件-汽车零部件Ⅲ
A1589: 交运设备-汽车零部件-汽车零部件Ⅲ
A1590: 交运设备-汽车零部件-汽车零部件Ⅲ
A1591: 交运设备-汽车零部件-汽车零部件Ⅲ
A1592: 交运设备-汽车零部件-汽车零部件Ⅲ
A1593: 交运设备-汽车零部件-汽车零部件Ⅲ
A1594: 交运设备-汽车零部件-汽车零部件Ⅲ
A1595: 交运设备-汽车零部件-汽车零部件Ⅲ
A1596: 交运设备-汽车零部件-汽车零部件Ⅲ
A1597: 交运设备-汽车零部件-汽车零部件Ⅲ
A1598: 交运设备-汽车零部件-汽车零部件Ⅲ
A1599: 交运设备-汽车零部件-汽车零部件Ⅲ
A1600: 交运设备-汽车零部件-汽车零部件Ⅲ
A1601: 交运设备-汽车零部件-汽车零部件Ⅲ
A1602: 交运设备-汽车零部件-汽车零部件Ⅲ
A1603: 交运设备-汽车零部件-汽车零部件Ⅲ
A1604: 交运设备-汽车零部件-汽车零部件Ⅲ
A1605: 交运设备-汽车零部件-汽车零部件Ⅲ
A1606: 交运设备-汽车零部件-汽车零部件Ⅲ
A1607: 交运设备-汽车零部件-汽车零部件Ⅲ
A1608: 交运设备-汽车零部件-汽车零部件Ⅲ
A1609: 交运设备-汽车零部件-汽车零部件Ⅲ
A1610: 交运设备-汽车零部件-汽车零部件Ⅲ
A1611: 交运设备-汽车零部件-汽车零部件Ⅲ
A1612: 交运设备-汽车零部件-汽车零部件Ⅲ
A1613: 交运设备-汽车零部件-汽车零部件Ⅲ
A1614: 交运设备-汽车零部件-汽车零部件Ⅲ
A1615: 交运设备-汽车零部件-汽车零部件Ⅲ
A1616: 交运设备-汽车零部件-汽车零部件Ⅲ
A1617: 交运设备-汽车零部件-汽车零部件Ⅲ
A1618: 交运设备-汽车零部件-汽车零部件Ⅲ
A1619: 交运设备-汽车零部件-汽车零部件Ⅲ
A1620: 交运设备-汽车零部件-汽车零部件Ⅲ
A1621: 交运设备-汽车零部件-汽车零部件Ⅲ
A1622: 交运设备-汽车零部件-汽车零部件Ⅲ
A1623: 交运设备-汽车零部件-汽车零部件Ⅲ
A1624: 交运设备-汽车零部件-汽车零部件Ⅲ
A1625: 交运设备-汽车零部件-汽车零部件Ⅲ
A1626: 交运设备-汽车零部件-汽车零部件Ⅲ
A1627: 交运设备-汽车零部件-汽车零部件Ⅲ
A1628: 交运设备-汽车零部件-汽车零部件Ⅲ
A1629: 交运设备-汽车零部件-汽车零部件Ⅲ
A1630: 交运设备-汽车零部件-汽车零部件Ⅲ
A1631: 交运设备-汽车零部件-汽车零部件Ⅲ
A1632: 交运设备-汽车零部件-汽车零部件Ⅲ
A1633: 交运设备-汽车零部件-汽车零部件Ⅲ
A1634: 交运设备-汽车零部件-汽车零部件Ⅲ
A1635: 交运设备-汽车零部件-汽车零部件Ⅲ
A1636: 交运设备-汽车零部件-汽车零部件Ⅲ
A1637: 交运设备-汽车零部件-汽车零部件Ⅲ
A1638: 交运设备-汽车零部件-汽车零部件Ⅲ
A1639: 交运设备-汽车零部件-汽车零部件Ⅲ
A1640: 交运设备-汽车零部件-汽车零部件Ⅲ
A1641: 交运设备-汽车零部件-汽车零部件Ⅲ
A1642: 交运设备-汽车零部件-汽车零部件Ⅲ
A1643: 交运设备-汽车零部件-汽车零部件Ⅲ
A1644: 交运设备-汽车零部件-汽车零部件Ⅲ
A1645: 交运设备-汽车零部件-汽车零部件Ⅲ
A1646: 交运设备-汽车零部件-汽车零部件Ⅲ
A1647: 交运设备-汽车零部件-汽车零部件Ⅲ
A1648: 交运设备-汽车零部件-汽车零部件Ⅲ
A1649: 交运设备-汽车零部件-汽车零部件Ⅲ
A1650: 交运设备-汽车零部件-汽车零部件Ⅲ
A1651: 交运设备-汽车零部件-汽车零部件Ⅲ
A1652: 交运设备-汽车零部件-汽车零部件Ⅲ
A1653: 交运设备-汽车零部件-汽车零部件Ⅲ
A1654: 交运设备-汽车零部件-汽车零部件Ⅲ
A1655: 交运设备-汽车零部件-汽车零部件Ⅲ
A1656: 交运设备-汽车零部件-汽车零部件Ⅲ
A1657: 交运设备-汽车零部件-汽车零部件Ⅲ
A1658: 交运设备-汽车零部件-汽车零部件Ⅲ
A1659: 交运设备-汽车零部件-汽车零部件Ⅲ
A1660: 交运设备-汽车零部件-汽车零部件Ⅲ
A1661: 交运设备-汽车零部件-汽车零部件Ⅲ
A1662: 交运设备-汽车零部件-汽车零部件Ⅲ
A1663: 交运设备-汽车零部件-汽车零部件Ⅲ
A1664: 交运设备-汽车零部件-汽车零部件Ⅲ
A1665: 交运设备-汽车零部件-汽车零部件Ⅲ
A1666: 交运设备-汽车零部件-汽车零部件Ⅲ
A1667: 交运设备-汽车零部件-汽车零部件Ⅲ
A1668: 交运设备-汽车零部件-汽车零部件Ⅲ
A1669: 交运设备-汽车零部件-汽车零部件Ⅲ
A1670: 交运设备-汽车零部件-汽车零部件Ⅲ
A1671: 交运设备-汽车零部件-汽车零部件Ⅲ
A1672: 交运设备-汽车零部件-汽车零部件Ⅲ
A1673: 交运设备-汽车零部件-汽车零部件Ⅲ
A1674: 交运设备-汽车零部件-汽车零部件Ⅲ
A1675: 交运设备-汽车零部件-汽车零部件Ⅲ
A1676: 交运设备-汽车零部件-汽车零部件Ⅲ
A1677: 交运设备-汽车零部件-汽车零部件Ⅲ
A1678: 交运设备-汽车零部件-汽车零部件Ⅲ
A1679: 交运设备-汽车零部件-汽车零部件Ⅲ
A1680: 交运设备-汽车零部件-汽车零部件Ⅲ
A1681: 交运设备-汽车零部件-汽车零部件Ⅲ
A1682: 交运设备-汽车零部件-汽车零部件Ⅲ
A1683: 交运设备-汽车零部件-汽车零部件Ⅲ
A1684: 交运设备-汽车零部件-汽车零部件Ⅲ
A1685: 交运设备-汽车零部件-汽车零部件Ⅲ
A1686: 交运设备-汽车零部件-汽车零部件Ⅲ
A1687: 交运设备-汽车零部件-汽车零部件Ⅲ
A1688: 交运设备-汽车零部件-汽车零部件Ⅲ
A1689: 交运设备-汽车零部件-汽车零部件Ⅲ
A1690: 交运设备-汽车零部件-汽车零部件Ⅲ
A1691: 交运设备-汽车零部件-汽车零部件Ⅲ
A1692: 交运设备-汽车零部件-汽车零部件Ⅲ
A1693: 交运设备-汽车零部件-汽车零部件Ⅲ
A1694: 交运设备-汽车零部件-汽车零部件Ⅲ
A1695: 交运设备-汽车零部件-汽车零部件Ⅲ
A1696: 交运设备-汽车零部件-汽车零部件Ⅲ
A1697: 交运设备-汽车零部件-汽车零部件Ⅲ
A1698: 交运设备-汽车零部件-汽车零部件Ⅲ
A1699: 交运设备-汽车零部件-汽车零部件Ⅲ
A1700: 交运设备-汽车零部件-汽车零部件Ⅲ
A1701: 交运设备-汽车零部件-汽车零部件Ⅲ
A1702: 交运设备-汽车零部件-汽车零部件Ⅲ
A1703: 交运设备-汽车零部件-汽车零部件Ⅲ
A1704: 交运设备-汽车零部件-汽车零部件Ⅲ
A1705: 交运设备-汽车零部件-汽车零部件Ⅲ
A1706: 交运设备-汽车零部件-汽车零部件Ⅲ
A1707: 交运设备-汽车零部件-汽车零部件Ⅲ
A1708: 交运设备-汽车零部件-汽车零部件Ⅲ
A1709: 交运设备-汽车零部件-汽车零部件Ⅲ
A1710: 交运设备-汽车零部件-汽车零部件Ⅲ
A1711: 交运设备-汽车零部件-汽车零部件Ⅲ
A1712: 交运设备-汽车零部件-汽车零部件Ⅲ
A1713: 交运设备-汽车零部件-汽车零部件Ⅲ
A1714: 交运设备-汽车零部件-汽车零部件Ⅲ
A1715: 交运设备-汽车零部件-汽车零部件Ⅲ
A1716: 交运设备-汽车零部件-汽车零部件Ⅲ
A1717: 交运设备-汽车零部件-汽车零部件Ⅲ
A1718: 交运设备-汽车零部件-汽车零部件Ⅲ
A1719: 交运设备-汽车零部件-汽车零部件Ⅲ
A1720: 交运设备-汽车零部件-汽车零部件Ⅲ
A1721: 交运设备-汽车零部件-汽车零部件Ⅲ
A1722: 交运设备-汽车零部件-汽车零部件Ⅲ
A1723: 交运设备-汽车零部件-汽车零部件Ⅲ
A1724: 交运设备-汽车零部件-汽车零部件Ⅲ
A1725: 交运设备-汽车零部件-汽车零部件Ⅲ
A1726: 交运设备-汽车零部件-汽车零部件Ⅲ
A1727: 交运设备-汽车零部件-汽车零部件Ⅲ
A1728: 交运设备-汽车零部件-汽车零部件Ⅲ
A1729: 交运设备-汽车零部件-汽车零部件Ⅲ
A1730: 交运设备-汽车零部件-汽车零部件Ⅲ
A1731: 交运设备-汽车零部件-汽车零部件Ⅲ
A1732: 交运设备-汽车零部件-汽车零部件Ⅲ
A1733: 交运设备-汽车零部件-汽车零部件Ⅲ
A1734: 交运设备-汽车零部件-汽车零部件Ⅲ
A1735: 交运设备-汽车零部件-汽车零部件Ⅲ
A1736: 交运设备-汽车零部件-汽车零部件Ⅲ
A1737: 交运设备-汽车零部件-汽车零部件Ⅲ
A1738: 交运设备-汽车零部件-汽车零部件Ⅲ
A1739: 交运设备-汽车零部件-汽车零部件Ⅲ
A1740: 交运设备-汽车零部件-汽车零部件Ⅲ
A1741: 交运设备-汽车零部件-汽车零部件Ⅲ
A1742: 交运设备-汽车零部件-汽车零部件Ⅲ
A1743: 交运设备-汽车零部件-汽车零部件Ⅲ
A1744: 交运设备-汽车零部件-汽车零部件Ⅲ
A1745: 交运设备-汽车零部件-汽车零部件Ⅲ
A1746: 交运设备-汽车零部件-汽车零部件Ⅲ
A1747: 交运设备-汽车零部件-汽车零部件Ⅲ
A1748: 交运设备-汽车零部件-汽车零部件Ⅲ
A1749: 交运设备-汽车零部件-汽车零部件Ⅲ
A1750: 交运设备-汽车零部件-汽车零部件Ⅲ
A1751: 交运设备-汽车零部件-汽车零部件Ⅲ
A1752: 交运设备-汽车零部件-汽车零部件Ⅲ
A1753: 交运设备-汽车零部件-汽车零部件Ⅲ
A1754: 交运设备-汽车零部件-汽车零部件Ⅲ
A1755: 交运设备-汽车零部件-汽车零部件Ⅲ
A1756: 交运设备-汽车零部件-汽车零部件Ⅲ
A1757: 交运设备-汽车零部件-汽车零部件Ⅲ
A1758: 交运设备-汽车零部件-汽车零部件Ⅲ
A1759: 交运设备-汽车零部件-汽车零部件Ⅲ
A1760: 交运设备-汽车零部件-汽车零部件Ⅲ
A1761: 交运设备-汽车零部件-汽车零部件Ⅲ
A1762: 交运设备-汽车零部件-汽车零部件Ⅲ
A1763: 交运设备-汽车零部件-汽车零部件Ⅲ
A1764: 交运设备-汽车零部件-汽车零部件Ⅲ
A1765: 交运设备-汽车零部件-汽车零部件Ⅲ
A1766: 交运设备-汽车零部件-汽车零部件Ⅲ
A1767: 交运设备-汽车零部件-汽车零部件Ⅲ
A1768: 交运设备-汽车零部件-汽车零部件Ⅲ
A1769: 交运设备-汽车零部件-汽车零部件Ⅲ
A1770: 交运设备-汽车零部件-汽车零部件Ⅲ
A1771: 交运设备-汽车零部件-汽车零部件Ⅲ
A1772: 交运设备-汽车零部件-汽车零部件Ⅲ
A1773: 交运设备-汽车零部件-汽车零部件Ⅲ
A1774: 交运设备-汽车零部件-汽车零部件Ⅲ
A1775: 交运设备-汽车零部件-汽车零部件Ⅲ
A1776: 交运设备-汽车零部件-汽车零部件Ⅲ
A1777: 交运设备-汽车零部件-汽车零部件Ⅲ
A1778: 交运设备-汽车零部件-汽车零部件Ⅲ
A1779: 交运设备-汽车零部件-汽车零部件Ⅲ
A1780: 交运设备-汽车零部件-汽车零部件Ⅲ
A1781: 交运设备-汽车零部件-汽车零部件Ⅲ
A1782: 交运设备-汽车零部件-汽车零部件Ⅲ
A1783: 交运设备-汽车零部件-汽车零部件Ⅲ
A1784: 交运设备-汽车零部件-汽车零部件Ⅲ
A1785: 交运设备-汽车零部件-汽车零部件Ⅲ
A1786: 交运设备-汽车零部件-汽车零部件Ⅲ
A1787: 交运设备-汽车零部件-汽车零部件Ⅲ
A1788: 交运设备-汽车零部件-汽车零部件Ⅲ
A1789: 交运设备-汽车零部件-汽车零部件Ⅲ
A1790: 交运设备-汽车零部件-汽车零部件Ⅲ
A1791: 交运设备-汽车零部件-汽车零部件Ⅲ
A1792: 交运设备-汽车零部件-汽车零部件Ⅲ
A1793: 交运设备-汽车零部件-汽车零部件Ⅲ
A1794: 交运设备-汽车零部件-汽车零部件Ⅲ
A1795: 交运设备-汽车零部件-汽车零部件Ⅲ
A1796: 交运设备-汽车零部件-汽车零部件Ⅲ
A1797: 交运设备-汽车零部件-汽车零部件Ⅲ
A1798: 交运设备-汽车零部件-汽车零部件Ⅲ
A1799: 交运设备-汽车零部件-汽车零部件Ⅲ
A1800: 交运设备-汽车零部件-汽车零部件Ⅲ
A1801: 交运设备-汽车零部件-汽车零部件Ⅲ
A1802: 交运设备-汽车零部件-汽车零部件Ⅲ
A1803: 交运设备-汽车零部件-汽车零部件Ⅲ
A1804: 交运设备-汽车零部件-汽车零部件Ⅲ
A1805: 交运设备-汽车零部件-汽车零部件Ⅲ
A1806: 交运设备-汽车零部件-汽车零部件Ⅲ
A1807: 交运设备-汽车零部件-汽车零部件Ⅲ
A1808: 交运设备-汽车零部件-汽车零部件Ⅲ
A1809: 交运设备-汽车零部件-汽车零部件Ⅲ
A1810: 交运设备-汽车零部件-汽车零部件Ⅲ
A1811: 交运设备-汽车零部件-汽车零部件Ⅲ
A1812: 交运设备-汽车零部件-汽车零部件Ⅲ
A1813: 交运设备-汽车服务-汽车服务Ⅲ
A1814: 交运设备-汽车服务-汽车服务Ⅲ
A1815: 交运设备-汽车服务-汽车服务Ⅲ
A1816: 交运设备-汽车服务-汽车服务Ⅲ
A1817: 交运设备-汽车服务-汽车服务Ⅲ
A1818: 交运设备-汽车服务-汽车服务Ⅲ
A1819: 交运设备-汽车服务-汽车服务Ⅲ
A1820: 交运设备-汽车服务-汽车服务Ⅲ
A1821: 交运设备-汽车服务-汽车服务Ⅲ
A1822: 交运设备-汽车服务-汽车服务Ⅲ
A1823: 交运设备-汽车服务-汽车服务Ⅲ
A1824: 交运设备-非汽车交运-其他交运设备
A1825: 交运设备-非汽车交运-其他交运设备
A1826: 交运设备-非汽车交运-其他交运设备
A1827: 交运设备-非汽车交运-其他交运设备
A1828: 交运设备-非汽车交运-其他交运设备
A1829: 交运设备-非汽车交运-其他交运设备
A1830: 交运设备-非汽车交运-其他交运设备
A1831: 交运设备-非汽车交运-其他交运设备
A1832: 交运设备-非汽车交运-其他交运设备
A1833: 交运设备-非汽车交运-其他交运设备
A1834: 交运设备-非汽车交运-其他交运设备
A1835: 交运设备-非汽车交运-其他交运设备
A1836: 交运设备-非汽车交运-其他交运设备
A1837: 交运设备-非汽车交运-其他交运设备
A1838: 交运设备-非汽车交运-其他交运设备
A1839: 交运设备-非汽车交运-其他交运设备
A1840: 交运设备-非汽车交运-轨交设备
A1841: 交运设备-非汽车交运-轨交设备
A1842: 交运设备-非汽车交运-轨交设备
A1843: 交运设备-非汽车交运-轨交设备
A1844: 交运设备-非汽车交运-轨交设备
A1845: 交运设备-非汽车交运-轨交设备
A1846: 交运设备-非汽车交运-轨交设备
A1847: 交运设备-非汽车交运-轨交设备
A1848: 交运设备-非汽车交运-轨交设备
A1849: 交运设备-非汽车交运-轨交设备
A1850: 交运设备-非汽车交运-轨交设备
A1851: 交运设备-非汽车交运-轨交设备
A1852: 交运设备-非汽车交运-轨交设备
A1853: 交运设备-非汽车交运-轨交设备
A1854: 交运设备-非汽车交运-轨交设备
A1855: 交运设备-非汽车交运-轨交设备
A1856: 交运设备-非汽车交运-轨交设备
A1857: 交运设备-非汽车交运-轨交设备
A1858: 交运设备-非汽车交运-轨交设备
A1859: 交运设备-非汽车交运-轨交设备
A1860: 交运设备-非汽车交运-轨交设备
A1861: 交运设备-非汽车交运-轨交设备
A1862: 交运设备-非汽车交运-轨交设备
A1863: 交运设备-非汽车交运-轨交设备
A1864: 交运设备-非汽车交运-轨交设备
A1865: 交运设备-非汽车交运-轨交设备
A1866: 交运设备-非汽车交运-轨交设备
A1867: 交运设备-非汽车交运-轨交设备
A1868: 交运设备-非汽车交运-轨交设备
A1869: 交运设备-非汽车交运-轨交设备
A1870: 交通运输-物流-物流Ⅲ
A1871: 交通运输-物流-物流Ⅲ
A1872: 交通运输-物流-物流Ⅲ
A1873: 交通运输-物流-物流Ⅲ
A1874: 交通运输-物流-物流Ⅲ
A1875: 交通运输-物流-物流Ⅲ
A1876: 交通运输-物流-物流Ⅲ
A1877: 交通运输-物流-物流Ⅲ
A1878: 交通运输-物流-物流Ⅲ
A1879: 交通运输-物流-物流Ⅲ
A1880: 交通运输-物流-物流Ⅲ
A1881: 交通运输-物流-物流Ⅲ
A1882: 交通运输-物流-物流Ⅲ
A1883: 交通运输-物流-物流Ⅲ
A1884: 交通运输-物流-物流Ⅲ
A1885: 交通运输-物流-物流Ⅲ
A1886: 交通运输-物流-物流Ⅲ
A1887: 交通运输-物流-物流Ⅲ
A1888: 交通运输-物流-物流Ⅲ
A1889: 交通运输-物流-物流Ⅲ
A1890: 交通运输-物流-物流Ⅲ
A1891: 交通运输-物流-物流Ⅲ
A1892: 交通运输-物流-物流Ⅲ
A1893: 交通运输-物流-物流Ⅲ
A1894: 交通运输-物流-物流Ⅲ
A1895: 交通运输-物流-物流Ⅲ
A1896: 交通运输-物流-物流Ⅲ
A1897: 交通运输-物流-物流Ⅲ
A1898: 交通运输-物流-物流Ⅲ
A1899: 交通运输-物流-物流Ⅲ
A1900: 交通运输-物流-物流Ⅲ
A1901: 交通运输-物流-物流Ⅲ
A1902: 交通运输-物流-物流Ⅲ
A1903: 交通运输-物流-物流Ⅲ
A1904: 交通运输-物流-物流Ⅲ
A1905: 交通运输-物流-物流Ⅲ
A1906: 交通运输-物流-物流Ⅲ
A1907: 交通运输-物流-物流Ⅲ
A1908: 交通运输-物流-物流Ⅲ
A1909: 交通运输-物流-物流Ⅲ
A1910: 交通运输-物流-物流Ⅲ
A1911: 交通运输-物流-物流Ⅲ
A1912: 交通运输-物流-物流Ⅲ
A1913: 交通运输-物流-物流Ⅲ
A1914: 交通运输-物流-物流Ⅲ
A1915: 交通运输-物流-物流Ⅲ
A1916: 交通运输-物流-物流Ⅲ
A1917: 交通运输-机场航运-机场
A1918: 交通运输-机场航运-机场
A1919: 交通运输-机场航运-机场
A1920: 交通运输-机场航运-机场
A1921: 交通运输-机场航运-机场
A1922: 交通运输-机场航运-航空运输
A1923: 交通运输-机场航运-航空运输
A1924: 交通运输-机场航运-航空运输
A1925: 交通运输-机场航运-航空运输
A1926: 交通运输-机场航运-航空运输
A1927: 交通运输-机场航运-航空运输
A1928: 交通运输-机场航运-航空运输
A1929: 交通运输-机场航运-航空运输
A1930: 交通运输-公路铁路运输-铁路运输
A1931: 交通运输-公路铁路运输-铁路运输
A1932: 交通运输-公路铁路运输-铁路运输
A1933: 交通运输-公路铁路运输-铁路运输
A1934: 交通运输-公路铁路运输-铁路运输
A1935: 交通运输-公路铁路运输-铁路运输
A1936: 交通运输-公路铁路运输-铁路运输
A1937: 交通运输-公路铁路运输-公交
A1938: 交通运输-公路铁路运输-公交
A1939: 交通运输-公路铁路运输-公交
A1940: 交通运输-公路铁路运输-公交
A1941: 交通运输-公路铁路运输-公交
A1942: 交通运输-公路铁路运输-公交
A1943: 交通运输-公路铁路运输-公交
A1944: 交通运输-公路铁路运输-高速公路
A1945: 交通运输-公路铁路运输-高速公路
A1946: 交通运输-公路铁路运输-高速公路
A1947: 交通运输-公路铁路运输-高速公路
A1948: 交通运输-公路铁路运输-高速公路
A1949: 交通运输-公路铁路运输-高速公路
A1950: 交通运输-公路铁路运输-高速公路
A1951: 交通运输-公路铁路运输-高速公路
A1952: 交通运输-公路铁路运输-高速公路
A1953: 交通运输-公路铁路运输-高速公路
A1954: 交通运输-公路铁路运输-高速公路
A1955: 交通运输-公路铁路运输-高速公路
A1956: 交通运输-公路铁路运输-高速公路
A1957: 交通运输-公路铁路运输-高速公路
A1958: 交通运输-公路铁路运输-高速公路
A1959: 交通运输-公路铁路运输-高速公路
A1960: 交通运输-公路铁路运输-高速公路
A1961: 交通运输-公路铁路运输-高速公路
A1962: 交通运输-公路铁路运输-高速公路
A1963: 交通运输-港口航运-航运
A1964: 交通运输-港口航运-航运
A1965: 交通运输-港口航运-航运
A1966: 交通运输-港口航运-航运
A1967: 交通运输-港口航运-航运
A1968: 交通运输-港口航运-航运
A1969: 交通运输-港口航运-航运
A1970: 交通运输-港口航运-航运
A1971: 交通运输-港口航运-航运
A1972: 交通运输-港口航运-航运
A1973: 交通运输-港口航运-航运
A1974: 交通运输-港口航运-航运
A1975: 交通运输-港口航运-航运
A1976: 交通运输-港口航运-航运
A1977: 交通运输-港口航运-航运
A1978: 交通运输-港口航运-航运
A1979: 交通运输-港口航运-航运
A1980: 交通运输-港口航运-航运
A1981: 交通运输-港口航运-港口
A1982: 交通运输-港口航运-港口
A1983: 交通运输-港口航运-港口
A1984: 交通运输-港口航运-港口
A1985: 交通运输-港口航运-港口
A1986: 交通运输-港口航运-港口
A1987: 交通运输-港口航运-港口
A1988: 交通运输-港口航运-港口
A1989: 交通运输-港口航运-港口
A1990: 交通运输-港口航运-港口
A1991: 交通运输-港口航运-港口
A1992: 交通运输-港口航运-港口
A1993: 交通运输-港口航运-港口
A1994: 交通运输-港口航运-港口
A1995: 交通运输-港口航运-港口
A1996: 交通运输-港口航运-港口
A1997: 交通运输-港口航运-港口
A1998: 交通运输-港口航运-港口
A1999: 建筑装饰-建筑装饰-装饰园林
A2000: 建筑装饰-建筑装饰-装饰园林
A2001: 建筑装饰-建筑装饰-装饰园林
A2002: 建筑装饰-建筑装饰-装饰园林
A2003: 建筑装饰-建筑装饰-装饰园林
A2004: 建筑装饰-建筑装饰-装饰园林
A2005: 建筑装饰-建筑装饰-装饰园林
A2006: 建筑装饰-建筑装饰-装饰园林
A2007: 建筑装饰-建筑装饰-装饰园林
A2008: 建筑装饰-建筑装饰-装饰园林
A2009: 建筑装饰-建筑装饰-装饰园林
A2010: 建筑装饰-建筑装饰-装饰园林
A2011: 建筑装饰-建筑装饰-装饰园林
A2012: 建筑装饰-建筑装饰-装饰园林
A2013: 建筑装饰-建筑装饰-装饰园林
A2014: 建筑装饰-建筑装饰-装饰园林
A2015: 建筑装饰-建筑装饰-装饰园林
A2016: 建筑装饰-建筑装饰-装饰园林
A2017: 建筑装饰-建筑装饰-装饰园林
A2018: 建筑装饰-建筑装饰-装饰园林
A2019: 建筑装饰-建筑装饰-装饰园林
A2020: 建筑装饰-建筑装饰-装饰园林
A2021: 建筑装饰-建筑装饰-装饰园林
A2022: 建筑装饰-建筑装饰-装饰园林
A2023: 建筑装饰-建筑装饰-装饰园林
A2024: 建筑装饰-建筑装饰-装饰园林
A2025: 建筑装饰-建筑装饰-装饰园林
A2026: 建筑装饰-建筑装饰-装饰园林
A2027: 建筑装饰-建筑装饰-装饰园林
A2028: 建筑装饰-建筑装饰-装饰园林
A2029: 建筑装饰-建筑装饰-装饰园林
A2030: 建筑装饰-建筑装饰-装饰园林
A2031: 建筑装饰-建筑装饰-装饰园林
A2032: 建筑装饰-建筑装饰-装饰园林
A2033: 建筑装饰-建筑装饰-装饰园林
A2034: 建筑装饰-建筑装饰-装饰园林
A2035: 建筑装饰-建筑装饰-装饰园林
A2036: 建筑装饰-建筑装饰-装饰园林
A2037: 建筑装饰-建筑装饰-装饰园林
A2038: 建筑装饰-建筑装饰-装饰园林
A2039: 建筑装饰-建筑装饰-装饰园林
A2040: 建筑装饰-建筑装饰-装饰园林
A2041: 建筑装饰-建筑装饰-专业工程
A2042: 建筑装饰-建筑装饰-专业工程
A2043: 建筑装饰-建筑装饰-专业工程
A2044: 建筑装饰-建筑装饰-专业工程
A2045: 建筑装饰-建筑装饰-专业工程
A2046: 建筑装饰-建筑装饰-专业工程
A2047: 建筑装饰-建筑装饰-专业工程
A2048: 建筑装饰-建筑装饰-专业工程
A2049: 建筑装饰-建筑装饰-专业工程
A2050: 建筑装饰-建筑装饰-专业工程
A2051: 建筑装饰-建筑装饰-专业工程
A2052: 建筑装饰-建筑装饰-专业工程
A2053: 建筑装饰-建筑装饰-专业工程
A2054: 建筑装饰-建筑装饰-专业工程
A2055: 建筑装饰-建筑装饰-专业工程
A2056: 建筑装饰-建筑装饰-专业工程
A2057: 建筑装饰-建筑装饰-专业工程
A2058: 建筑装饰-建筑装饰-专业工程
A2059: 建筑装饰-建筑装饰-专业工程
A2060: 建筑装饰-建筑装饰-专业工程
A2061: 建筑装饰-建筑装饰-专业工程
A2062: 建筑装饰-建筑装饰-专业工程
A2063: 建筑装饰-建筑装饰-专业工程
A2064: 建筑装饰-建筑装饰-专业工程
A2065: 建筑装饰-建筑装饰-专业工程
A2066: 建筑装饰-建筑装饰-专业工程
A2067: 建筑装饰-建筑装饰-专业工程
A2068: 建筑装饰-建筑装饰-专业工程
A2069: 建筑装饰-建筑装饰-专业工程
A2070: 建筑装饰-建筑装饰-专业工程
A2071: 建筑装饰-建筑装饰-专业工程
A2072: 建筑装饰-建筑装饰-专业工程
A2073: 建筑装饰-建筑装饰-专业工程
A2074: 建筑装饰-建筑装饰-专业工程
A2075: 建筑装饰-建筑装饰-基础建设
A2076: 建筑装饰-建筑装饰-基础建设
A2077: 建筑装饰-建筑装饰-基础建设
A2078: 建筑装饰-建筑装饰-基础建设
A2079: 建筑装饰-建筑装饰-基础建设
A2080: 建筑装饰-建筑装饰-基础建设
A2081: 建筑装饰-建筑装饰-基础建设
A2082: 建筑装饰-建筑装饰-基础建设
A2083: 建筑装饰-建筑装饰-基础建设
A2084: 建筑装饰-建筑装饰-基础建设
A2085: 建筑装饰-建筑装饰-基础建设
A2086: 建筑装饰-建筑装饰-基础建设
A2087: 建筑装饰-建筑装饰-基础建设
A2088: 建筑装饰-建筑装饰-基础建设
A2089: 建筑装饰-建筑装饰-基础建设
A2090: 建筑装饰-建筑装饰-基础建设
A2091: 建筑装饰-建筑装饰-基础建设
A2092: 建筑装饰-建筑装饰-基础建设
A2093: 建筑装饰-建筑装饰-基础建设
A2094: 建筑装饰-建筑装饰-基础建设
A2095: 建筑装饰-建筑装饰-基础建设
A2096: 建筑装饰-建筑装饰-基础建设
A2097: 建筑装饰-建筑装饰-基础建设
A2098: 建筑装饰-建筑装饰-基础建设
A2099: 建筑装饰-建筑装饰-基础建设
A2100: 建筑装饰-建筑装饰-基础建设
A2101: 建筑装饰-建筑装饰-工程咨询服务
A2102: 建筑装饰-建筑装饰-工程咨询服务
A2103: 建筑装饰-建筑装饰-工程咨询服务
A2104: 建筑装饰-建筑装饰-工程咨询服务
A2105: 建筑装饰-建筑装饰-工程咨询服务
A2106: 建筑装饰-建筑装饰-工程咨询服务
A2107: 建筑装饰-建筑装饰-工程咨询服务
A2108: 建筑装饰-建筑装饰-工程咨询服务
A2109: 建筑装饰-建筑装饰-工程咨询服务
A2110: 建筑装饰-建筑装饰-工程咨询服务
A2111: 建筑装饰-建筑装饰-工程咨询服务
A2112: 建筑装饰-建筑装饰-工程咨询服务
A2113: 建筑装饰-建筑装饰-工程咨询服务
A2114: 建筑装饰-建筑装饰-工程咨询服务
A2115: 建筑装饰-建筑装饰-工程咨询服务
A2116: 建筑装饰-建筑装饰-工程咨询服务
A2117: 建筑装饰-建筑装饰-工程咨询服务
A2118: 建筑装饰-建筑装饰-工程咨询服务
A2119: 建筑装饰-建筑装饰-工程咨询服务
A2120: 建筑装饰-建筑装饰-工程咨询服务
A2121: 建筑装饰-建筑装饰-工程咨询服务
A2122: 建筑装饰-建筑装饰-工程咨询服务
A2123: 建筑装饰-建筑装饰-工程咨询服务
A2124: 建筑装饰-建筑装饰-工程咨询服务
A2125: 建筑装饰-建筑装饰-工程咨询服务
A2126: 建筑装饰-建筑装饰-工程咨询服务
A2127: 建筑装饰-建筑装饰-工程咨询服务
A2128: 建筑装饰-建筑装饰-工程咨询服务
A2129: 建筑装饰-建筑装饰-工程咨询服务
A2130: 建筑装饰-建筑装饰-工程咨询服务
A2131: 建筑装饰-建筑装饰-工程咨询服务
A2132: 建筑装饰-建筑装饰-工程咨询服务
A2133: 建筑装饰-建筑装饰-工程咨询服务
A2134: 建筑装饰-建筑装饰-工程咨询服务
A2135: 建筑装饰-建筑装饰-工程咨询服务
A2136: 建筑装饰-建筑装饰-工程咨询服务
A2137: 建筑装饰-建筑装饰-工程咨询服务
A2138: 建筑装饰-建筑装饰-工程咨询服务
A2139: 建筑装饰-建筑装饰-工程咨询服务
A2140: 建筑装饰-建筑装饰-工程咨询服务
A2141: 建筑装饰-建筑装饰-工程咨询服务
A2142: 建筑装饰-建筑装饰-工程咨询服务
A2143: 建筑装饰-建筑装饰-工程咨询服务
A2144: 建筑装饰-建筑装饰-工程咨询服务
A2145: 建筑装饰-建筑装饰-房屋建设
A2146: 建筑装饰-建筑装饰-房屋建设
A2147: 建筑装饰-建筑装饰-房屋建设
A2148: 建筑装饰-建筑装饰-房屋建设
A2149: 建筑装饰-建筑装饰-房屋建设
A2150: 建筑装饰-建筑装饰-房屋建设
A2151: 建筑装饰-建筑装饰-房屋建设
A2152: 建筑装饰-建筑装饰-房屋建设
A2153: 建筑材料-建筑材料-水泥
A2154: 建筑材料-建筑材料-水泥
A2155: 建筑材料-建筑材料-水泥
A2156: 建筑材料-建筑材料-水泥
A2157: 建筑材料-建筑材料-水泥
A2158: 建筑材料-建筑材料-水泥
A2159: 建筑材料-建筑材料-水泥
A2160: 建筑材料-建筑材料-水泥
A2161: 建筑材料-建筑材料-水泥
A2162: 建筑材料-建筑材料-水泥
A2163: 建筑材料-建筑材料-水泥
A2164: 建筑材料-建筑材料-水泥
A2165: 建筑材料-建筑材料-水泥
A2166: 建筑材料-建筑材料-水泥
A2167: 建筑材料-建筑材料-水泥
A2168: 建筑材料-建筑材料-水泥
A2169: 建筑材料-建筑材料-水泥
A2170: 建筑材料-建筑材料-水泥
A2171: 建筑材料-建筑材料-水泥
A2172: 建筑材料-建筑材料-水泥
A2173: 建筑材料-建筑材料-水泥
A2174: 建筑材料-建筑材料-水泥
A2175: 建筑材料-建筑材料-水泥
A2176: 建筑材料-建筑材料-水泥
A2177: 建筑材料-建筑材料-水泥
A2178: 建筑材料-建筑材料-其他建材
A2179: 建筑材料-建筑材料-其他建材
A2180: 建筑材料-建筑材料-其他建材
A2181: 建筑材料-建筑材料-其他建材
A2182: 建筑材料-建筑材料-其他建材
A2183: 建筑材料-建筑材料-其他建材
A2184: 建筑材料-建筑材料-其他建材
A2185: 建筑材料-建筑材料-其他建材
A2186: 建筑材料-建筑材料-其他建材
A2187: 建筑材料-建筑材料-其他建材
A2188: 建筑材料-建筑材料-其他建材
A2189: 建筑材料-建筑材料-其他建材
A2190: 建筑材料-建筑材料-其他建材
A2191: 建筑材料-建筑材料-其他建材
A2192: 建筑材料-建筑材料-其他建材
A2193: 建筑材料-建筑材料-其他建材
A2194: 建筑材料-建筑材料-其他建材
A2195: 建筑材料-建筑材料-其他建材
A2196: 建筑材料-建筑材料-其他建材
A2197: 建筑材料-建筑材料-其他建材
A2198: 建筑材料-建筑材料-其他建材
A2199: 建筑材料-建筑材料-其他建材
A2200: 建筑材料-建筑材料-其他建材
A2201: 建筑材料-建筑材料-其他建材
A2202: 建筑材料-建筑材料-耐火材料
A2203: 建筑材料-建筑材料-耐火材料
A2204: 建筑材料-建筑材料-耐火材料
A2205: 建筑材料-建筑材料-耐火材料
A2206: 建筑材料-建筑材料-耐火材料
A2207: 建筑材料-建筑材料-耐火材料
A2208: 建筑材料-建筑材料-耐火材料
A2209: 建筑材料-建筑材料-管材
A2210: 建筑材料-建筑材料-管材
A2211: 建筑材料-建筑材料-管材
A2212: 建筑材料-建筑材料-管材
A2213: 建筑材料-建筑材料-管材
A2214: 建筑材料-建筑材料-管材
A2215: 建筑材料-建筑材料-管材
A2216: 建筑材料-建筑材料-玻璃玻纤
A2217: 建筑材料-建筑材料-玻璃玻纤
A2218: 建筑材料-建筑材料-玻璃玻纤
A2219: 建筑材料-建筑材料-玻璃玻纤
A2220: 建筑材料-建筑材料-玻璃玻纤
A2221: 建筑材料-建筑材料-玻璃玻纤
A2222: 建筑材料-建筑材料-玻璃玻纤
A2223: 建筑材料-建筑材料-玻璃玻纤
A2224: 建筑材料-建筑材料-玻璃玻纤
A2225: 建筑材料-建筑材料-玻璃玻纤
A2226: 建筑材料-建筑材料-玻璃玻纤
A2227: 建筑材料-建筑材料-玻璃玻纤
A2228: 建筑材料-建筑材料-玻璃玻纤
A2229: 家用电器-小家电-小家电Ⅲ
A2230: 家用电器-小家电-小家电Ⅲ
A2231: 家用电器-小家电-小家电Ⅲ
A2232: 家用电器-小家电-小家电Ⅲ
A2233: 家用电器-小家电-小家电Ⅲ
A2234: 家用电器-小家电-小家电Ⅲ
A2235: 家用电器-小家电-小家电Ⅲ
A2236: 家用电器-小家电-小家电Ⅲ
A2237: 家用电器-小家电-小家电Ⅲ
A2238: 家用电器-小家电-小家电Ⅲ
A2239: 家用电器-小家电-小家电Ⅲ
A2240: 家用电器-小家电-小家电Ⅲ
A2241: 家用电器-小家电-小家电Ⅲ
A2242: 家用电器-小家电-小家电Ⅲ
A2243: 家用电器-小家电-小家电Ⅲ
A2244: 家用电器-小家电-小家电Ⅲ
A2245: 家用电器-小家电-小家电Ⅲ
A2246: 家用电器-小家电-小家电Ⅲ
A2247: 家用电器-小家电-小家电Ⅲ
A2248: 家用电器-小家电-小家电Ⅲ
A2249: 家用电器-小家电-小家电Ⅲ
A2250: 家用电器-小家电-小家电Ⅲ
A2251: 家用电器-小家电-小家电Ⅲ
A2252: 家用电器-小家电-小家电Ⅲ
A2253: 家用电器-小家电-小家电Ⅲ
A2254: 家用电器-小家电-小家电Ⅲ
A2255: 家用电器-黑色家电-其他黑色家电
A2256: 家用电器-黑色家电-其他黑色家电
A2257: 家用电器-黑色家电-其他黑色家电
A2258: 家用电器-黑色家电-其他黑色家电
A2259: 家用电器-黑色家电-其他黑色家电
A2260: 家用电器-黑色家电-其他黑色家电
A2261: 家用电器-黑色家电-彩电
A2262: 家用电器-黑色家电-彩电
A2263: 家用电器-黑色家电-彩电
A2264: 家用电器-黑色家电-彩电
A2265: 家用电器-厨卫电器-厨卫电器Ⅲ
A2266: 家用电器-厨卫电器-厨卫电器Ⅲ
A2267: 家用电器-厨卫电器-厨卫电器Ⅲ
A2268: 家用电器-厨卫电器-厨卫电器Ⅲ
A2269: 家用电器-厨卫电器-厨卫电器Ⅲ
A2270: 家用电器-厨卫电器-厨卫电器Ⅲ
A2271: 家用电器-厨卫电器-厨卫电器Ⅲ
A2272: 家用电器-厨卫电器-厨卫电器Ⅲ
A2273: 家用电器-厨卫电器-厨卫电器Ⅲ
A2274: 家用电器-白色家电-其他白色家电
A2275: 家用电器-白色家电-其他白色家电
A2276: 家用电器-白色家电-其他白色家电
A2277: 家用电器-白色家电-其他白色家电
A2278: 家用电器-白色家电-其他白色家电
A2279: 家用电器-白色家电-其他白色家电
A2280: 家用电器-白色家电-其他白色家电
A2281: 家用电器-白色家电-其他白色家电
A2282: 家用电器-白色家电-其他白色家电
A2283: 家用电器-白色家电-其他白色家电
A2284: 家用电器-白色家电-其他白色家电
A2285: 家用电器-白色家电-其他白色家电
A2286: 家用电器-白色家电-其他白色家电
A2287: 家用电器-白色家电-其他白色家电
A2288: 家用电器-白色家电-其他白色家电
A2289: 家用电器-白色家电-其他白色家电
A2290: 家用电器-白色家电-其他白色家电
A2291: 家用电器-白色家电-其他白色家电
A2292: 家用电器-白色家电-其他白色家电
A2293: 家用电器-白色家电-其他白色家电
A2294: 家用电器-白色家电-其他白色家电
A2295: 家用电器-白色家电-其他白色家电
A2296: 家用电器-白色家电-其他白色家电
A2297: 家用电器-白色家电-其他白色家电
A2298: 家用电器-白色家电-其他白色家电
A2299: 家用电器-白色家电-其他白色家电
A2300: 家用电器-白色家电-其他白色家电
A2301: 家用电器-白色家电-空调
A2302: 家用电器-白色家电-空调
A2303: 家用电器-白色家电-空调
A2304: 家用电器-白色家电-冰洗
A2305: 家用电器-白色家电-冰洗
A2306: 家用电器-白色家电-冰洗
A2307: 家用电器-白色家电-冰洗
A2308: 家用电器-白色家电-冰洗
A2309: 计算机-计算机应用-软件开发
A2310: 计算机-计算机应用-软件开发
A2311: 计算机-计算机应用-软件开发
A2312: 计算机-计算机应用-软件开发
A2313: 计算机-计算机应用-软件开发
A2314: 计算机-计算机应用-软件开发
A2315: 计算机-计算机应用-软件开发
A2316: 计算机-计算机应用-软件开发
A2317: 计算机-计算机应用-软件开发
A2318: 计算机-计算机应用-软件开发
A2319: 计算机-计算机应用-软件开发
A2320: 计算机-计算机应用-软件开发
A2321: 计算机-计算机应用-软件开发
A2322: 计算机-计算机应用-软件开发
A2323: 计算机-计算机应用-软件开发
A2324: 计算机-计算机应用-软件开发
A2325: 计算机-计算机应用-软件开发
A2326: 计算机-计算机应用-软件开发
A2327: 计算机-计算机应用-软件开发
A2328: 计算机-计算机应用-软件开发
A2329: 计算机-计算机应用-软件开发
A2330: 计算机-计算机应用-软件开发
A2331: 计算机-计算机应用-软件开发
A2332: 计算机-计算机应用-软件开发
A2333: 计算机-计算机应用-软件开发
A2334: 计算机-计算机应用-软件开发
A2335: 计算机-计算机应用-软件开发
A2336: 计算机-计算机应用-软件开发
A2337: 计算机-计算机应用-软件开发
A2338: 计算机-计算机应用-软件开发
A2339: 计算机-计算机应用-软件开发
A2340: 计算机-计算机应用-软件开发
A2341: 计算机-计算机应用-软件开发
A2342: 计算机-计算机应用-软件开发
A2343: 计算机-计算机应用-软件开发
A2344: 计算机-计算机应用-软件开发
A2345: 计算机-计算机应用-软件开发
A2346: 计算机-计算机应用-软件开发
A2347: 计算机-计算机应用-软件开发
A2348: 计算机-计算机应用-软件开发
A2349: 计算机-计算机应用-软件开发
A2350: 计算机-计算机应用-软件开发
A2351: 计算机-计算机应用-软件开发
A2352: 计算机-计算机应用-软件开发
A2353: 计算机-计算机应用-软件开发
A2354: 计算机-计算机应用-软件开发
A2355: 计算机-计算机应用-软件开发
A2356: 计算机-计算机应用-软件开发
A2357: 计算机-计算机应用-软件开发
A2358: 计算机-计算机应用-软件开发
A2359: 计算机-计算机应用-软件开发
A2360: 计算机-计算机应用-软件开发
A2361: 计算机-计算机应用-软件开发
A2362: 计算机-计算机应用-软件开发
A2363: 计算机-计算机应用-软件开发
A2364: 计算机-计算机应用-软件开发
A2365: 计算机-计算机应用-软件开发
A2366: 计算机-计算机应用-软件开发
A2367: 计算机-计算机应用-软件开发
A2368: 计算机-计算机应用-软件开发
A2369: 计算机-计算机应用-软件开发
A2370: 计算机-计算机应用-软件开发
A2371: 计算机-计算机应用-软件开发
A2372: 计算机-计算机应用-软件开发
A2373: 计算机-计算机应用-软件开发
A2374: 计算机-计算机应用-软件开发
A2375: 计算机-计算机应用-软件开发
A2376: 计算机-计算机应用-软件开发
A2377: 计算机-计算机应用-软件开发
A2378: 计算机-计算机应用-软件开发
A2379: 计算机-计算机应用-软件开发
A2380: 计算机-计算机应用-软件开发
A2381: 计算机-计算机应用-软件开发
A2382: 计算机-计算机应用-软件开发
A2383: 计算机-计算机应用-软件开发
A2384: 计算机-计算机应用-软件开发
A2385: 计算机-计算机应用-软件开发
A2386: 计算机-计算机应用-软件开发
A2387: 计算机-计算机应用-软件开发
A2388: 计算机-计算机应用-软件开发
A2389: 计算机-计算机应用-软件开发
A2390: 计算机-计算机应用-软件开发
A2391: 计算机-计算机应用-软件开发
A2392: 计算机-计算机应用-软件开发
A2393: 计算机-计算机应用-软件开发
A2394: 计算机-计算机应用-软件开发
A2395: 计算机-计算机应用-软件开发
A2396: 计算机-计算机应用-软件开发
A2397: 计算机-计算机应用-软件开发
A2398: 计算机-计算机应用-软件开发
A2399: 计算机-计算机应用-软件开发
A2400: 计算机-计算机应用-软件开发
A2401: 计算机-计算机应用-软件开发
A2402: 计算机-计算机应用-软件开发
A2403: 计算机-计算机应用-软件开发
A2404: 计算机-计算机应用-软件开发
A2405: 计算机-计算机应用-软件开发
A2406: 计算机-计算机应用-软件开发
A2407: 计算机-计算机应用-软件开发
A2408: 计算机-计算机应用-软件开发
A2409: 计算机-计算机应用-软件开发
A2410: 计算机-计算机应用-软件开发
A2411: 计算机-计算机应用-软件开发
A2412: 计算机-计算机应用-软件开发
A2413: 计算机-计算机应用-软件开发
A2414: 计算机-计算机应用-软件开发
A2415: 计算机-计算机应用-软件开发
A2416: 计算机-计算机应用-软件开发
A2417: 计算机-计算机应用-软件开发
A2418: 计算机-计算机应用-软件开发
A2419: 计算机-计算机应用-软件开发
A2420: 计算机-计算机应用-软件开发
A2421: 计算机-计算机应用-软件开发
A2422: 计算机-计算机应用-软件开发
A2423: 计算机-计算机应用-软件开发
A2424: 计算机-计算机应用-软件开发
A2425: 计算机-计算机应用-软件开发
A2426: 计算机-计算机应用-软件开发
A2427: 计算机-计算机应用-软件开发
A2428: 计算机-计算机应用-软件开发
A2429: 计算机-计算机应用-软件开发
A2430: 计算机-计算机应用-软件开发
A2431: 计算机-计算机应用-软件开发
A2432: 计算机-计算机应用-软件开发
A2433: 计算机-计算机应用-软件开发
A2434: 计算机-计算机应用-软件开发
A2435: 计算机-计算机应用-软件开发
A2436: 计算机-计算机应用-软件开发
A2437: 计算机-计算机应用-软件开发
A2438: 计算机-计算机应用-软件开发
A2439: 计算机-计算机应用-软件开发
A2440: 计算机-计算机应用-软件开发
A2441: 计算机-计算机应用-软件开发
A2442: 计算机-计算机应用-软件开发
A2443: 计算机-计算机应用-软件开发
A2444: 计算机-计算机应用-IT服务
A2445: 计算机-计算机应用-IT服务
A2446: 计算机-计算机应用-IT服务
A2447: 计算机-计算机应用-IT服务
A2448: 计算机-计算机应用-IT服务
A2449: 计算机-计算机应用-IT服务
A2450: 计算机-计算机应用-IT服务
A2451: 计算机-计算机应用-IT服务
A2452: 计算机-计算机应用-IT服务
A2453: 计算机-计算机应用-IT服务
A2454: 计算机-计算机应用-IT服务
A2455: 计算机-计算机应用-IT服务
A2456: 计算机-计算机应用-IT服务
A2457: 计算机-计算机应用-IT服务
A2458: 计算机-计算机应用-IT服务
A2459: 计算机-计算机应用-IT服务
A2460: 计算机-计算机应用-IT服务
A2461: 计算机-计算机应用-IT服务
A2462: 计算机-计算机应用-IT服务
A2463: 计算机-计算机应用-IT服务
A2464: 计算机-计算机应用-IT服务
A2465: 计算机-计算机应用-IT服务
A2466: 计算机-计算机应用-IT服务
A2467: 计算机-计算机应用-IT服务
A2468: 计算机-计算机应用-IT服务
A2469: 计算机-计算机应用-IT服务
A2470: 计算机-计算机应用-IT服务
A2471: 计算机-计算机应用-IT服务
A2472: 计算机-计算机应用-IT服务
A2473: 计算机-计算机应用-IT服务
A2474: 计算机-计算机应用-IT服务
A2475: 计算机-计算机应用-IT服务
A2476: 计算机-计算机应用-IT服务
A2477: 计算机-计算机应用-IT服务
A2478: 计算机-计算机应用-IT服务
A2479: 计算机-计算机应用-IT服务
A2480: 计算机-计算机应用-IT服务
A2481: 计算机-计算机应用-IT服务
A2482: 计算机-计算机应用-IT服务
A2483: 计算机-计算机应用-IT服务
A2484: 计算机-计算机应用-IT服务
A2485: 计算机-计算机应用-IT服务
A2486: 计算机-计算机应用-IT服务
A2487: 计算机-计算机应用-IT服务
A2488: 计算机-计算机应用-IT服务
A2489: 计算机-计算机应用-IT服务
A2490: 计算机-计算机应用-IT服务
A2491: 计算机-计算机应用-IT服务
A2492: 计算机-计算机应用-IT服务
A2493: 计算机-计算机应用-IT服务
A2494: 计算机-计算机应用-IT服务
A2495: 计算机-计算机应用-IT服务
A2496: 计算机-计算机应用-IT服务
A2497: 计算机-计算机应用-IT服务
A2498: 计算机-计算机应用-IT服务
A2499: 计算机-计算机应用-IT服务
A2500: 计算机-计算机应用-IT服务
A2501: 计算机-计算机应用-IT服务
A2502: 计算机-计算机应用-IT服务
A2503: 计算机-计算机应用-IT服务
A2504: 计算机-计算机应用-IT服务
A2505: 计算机-计算机应用-IT服务
A2506: 计算机-计算机应用-IT服务
A2507: 计算机-计算机应用-IT服务
A2508: 计算机-计算机应用-IT服务
A2509: 计算机-计算机应用-IT服务
A2510: 计算机-计算机应用-IT服务
A2511: 计算机-计算机应用-IT服务
A2512: 计算机-计算机应用-IT服务
A2513: 计算机-计算机应用-IT服务
A2514: 计算机-计算机应用-IT服务
A2515: 计算机-计算机应用-IT服务
A2516: 计算机-计算机应用-IT服务
A2517: 计算机-计算机应用-IT服务
A2518: 计算机-计算机应用-IT服务
A2519: 计算机-计算机应用-IT服务
A2520: 计算机-计算机应用-IT服务
A2521: 计算机-计算机应用-IT服务
A2522: 计算机-计算机应用-IT服务
A2523: 计算机-计算机应用-IT服务
A2524: 计算机-计算机应用-IT服务
A2525: 计算机-计算机应用-IT服务
A2526: 计算机-计算机应用-IT服务
A2527: 计算机-计算机应用-IT服务
A2528: 计算机-计算机应用-IT服务
A2529: 计算机-计算机应用-IT服务
A2530: 计算机-计算机应用-IT服务
A2531: 计算机-计算机应用-IT服务
A2532: 计算机-计算机应用-IT服务
A2533: 计算机-计算机应用-IT服务
A2534: 计算机-计算机应用-IT服务
A2535: 计算机-计算机应用-IT服务
A2536: 计算机-计算机应用-IT服务
A2537: 计算机-计算机应用-IT服务
A2538: 计算机-计算机应用-IT服务
A2539: 计算机-计算机应用-IT服务
A2540: 计算机-计算机应用-IT服务
A2541: 计算机-计算机应用-IT服务
A2542: 计算机-计算机应用-IT服务
A2543: 计算机-计算机应用-IT服务
A2544: 计算机-计算机应用-IT服务
A2545: 计算机-计算机应用-IT服务
A2546: 计算机-计算机应用-IT服务
A2547: 计算机-计算机应用-IT服务
A2548: 计算机-计算机应用-IT服务
A2549: 计算机-计算机应用-IT服务
A2550: 计算机-计算机应用-IT服务
A2551: 计算机-计算机应用-IT服务
A2552: 计算机-计算机应用-IT服务
A2553: 计算机-计算机应用-IT服务
A2554: 计算机-计算机应用-IT服务
A2555: 计算机-计算机应用-IT服务
A2556: 计算机-计算机应用-IT服务
A2557: 计算机-计算机应用-IT服务
A2558: 计算机-计算机应用-IT服务
A2559: 计算机-计算机应用-IT服务
A2560: 计算机-计算机应用-IT服务
A2561: 计算机-计算机应用-IT服务
A2562: 计算机-计算机应用-IT服务
A2563: 计算机-计算机应用-IT服务
A2564: 计算机-计算机应用-IT服务
A2565: 计算机-计算机应用-IT服务
A2566: 计算机-计算机设备-计算机设备Ⅲ
A2567: 计算机-计算机设备-计算机设备Ⅲ
A2568: 计算机-计算机设备-计算机设备Ⅲ
A2569: 计算机-计算机设备-计算机设备Ⅲ
A2570: 计算机-计算机设备-计算机设备Ⅲ
A2571: 计算机-计算机设备-计算机设备Ⅲ
A2572: 计算机-计算机设备-计算机设备Ⅲ
A2573: 计算机-计算机设备-计算机设备Ⅲ
A2574: 计算机-计算机设备-计算机设备Ⅲ
A2575: 计算机-计算机设备-计算机设备Ⅲ
A2576: 计算机-计算机设备-计算机设备Ⅲ
A2577: 计算机-计算机设备-计算机设备Ⅲ
A2578: 计算机-计算机设备-计算机设备Ⅲ
A2579: 计算机-计算机设备-计算机设备Ⅲ
A2580: 计算机-计算机设备-计算机设备Ⅲ
A2581: 计算机-计算机设备-计算机设备Ⅲ
A2582: 计算机-计算机设备-计算机设备Ⅲ
A2583: 计算机-计算机设备-计算机设备Ⅲ
A2584: 计算机-计算机设备-计算机设备Ⅲ
A2585: 计算机-计算机设备-计算机设备Ⅲ
A2586: 计算机-计算机设备-计算机设备Ⅲ
A2587: 计算机-计算机设备-计算机设备Ⅲ
A2588: 计算机-计算机设备-计算机设备Ⅲ
A2589: 计算机-计算机设备-计算机设备Ⅲ
A2590: 计算机-计算机设备-计算机设备Ⅲ
A2591: 计算机-计算机设备-计算机设备Ⅲ
A2592: 计算机-计算机设备-计算机设备Ⅲ
A2593: 计算机-计算机设备-计算机设备Ⅲ
A2594: 计算机-计算机设备-计算机设备Ⅲ
A2595: 计算机-计算机设备-计算机设备Ⅲ
A2596: 计算机-计算机设备-计算机设备Ⅲ
A2597: 计算机-计算机设备-计算机设备Ⅲ
A2598: 计算机-计算机设备-计算机设备Ⅲ
A2599: 计算机-计算机设备-计算机设备Ⅲ
A2600: 计算机-计算机设备-计算机设备Ⅲ
A2601: 计算机-计算机设备-计算机设备Ⅲ
A2602: 计算机-计算机设备-计算机设备Ⅲ
A2603: 计算机-计算机设备-计算机设备Ⅲ
A2604: 计算机-计算机设备-计算机设备Ⅲ
A2605: 计算机-计算机设备-计算机设备Ⅲ
A2606: 计算机-计算机设备-计算机设备Ⅲ
A2607: 计算机-计算机设备-计算机设备Ⅲ
A2608: 计算机-计算机设备-计算机设备Ⅲ
A2609: 计算机-计算机设备-计算机设备Ⅲ
A2610: 计算机-计算机设备-计算机设备Ⅲ
A2611: 计算机-计算机设备-计算机设备Ⅲ
A2612: 计算机-计算机设备-计算机设备Ⅲ
A2613: 计算机-计算机设备-计算机设备Ⅲ
A2614: 计算机-计算机设备-计算机设备Ⅲ
A2615: 计算机-计算机设备-计算机设备Ⅲ
A2616: 计算机-计算机设备-计算机设备Ⅲ
A2617: 计算机-计算机设备-计算机设备Ⅲ
A2618: 计算机-计算机设备-计算机设备Ⅲ
A2619: 计算机-计算机设备-计算机设备Ⅲ
A2620: 计算机-计算机设备-计算机设备Ⅲ
A2621: 计算机-计算机设备-计算机设备Ⅲ
A2622: 计算机-计算机设备-计算机设备Ⅲ
A2623: 计算机-计算机设备-计算机设备Ⅲ
A2624: 计算机-计算机设备-计算机设备Ⅲ
A2625: 计算机-计算机设备-计算机设备Ⅲ
A2626: 计算机-计算机设备-计算机设备Ⅲ
A2627: 计算机-计算机设备-计算机设备Ⅲ
A2628: 计算机-计算机设备-计算机设备Ⅲ
A2629: 计算机-计算机设备-计算机设备Ⅲ
A2630: 计算机-计算机设备-计算机设备Ⅲ
A2631: 计算机-计算机设备-计算机设备Ⅲ
A2632: 计算机-计算机设备-计算机设备Ⅲ
A2633: 计算机-计算机设备-计算机设备Ⅲ
A2634: 计算机-计算机设备-计算机设备Ⅲ
A2635: 计算机-计算机设备-计算机设备Ⅲ
A2636: 计算机-计算机设备-计算机设备Ⅲ
A2637: 计算机-计算机设备-计算机设备Ⅲ
A2638: 计算机-计算机设备-计算机设备Ⅲ
A2639: 计算机-计算机设备-计算机设备Ⅲ
A2640: 计算机-计算机设备-计算机设备Ⅲ
A2641: 计算机-计算机设备-计算机设备Ⅲ
A2642: 计算机-计算机设备-计算机设备Ⅲ
A2643: 计算机-计算机设备-计算机设备Ⅲ
A2644: 计算机-计算机设备-计算机设备Ⅲ
A2645: 计算机-计算机设备-计算机设备Ⅲ
A2646: 基础化工-化学制品-有机硅
A2647: 基础化工-化学制品-有机硅
A2648: 基础化工-化学制品-有机硅
A2649: 基础化工-化学制品-有机硅
A2650: 基础化工-化学制品-有机硅
A2651: 基础化工-化学制品-有机硅
A2652: 基础化工-化学制品-有机硅
A2653: 基础化工-化学制品-有机硅
A2654: 基础化工-化学制品-有机硅
A2655: 基础化工-化学制品-有机硅
A2656: 基础化工-化学制品-有机硅
A2657: 基础化工-化学制品-有机硅
A2658: 基础化工-化学制品-涂料油墨
A2659: 基础化工-化学制品-涂料油墨
A2660: 基础化工-化学制品-涂料油墨
A2661: 基础化工-化学制品-涂料油墨
A2662: 基础化工-化学制品-涂料油墨
A2663: 基础化工-化学制品-涂料油墨
A2664: 基础化工-化学制品-涂料油墨
A2665: 基础化工-化学制品-涂料油墨
A2666: 基础化工-化学制品-涂料油墨
A2667: 基础化工-化学制品-涂料油墨
A2668: 基础化工-化学制品-涂料油墨
A2669: 基础化工-化学制品-涂料油墨
A2670: 基础化工-化学制品-涂料油墨
A2671: 基础化工-化学制品-涂料油墨
A2672: 基础化工-化学制品-食品及饲料添加剂
A2673: 基础化工-化学制品-食品及饲料添加剂
A2674: 基础化工-化学制品-食品及饲料添加剂
A2675: 基础化工-化学制品-食品及饲料添加剂
A2676: 基础化工-化学制品-食品及饲料添加剂
A2677: 基础化工-化学制品-食品及饲料添加剂
A2678: 基础化工-化学制品-食品及饲料添加剂
A2679: 基础化工-化学制品-食品及饲料添加剂
A2680: 基础化工-化学制品-食品及饲料添加剂
A2681: 基础化工-化学制品-食品及饲料添加剂
A2682: 基础化工-化学制品-食品及饲料添加剂
A2683: 基础化工-化学制品-食品及饲料添加剂
A2684: 基础化工-化学制品-食品及饲料添加剂
A2685: 基础化工-化学制品-食品及饲料添加剂
A2686: 基础化工-化学制品-食品及饲料添加剂
A2687: 基础化工-化学制品-食品及饲料添加剂
A2688: 基础化工-化学制品-食品及饲料添加剂
A2689: 基础化工-化学制品-食品及饲料添加剂
A2690: 基础化工-化学制品-食品及饲料添加剂
A2691: 基础化工-化学制品-食品及饲料添加剂
A2692: 基础化工-化学制品-食品及饲料添加剂
A2693: 基础化工-化学制品-其他化学制品
A2694: 基础化工-化学制品-其他化学制品
A2695: 基础化工-化学制品-其他化学制品
A2696: 基础化工-化学制品-其他化学制品
A2697: 基础化工-化学制品-其他化学制品
A2698: 基础化工-化学制品-其他化学制品
A2699: 基础化工-化学制品-其他化学制品
A2700: 基础化工-化学制品-其他化学制品
A2701: 基础化工-化学制品-其他化学制品
A2702: 基础化工-化学制品-其他化学制品
A2703: 基础化工-化学制品-其他化学制品
A2704: 基础化工-化学制品-其他化学制品
A2705: 基础化工-化学制品-其他化学制品
A2706: 基础化工-化学制品-其他化学制品
A2707: 基础化工-化学制品-其他化学制品
A2708: 基础化工-化学制品-其他化学制品
A2709: 基础化工-化学制品-其他化学制品
A2710: 基础化工-化学制品-其他化学制品
A2711: 基础化工-化学制品-其他化学制品
A2712: 基础化工-化学制品-其他化学制品
A2713: 基础化工-化学制品-其他化学制品
A2714: 基础化工-化学制品-其他化学制品
A2715: 基础化工-化学制品-其他化学制品
A2716: 基础化工-化学制品-其他化学制品
A2717: 基础化工-化学制品-其他化学制品
A2718: 基础化工-化学制品-其他化学制品
A2719: 基础化工-化学制品-其他化学制品
A2720: 基础化工-化学制品-其他化学制品
A2721: 基础化工-化学制品-其他化学制品
A2722: 基础化工-化学制品-其他化学制品
A2723: 基础化工-化学制品-其他化学制品
A2724: 基础化工-化学制品-其他化学制品
A2725: 基础化工-化学制品-其他化学制品
A2726: 基础化工-化学制品-其他化学制品
A2727: 基础化工-化学制品-其他化学制品
A2728: 基础化工-化学制品-其他化学制品
A2729: 基础化工-化学制品-其他化学制品
A2730: 基础化工-化学制品-其他化学制品
A2731: 基础化工-化学制品-其他化学制品
A2732: 基础化工-化学制品-其他化学制品
A2733: 基础化工-化学制品-其他化学制品
A2734: 基础化工-化学制品-其他化学制品
A2735: 基础化工-化学制品-其他化学制品
A2736: 基础化工-化学制品-其他化学制品
A2737: 基础化工-化学制品-其他化学制品
A2738: 基础化工-化学制品-其他化学制品
A2739: 基础化工-化学制品-其他化学制品
A2740: 基础化工-化学制品-其他化学制品
A2741: 基础化工-化学制品-其他化学制品
A2742: 基础化工-化学制品-其他化学制品
A2743: 基础化工-化学制品-其他化学制品
A2744: 基础化工-化学制品-其他化学制品
A2745: 基础化工-化学制品-其他化学制品
A2746: 基础化工-化学制品-其他化学制品
A2747: 基础化工-化学制品-其他化学制品
A2748: 基础化工-化学制品-其他化学制品
A2749: 基础化工-化学制品-其他化学制品
A2750: 基础化工-化学制品-其他化学制品
A2751: 基础化工-化学制品-其他化学制品
A2752: 基础化工-化学制品-其他化学制品
A2753: 基础化工-化学制品-其他化学制品
A2754: 基础化工-化学制品-其他化学制品
A2755: 基础化工-化学制品-其他化学制品
A2756: 基础化工-化学制品-其他化学制品
A2757: 基础化工-化学制品-其他化学制品
A2758: 基础化工-化学制品-其他化学制品
A2759: 基础化工-化学制品-其他化学制品
A2760: 基础化工-化学制品-其他化学制品
A2761: 基础化工-化学制品-其他化学制品
A2762: 基础化工-化学制品-其他化学制品
A2763: 基础化工-化学制品-其他化学制品
A2764: 基础化工-化学制品-其他化学制品
A2765: 基础化工-化学制品-其他化学制品
A2766: 基础化工-化学制品-农药
A2767: 基础化工-化学制品-农药
A2768: 基础化工-化学制品-农药
A2769: 基础化工-化学制品-农药
A2770: 基础化工-化学制品-农药
A2771: 基础化工-化学制品-农药
A2772: 基础化工-化学制品-农药
A2773: 基础化工-化学制品-农药
A2774: 基础化工-化学制品-农药
A2775: 基础化工-化学制品-农药
A2776: 基础化工-化学制品-农药
A2777: 基础化工-化学制品-农药
A2778: 基础化工-化学制品-农药
A2779: 基础化工-化学制品-农药
A2780: 基础化工-化学制品-农药
A2781: 基础化工-化学制品-农药
A2782: 基础化工-化学制品-农药
A2783: 基础化工-化学制品-农药
A2784: 基础化工-化学制品-农药
A2785: 基础化工-化学制品-农药
A2786: 基础化工-化学制品-农药
A2787: 基础化工-化学制品-农药
A2788: 基础化工-化学制品-农药
A2789: 基础化工-化学制品-农药
A2790: 基础化工-化学制品-农药
A2791: 基础化工-化学制品-农药
A2792: 基础化工-化学制品-农药
A2793: 基础化工-化学制品-农药
A2794: 基础化工-化学制品-农药
A2795: 基础化工-化学制品-农药
A2796: 基础化工-化学制品-农药
A2797: 基础化工-化学制品-民爆用品
A2798: 基础化工-化学制品-民爆用品
A2799: 基础化工-化学制品-民爆用品
A2800: 基础化工-化学制品-民爆用品
A2801: 基础化工-化学制品-民爆用品
A2802: 基础化工-化学制品-民爆用品
A2803: 基础化工-化学制品-民爆用品
A2804: 基础化工-化学制品-民爆用品
A2805: 基础化工-化学制品-民爆用品
A2806: 基础化工-化学制品-民爆用品
A2807: 基础化工-化学制品-民爆用品
A2808: 基础化工-化学制品-磷肥及磷化工
A2809: 基础化工-化学制品-磷肥及磷化工
A2810: 基础化工-化学制品-磷肥及磷化工
A2811: 基础化工-化学制品-磷肥及磷化工
A2812: 基础化工-化学制品-磷肥及磷化工
A2813: 基础化工-化学制品-磷肥及磷化工
A2814: 基础化工-化学制品-磷肥及磷化工
A2815: 基础化工-化学制品-磷肥及磷化工
A2816: 基础化工-化学制品-磷肥及磷化工
A2817: 基础化工-化学制品-磷肥及磷化工
A2818: 基础化工-化学制品-聚氨酯
A2819: 基础化工-化学制品-聚氨酯
A2820: 基础化工-化学制品-聚氨酯
A2821: 基础化工-化学制品-聚氨酯
A2822: 基础化工-化学制品-聚氨酯
A2823: 基础化工-化学制品-聚氨酯
A2824: 基础化工-化学制品-聚氨酯
A2825: 基础化工-化学制品-聚氨酯
A2826: 基础化工-化学制品-聚氨酯
A2827: 基础化工-化学制品-聚氨酯
A2828: 基础化工-化学制品-聚氨酯
A2829: 基础化工-化学制品-钾肥
A2830: 基础化工-化学制品-钾肥
A2831: 基础化工-化学制品-钾肥
A2832: 基础化工-化学制品-钾肥
A2833: 基础化工-化学制品-复合肥
A2834: 基础化工-化学制品-复合肥
A2835: 基础化工-化学制品-复合肥
A2836: 基础化工-化学制品-复合肥
A2837: 基础化工-化学制品-复合肥
A2838: 基础化工-化学制品-复合肥
A2839: 基础化工-化学制品-复合肥
A2840: 基础化工-化学制品-复合肥
A2841: 基础化工-化学制品-氟化工
A2842: 基础化工-化学制品-氟化工
A2843: 基础化工-化学制品-氟化工
A2844: 基础化工-化学制品-氟化工
A2845: 基础化工-化学制品-氟化工
A2846: 基础化工-化学制品-氟化工
A2847: 基础化工-化学制品-氟化工
A2848: 基础化工-化学制品-氟化工
A2849: 基础化工-化学制品-氟化工
A2850: 基础化工-化学制品-纺织化学用品
A2851: 基础化工-化学制品-纺织化学用品
A2852: 基础化工-化学制品-纺织化学用品
A2853: 基础化工-化学制品-纺织化学用品
A2854: 基础化工-化学制品-纺织化学用品
A2855: 基础化工-化学制品-纺织化学用品
A2856: 基础化工-化学制品-纺织化学用品
A2857: 基础化工-化学制品-纺织化学用品
A2858: 基础化工-化学制品-纺织化学用品
A2859: 基础化工-化学制品-纺织化学用品
A2860: 基础化工-化学制品-纺织化学用品
A2861: 基础化工-化学制品-纺织化学用品
A2862: 基础化工-化学制品-纺织化学用品
A2863: 基础化工-化学制品-氮肥
A2864: 基础化工-化学制品-氮肥
A2865: 基础化工-化学制品-氮肥
A2866: 基础化工-化学制品-氮肥
A2867: 基础化工-化学制品-氮肥
A2868: 基础化工-化学原料-无机盐
A2869: 基础化工-化学原料-无机盐
A2870: 基础化工-化学原料-无机盐
A2871: 基础化工-化学原料-无机盐
A2872: 基础化工-化学原料-无机盐
A2873: 基础化工-化学原料-无机盐
A2874: 基础化工-化学原料-无机盐
A2875: 基础化工-化学原料-无机盐
A2876: 基础化工-化学原料-无机盐
A2877: 基础化工-化学原料-无机盐
A2878: 基础化工-化学原料-钛白粉
A2879: 基础化工-化学原料-钛白粉
A2880: 基础化工-化学原料-钛白粉
A2881: 基础化工-化学原料-钛白粉
A2882: 基础化工-化学原料-钛白粉
A2883: 基础化工-化学原料-其他化学原料
A2884: 基础化工-化学原料-其他化学原料
A2885: 基础化工-化学原料-其他化学原料
A2886: 基础化工-化学原料-其他化学原料
A2887: 基础化工-化学原料-其他化学原料
A2888: 基础化工-化学原料-其他化学原料
A2889: 基础化工-化学原料-其他化学原料
A2890: 基础化工-化学原料-其他化学原料
A2891: 基础化工-化学原料-其他化学原料
A2892: 基础化工-化学原料-其他化学原料
A2893: 基础化工-化学原料-其他化学原料
A2894: 基础化工-化学原料-其他化学原料
A2895: 基础化工-化学原料-其他化学原料
A2896: 基础化工-化学原料-其他化学原料
A2897: 基础化工-化学原料-其他化学原料
A2898: 基础化工-化学原料-其他化学原料
A2899: 基础化工-化学原料-其他化学原料
A2900: 基础化工-化学原料-其他化学原料
A2901: 基础化工-化学原料-其他化学原料
A2902: 基础化工-化学原料-其他化学原料
A2903: 基础化工-化学原料-其他化学原料
A2904: 基础化工-化学原料-其他化学原料
A2905: 基础化工-化学原料-其他化学原料
A2906: 基础化工-化学原料-氯碱
A2907: 基础化工-化学原料-氯碱
A2908: 基础化工-化学原料-氯碱
A2909: 基础化工-化学原料-氯碱
A2910: 基础化工-化学原料-氯碱
A2911: 基础化工-化学原料-氯碱
A2912: 基础化工-化学原料-氯碱
A2913: 基础化工-化学原料-氯碱
A2914: 基础化工-化学原料-氯碱
A2915: 基础化工-化学原料-氯碱
A2916: 基础化工-化学原料-氯碱
A2917: 基础化工-化学原料-氯碱
A2918: 基础化工-化学原料-氯碱
A2919: 基础化工-化学原料-氯碱
A2920: 基础化工-化学原料-氯碱
A2921: 基础化工-化学原料-氯碱
A2922: 基础化工-化学原料-纯碱
A2923: 基础化工-化学原料-纯碱
A2924: 基础化工-化学原料-纯碱
A2925: 基础化工-化学原料-纯碱
A2926: 基础化工-化工合成材料-粘胶
A2927: 基础化工-化工合成材料-粘胶
A2928: 基础化工-化工合成材料-炭黑
A2929: 基础化工-化工合成材料-炭黑
A2930: 基础化工-化工合成材料-炭黑
A2931: 基础化工-化工合成材料-炭黑
A2932: 基础化工-化工合成材料-炭黑
A2933: 基础化工-化工合成材料-炭黑
A2934: 基础化工-化工合成材料-其他橡胶制品
A2935: 基础化工-化工合成材料-其他橡胶制品
A2936: 基础化工-化工合成材料-其他橡胶制品
A2937: 基础化工-化工合成材料-其他橡胶制品
A2938: 基础化工-化工合成材料-其他橡胶制品
A2939: 基础化工-化工合成材料-其他橡胶制品
A2940: 基础化工-化工合成材料-其他橡胶制品
A2941: 基础化工-化工合成材料-其他橡胶制品
A2942: 基础化工-化工合成材料-其他橡胶制品
A2943: 基础化工-化工合成材料-其他橡胶制品
A2944: 基础化工-化工合成材料-其他橡胶制品
A2945: 基础化工-化工合成材料-其他橡胶制品
A2946: 基础化工-化工合成材料-其他橡胶制品
A2947: 基础化工-化工合成材料-其他纤维
A2948: 基础化工-化工合成材料-其他纤维
A2949: 基础化工-化工合成材料-其他纤维
A2950: 基础化工-化工合成材料-其他纤维
A2951: 基础化工-化工合成材料-其他纤维
A2952: 基础化工-化工合成材料-其他纤维
A2953: 基础化工-化工合成材料-其他纤维
A2954: 基础化工-化工合成材料-其他纤维
A2955: 基础化工-化工合成材料-其他塑料制品
A2956: 基础化工-化工合成材料-其他塑料制品
A2957: 基础化工-化工合成材料-其他塑料制品
A2958: 基础化工-化工合成材料-其他塑料制品
A2959: 基础化工-化工合成材料-其他塑料制品
A2960: 基础化工-化工合成材料-其他塑料制品
A2961: 基础化工-化工合成材料-其他塑料制品
A2962: 基础化工-化工合成材料-其他塑料制品
A2963: 基础化工-化工合成材料-其他塑料制品
A2964: 基础化工-化工合成材料-其他塑料制品
A2965: 基础化工-化工合成材料-其他塑料制品
A2966: 基础化工-化工合成材料-其他塑料制品
A2967: 基础化工-化工合成材料-其他塑料制品
A2968: 基础化工-化工合成材料-其他塑料制品
A2969: 基础化工-化工合成材料-其他塑料制品
A2970: 基础化工-化工合成材料-其他塑料制品
A2971: 基础化工-化工合成材料-其他塑料制品
A2972: 基础化工-化工合成材料-其他塑料制品
A2973: 基础化工-化工合成材料-其他塑料制品
A2974: 基础化工-化工合成材料-膜材料
A2975: 基础化工-化工合成材料-膜材料
A2976: 基础化工-化工合成材料-膜材料
A2977: 基础化工-化工合成材料-膜材料
A2978: 基础化工-化工合成材料-膜材料
A2979: 基础化工-化工合成材料-膜材料
A2980: 基础化工-化工合成材料-膜材料
A2981: 基础化工-化工合成材料-膜材料
A2982: 基础化工-化工合成材料-膜材料
A2983: 基础化工-化工合成材料-膜材料
A2984: 基础化工-化工合成材料-膜材料
A2985: 基础化工-化工合成材料-膜材料
A2986: 基础化工-化工合成材料-膜材料
A2987: 基础化工-化工合成材料-膜材料
A2988: 基础化工-化工合成材料-膜材料
A2989: 基础化工-化工合成材料-膜材料
A2990: 基础化工-化工合成材料-膜材料
A2991: 基础化工-化工合成材料-膜材料
A2992: 基础化工-化工合成材料-合成树脂
A2993: 基础化工-化工合成材料-合成树脂
A2994: 基础化工-化工合成材料-合成树脂
A2995: 基础化工-化工合成材料-合成树脂
A2996: 基础化工-化工合成材料-合成树脂
A2997: 基础化工-化工合成材料-合成树脂
A2998: 基础化工-化工合成材料-合成树脂
A2999: 基础化工-化工合成材料-合成树脂
A3000: 基础化工-化工合成材料-合成树脂
A3001: 基础化工-化工合成材料-合成树脂
A3002: 基础化工-化工合成材料-合成树脂
A3003: 基础化工-化工合成材料-改性塑料
A3004: 基础化工-化工合成材料-改性塑料
A3005: 基础化工-化工合成材料-改性塑料
A3006: 基础化工-化工合成材料-改性塑料
A3007: 基础化工-化工合成材料-改性塑料
A3008: 基础化工-化工合成材料-改性塑料
A3009: 基础化工-化工合成材料-改性塑料
A3010: 基础化工-化工合成材料-改性塑料
A3011: 基础化工-化工合成材料-改性塑料
A3012: 基础化工-化工合成材料-改性塑料
A3013: 基础化工-化工合成材料-改性塑料
A3014: 基础化工-化工合成材料-改性塑料
A3015: 基础化工-化工合成材料-改性塑料
A3016: 基础化工-化工合成材料-改性塑料
A3017: 基础化工-化工合成材料-改性塑料
A3018: 基础化工-化工合成材料-改性塑料
A3019: 基础化工-化工合成材料-改性塑料
A3020: 基础化工-化工合成材料-改性塑料
A3021: 基础化工-化工合成材料-涤纶
A3022: 基础化工-化工合成材料-涤纶
A3023: 基础化工-化工合成材料-涤纶
A3024: 基础化工-化工合成材料-涤纶
A3025: 基础化工-化工合成材料-涤纶
A3026: 基础化工-化工合成材料-涤纶
A3027: 基础化工-化工合成材料-涤纶
A3028: 基础化工-化工合成材料-涤纶
A3029: 基础化工-化工合成材料-涤纶
A3030: 基础化工-化工合成材料-涤纶
A3031: 基础化工-化工合成材料-氨纶
A3032: 基础化工-化工合成材料-氨纶
A3033: 基础化工-化工合成材料-氨纶
A3034: 基础化工-非金属材料-非金属材料Ⅲ
A3035: 基础化工-非金属材料-非金属材料Ⅲ
A3036: 基础化工-非金属材料-非金属材料Ⅲ
A3037: 基础化工-非金属材料-非金属材料Ⅲ
A3038: 基础化工-非金属材料-非金属材料Ⅲ
A3039: 基础化工-非金属材料-非金属材料Ⅲ
A3040: 基础化工-非金属材料-非金属材料Ⅲ
A3041: 基础化工-非金属材料-非金属材料Ⅲ
A3042: 基础化工-非金属材料-非金属材料Ⅲ
A3043: 基础化工-非金属材料-非金属材料Ⅲ
A3044: 基础化工-非金属材料-非金属材料Ⅲ
A3045: 基础化工-非金属材料-非金属材料Ⅲ
A3046: 机械设备-自动化设备-其他自动化设备
A3047: 机械设备-自动化设备-其他自动化设备
A3048: 机械设备-自动化设备-其他自动化设备
A3049: 机械设备-自动化设备-其他自动化设备
A3050: 机械设备-自动化设备-其他自动化设备
A3051: 机械设备-自动化设备-其他自动化设备
A3052: 机械设备-自动化设备-其他自动化设备
A3053: 机械设备-自动化设备-其他自动化设备
A3054: 机械设备-自动化设备-其他自动化设备
A3055: 机械设备-自动化设备-其他自动化设备
A3056: 机械设备-自动化设备-其他自动化设备
A3057: 机械设备-自动化设备-其他自动化设备
A3058: 机械设备-自动化设备-其他自动化设备
A3059: 机械设备-自动化设备-其他自动化设备
A3060: 机械设备-自动化设备-其他自动化设备
A3061: 机械设备-自动化设备-其他自动化设备
A3062: 机械设备-自动化设备-其他自动化设备
A3063: 机械设备-自动化设备-其他自动化设备
A3064: 机械设备-自动化设备-其他自动化设备
A3065: 机械设备-自动化设备-其他自动化设备
A3066: 机械设备-自动化设备-其他自动化设备
A3067: 机械设备-自动化设备-其他自动化设备
A3068: 机械设备-自动化设备-其他自动化设备
A3069: 机械设备-自动化设备-其他自动化设备
A3070: 机械设备-自动化设备-其他自动化设备
A3071: 机械设备-自动化设备-激光设备
A3072: 机械设备-自动化设备-激光设备
A3073: 机械设备-自动化设备-激光设备
A3074: 机械设备-自动化设备-激光设备
A3075: 机械设备-自动化设备-激光设备
A3076: 机械设备-自动化设备-激光设备
A3077: 机械设备-自动化设备-激光设备
A3078: 机械设备-自动化设备-激光设备
A3079: 机械设备-自动化设备-激光设备
A3080: 机械设备-自动化设备-激光设备
A3081: 机械设备-自动化设备-激光设备
A3082: 机械设备-自动化设备-激光设备
A3083: 机械设备-自动化设备-机器人
A3084: 机械设备-自动化设备-机器人
A3085: 机械设备-自动化设备-机器人
A3086: 机械设备-自动化设备-机器人
A3087: 机械设备-自动化设备-机器人
A3088: 机械设备-自动化设备-机器人
A3089: 机械设备-自动化设备-机器人
A3090: 机械设备-自动化设备-机器人
A3091: 机械设备-自动化设备-机器人
A3092: 机械设备-自动化设备-机器人
A3093: 机械设备-自动化设备-机器人
A3094: 机械设备-自动化设备-机器人
A3095: 机械设备-自动化设备-机器人
A3096: 机械设备-自动化设备-机器人
A3097: 机械设备-自动化设备-机器人
A3098: 机械设备-自动化设备-机器人
A3099: 机械设备-自动化设备-机器人
A3100: 机械设备-自动化设备-机器人
A3101: 机械设备-自动化设备-机器人
A3102: 机械设备-自动化设备-机器人
A3103: 机械设备-自动化设备-机器人
A3104: 机械设备-自动化设备-机器人
A3105: 机械设备-自动化设备-工控设备
A3106: 机械设备-自动化设备-工控设备
A3107: 机械设备-自动化设备-工控设备
A3108: 机械设备-自动化设备-工控设备
A3109: 机械设备-自动化设备-工控设备
A3110: 机械设备-自动化设备-工控设备
A3111: 机械设备-自动化设备-工控设备
A3112: 机械设备-自动化设备-工控设备
A3113: 机械设备-自动化设备-工控设备
A3114: 机械设备-自动化设备-工控设备
A3115: 机械设备-自动化设备-工控设备
A3116: 机械设备-自动化设备-工控设备
A3117: 机械设备-自动化设备-工控设备
A3118: 机械设备-自动化设备-工控设备
A3119: 机械设备-自动化设备-工控设备
A3120: 机械设备-自动化设备-工控设备
A3121: 机械设备-自动化设备-工控设备
A3122: 机械设备-自动化设备-工控设备
A3123: 机械设备-自动化设备-工控设备
A3124: 机械设备-自动化设备-工控设备
A3125: 机械设备-自动化设备-工控设备
A3126: 机械设备-自动化设备-工控设备
A3127: 机械设备-自动化设备-工控设备
A3128: 机械设备-自动化设备-工控设备
A3129: 机械设备-自动化设备-工控设备
A3130: 机械设备-自动化设备-工控设备
A3131: 机械设备-自动化设备-工控设备
A3132: 机械设备-自动化设备-工控设备
A3133: 机械设备-自动化设备-工控设备
A3134: 机械设备-自动化设备-工控设备
A3135: 机械设备-自动化设备-工控设备
A3136: 机械设备-自动化设备-工控设备
A3137: 机械设备-专用设备-印刷包装机械
A3138: 机械设备-专用设备-印刷包装机械
A3139: 机械设备-专用设备-印刷包装机械
A3140: 机械设备-专用设备-印刷包装机械
A3141: 机械设备-专用设备-印刷包装机械
A3142: 机械设备-专用设备-印刷包装机械
A3143: 机械设备-专用设备-印刷包装机械
A3144: 机械设备-专用设备-印刷包装机械
A3145: 机械设备-专用设备-印刷包装机械
A3146: 机械设备-专用设备-印刷包装机械
A3147: 机械设备-专用设备-印刷包装机械
A3148: 机械设备-专用设备-印刷包装机械
A3149: 机械设备-专用设备-其他专用设备
A3150: 机械设备-专用设备-其他专用设备
A3151: 机械设备-专用设备-其他专用设备
A3152: 机械设备-专用设备-其他专用设备
A3153: 机械设备-专用设备-其他专用设备
A3154: 机械设备-专用设备-其他专用设备
A3155: 机械设备-专用设备-其他专用设备
A3156: 机械设备-专用设备-其他专用设备
A3157: 机械设备-专用设备-其他专用设备
A3158: 机械设备-专用设备-其他专用设备
A3159: 机械设备-专用设备-其他专用设备
A3160: 机械设备-专用设备-其他专用设备
A3161: 机械设备-专用设备-其他专用设备
A3162: 机械设备-专用设备-其他专用设备
A3163: 机械设备-专用设备-其他专用设备
A3164: 机械设备-专用设备-其他专用设备
A3165: 机械设备-专用设备-其他专用设备
A3166: 机械设备-专用设备-其他专用设备
A3167: 机械设备-专用设备-其他专用设备
A3168: 机械设备-专用设备-其他专用设备
A3169: 机械设备-专用设备-其他专用设备
A3170: 机械设备-专用设备-其他专用设备
A3171: 机械设备-专用设备-其他专用设备
A3172: 机械设备-专用设备-其他专用设备
A3173: 机械设备-专用设备-其他专用设备
A3174: 机械设备-专用设备-其他专用设备
A3175: 机械设备-专用设备-其他专用设备
A3176: 机械设备-专用设备-其他专用设备
A3177: 机械设备-专用设备-其他专用设备
A3178: 机械设备-专用设备-其他专用设备
A3179: 机械设备-专用设备-其他专用设备
A3180: 机械设备-专用设备-其他专用设备
A3181: 机械设备-专用设备-其他专用设备
A3182: 机械设备-专用设备-其他专用设备
A3183: 机械设备-专用设备-其他专用设备
A3184: 机械设备-专用设备-其他专用设备
A3185: 机械设备-专用设备-其他专用设备
A3186: 机械设备-专用设备-其他专用设备
A3187: 机械设备-专用设备-其他专用设备
A3188: 机械设备-专用设备-其他专用设备
A3189: 机械设备-专用设备-其他专用设备
A3190: 机械设备-专用设备-其他专用设备
A3191: 机械设备-专用设备-其他专用设备
A3192: 机械设备-专用设备-其他专用设备
A3193: 机械设备-专用设备-其他专用设备
A3194: 机械设备-专用设备-其他专用设备
A3195: 机械设备-专用设备-其他专用设备
A3196: 机械设备-专用设备-其他专用设备
A3197: 机械设备-专用设备-其他专用设备
A3198: 机械设备-专用设备-其他专用设备
A3199: 机械设备-专用设备-其他专用设备
A3200: 机械设备-专用设备-其他专用设备
A3201: 机械设备-专用设备-其他专用设备
A3202: 机械设备-专用设备-其他专用设备
A3203: 机械设备-专用设备-其他专用设备
A3204: 机械设备-专用设备-其他专用设备
A3205: 机械设备-专用设备-其他专用设备
A3206: 机械设备-专用设备-其他专用设备
A3207: 机械设备-专用设备-其他专用设备
A3208: 机械设备-专用设备-其他专用设备
A3209: 机械设备-专用设备-其他专用设备
A3210: 机械设备-专用设备-其他专用设备
A3211: 机械设备-专用设备-其他专用设备
A3212: 机械设备-专用设备-其他专用设备
A3213: 机械设备-专用设备-其他专用设备
A3214: 机械设备-专用设备-其他专用设备
A3215: 机械设备-专用设备-其他专用设备
A3216: 机械设备-专用设备-其他专用设备
A3217: 机械设备-专用设备-其他专用设备
A3218: 机械设备-专用设备-其他专用设备
A3219: 机械设备-专用设备-其他专用设备
A3220: 机械设备-专用设备-其他专用设备
A3221: 机械设备-专用设备-其他专用设备
A3222: 机械设备-专用设备-其他专用设备
A3223: 机械设备-专用设备-其他专用设备
A3224: 机械设备-专用设备-其他专用设备
A3225: 机械设备-专用设备-其他专用设备
A3226: 机械设备-专用设备-农用机械
A3227: 机械设备-专用设备-农用机械
A3228: 机械设备-专用设备-农用机械
A3229: 机械设备-专用设备-农用机械
A3230: 机械设备-专用设备-农用机械
A3231: 机械设备-专用设备-农用机械
A3232: 机械设备-专用设备-农用机械
A3233: 机械设备-专用设备-农用机械
A3234: 机械设备-专用设备-农用机械
A3235: 机械设备-专用设备-农用机械
A3236: 机械设备-专用设备-能源及重型设备
A3237: 机械设备-专用设备-能源及重型设备
A3238: 机械设备-专用设备-能源及重型设备
A3239: 机械设备-专用设备-能源及重型设备
A3240: 机械设备-专用设备-能源及重型设备
A3241: 机械设备-专用设备-能源及重型设备
A3242: 机械设备-专用设备-能源及重型设备
A3243: 机械设备-专用设备-能源及重型设备
A3244: 机械设备-专用设备-能源及重型设备
A3245: 机械设备-专用设备-能源及重型设备
A3246: 机械设备-专用设备-能源及重型设备
A3247: 机械设备-专用设备-能源及重型设备
A3248: 机械设备-专用设备-能源及重型设备
A3249: 机械设备-专用设备-能源及重型设备
A3250: 机械设备-专用设备-能源及重型设备
A3251: 机械设备-专用设备-能源及重型设备
A3252: 机械设备-专用设备-能源及重型设备
A3253: 机械设备-专用设备-能源及重型设备
A3254: 机械设备-专用设备-能源及重型设备
A3255: 机械设备-专用设备-能源及重型设备
A3256: 机械设备-专用设备-能源及重型设备
A3257: 机械设备-专用设备-能源及重型设备
A3258: 机械设备-专用设备-能源及重型设备
A3259: 机械设备-专用设备-能源及重型设备
A3260: 机械设备-专用设备-能源及重型设备
A3261: 机械设备-专用设备-能源及重型设备
A3262: 机械设备-专用设备-能源及重型设备
A3263: 机械设备-专用设备-能源及重型设备
A3264: 机械设备-专用设备-能源及重型设备
A3265: 机械设备-专用设备-能源及重型设备
A3266: 机械设备-专用设备-能源及重型设备
A3267: 机械设备-专用设备-能源及重型设备
A3268: 机械设备-专用设备-能源及重型设备
A3269: 机械设备-专用设备-能源及重型设备
A3270: 机械设备-专用设备-能源及重型设备
A3271: 机械设备-专用设备-能源及重型设备
A3272: 机械设备-专用设备-能源及重型设备
A3273: 机械设备-专用设备-能源及重型设备
A3274: 机械设备-专用设备-能源及重型设备
A3275: 机械设备-专用设备-能源及重型设备
A3276: 机械设备-专用设备-能源及重型设备
A3277: 机械设备-专用设备-能源及重型设备
A3278: 机械设备-专用设备-能源及重型设备
A3279: 机械设备-专用设备-能源及重型设备
A3280: 机械设备-专用设备-能源及重型设备
A3281: 机械设备-专用设备-能源及重型设备
A3282: 机械设备-专用设备-能源及重型设备
A3283: 机械设备-专用设备-能源及重型设备
A3284: 机械设备-专用设备-能源及重型设备
A3285: 机械设备-专用设备-楼宇设备
A3286: 机械设备-专用设备-楼宇设备
A3287: 机械设备-专用设备-楼宇设备
A3288: 机械设备-专用设备-楼宇设备
A3289: 机械设备-专用设备-楼宇设备
A3290: 机械设备-专用设备-楼宇设备
A3291: 机械设备-专用设备-楼宇设备
A3292: 机械设备-专用设备-楼宇设备
A3293: 机械设备-专用设备-楼宇设备
A3294: 机械设备-专用设备-楼宇设备
A3295: 机械设备-专用设备-楼宇设备
A3296: 机械设备-专用设备-楼宇设备
A3297: 机械设备-专用设备-楼宇设备
A3298: 机械设备-专用设备-工程机械
A3299: 机械设备-专用设备-工程机械
A3300: 机械设备-专用设备-工程机械
A3301: 机械设备-专用设备-工程机械
A3302: 机械设备-专用设备-工程机械
A3303: 机械设备-专用设备-工程机械
A3304: 机械设备-专用设备-工程机械
A3305: 机械设备-专用设备-工程机械
A3306: 机械设备-专用设备-工程机械
A3307: 机械设备-专用设备-工程机械
A3308: 机械设备-专用设备-工程机械
A3309: 机械设备-专用设备-工程机械
A3310: 机械设备-专用设备-工程机械
A3311: 机械设备-专用设备-工程机械
A3312: 机械设备-专用设备-工程机械
A3313: 机械设备-专用设备-工程机械
A3314: 机械设备-专用设备-工程机械
A3315: 机械设备-专用设备-工程机械
A3316: 机械设备-专用设备-工程机械
A3317: 机械设备-专用设备-工程机械
A3318: 机械设备-专用设备-工程机械
A3319: 机械设备-专用设备-工程机械
A3320: 机械设备-专用设备-工程机械
A3321: 机械设备-专用设备-工程机械
A3322: 机械设备-专用设备-工程机械
A3323: 机械设备-专用设备-工程机械
A3324: 机械设备-专用设备-工程机械
A3325: 机械设备-专用设备-工程机械
A3326: 机械设备-专用设备-纺织服装设备
A3327: 机械设备-专用设备-纺织服装设备
A3328: 机械设备-专用设备-纺织服装设备
A3329: 机械设备-专用设备-纺织服装设备
A3330: 机械设备-专用设备-纺织服装设备
A3331: 机械设备-专用设备-纺织服装设备
A3332: 机械设备-专用设备-纺织服装设备
A3333: 机械设备-专用设备-纺织服装设备
A3334: 机械设备-专用设备-纺织服装设备
A3335: 机械设备-专用设备-纺织服装设备
A3336: 机械设备-专用设备-纺织服装设备
A3337: 机械设备-专用设备-纺织服装设备
A3338: 机械设备-仪器仪表-仪器仪表Ⅲ
A3339: 机械设备-仪器仪表-仪器仪表Ⅲ
A3340: 机械设备-仪器仪表-仪器仪表Ⅲ
A3341: 机械设备-仪器仪表-仪器仪表Ⅲ
A3342: 机械设备-仪器仪表-仪器仪表Ⅲ
A3343: 机械设备-仪器仪表-仪器仪表Ⅲ
A3344: 机械设备-仪器仪表-仪器仪表Ⅲ
A3345: 机械设备-仪器仪表-仪器仪表Ⅲ
A3346: 机械设备-仪器仪表-仪器仪表Ⅲ
A3347: 机械设备-仪器仪表-仪器仪表Ⅲ
A3348: 机械设备-仪器仪表-仪器仪表Ⅲ
A3349: 机械设备-仪器仪表-仪器仪表Ⅲ
A3350: 机械设备-仪器仪表-仪器仪表Ⅲ
A3351: 机械设备-仪器仪表-仪器仪表Ⅲ
A3352: 机械设备-仪器仪表-仪器仪表Ⅲ
A3353: 机械设备-仪器仪表-仪器仪表Ⅲ
A3354: 机械设备-仪器仪表-仪器仪表Ⅲ
A3355: 机械设备-仪器仪表-仪器仪表Ⅲ
A3356: 机械设备-仪器仪表-仪器仪表Ⅲ
A3357: 机械设备-仪器仪表-仪器仪表Ⅲ
A3358: 机械设备-仪器仪表-仪器仪表Ⅲ
A3359: 机械设备-仪器仪表-仪器仪表Ⅲ
A3360: 机械设备-仪器仪表-仪器仪表Ⅲ
A3361: 机械设备-仪器仪表-仪器仪表Ⅲ
A3362: 机械设备-仪器仪表-仪器仪表Ⅲ
A3363: 机械设备-仪器仪表-仪器仪表Ⅲ
A3364: 机械设备-仪器仪表-仪器仪表Ⅲ
A3365: 机械设备-仪器仪表-仪器仪表Ⅲ
A3366: 机械设备-仪器仪表-仪器仪表Ⅲ
A3367: 机械设备-仪器仪表-仪器仪表Ⅲ
A3368: 机械设备-仪器仪表-仪器仪表Ⅲ
A3369: 机械设备-仪器仪表-仪器仪表Ⅲ
A3370: 机械设备-仪器仪表-仪器仪表Ⅲ
A3371: 机械设备-仪器仪表-仪器仪表Ⅲ
A3372: 机械设备-仪器仪表-仪器仪表Ⅲ
A3373: 机械设备-仪器仪表-仪器仪表Ⅲ
A3374: 机械设备-仪器仪表-仪器仪表Ⅲ
A3375: 机械设备-仪器仪表-仪器仪表Ⅲ
A3376: 机械设备-仪器仪表-仪器仪表Ⅲ
A3377: 机械设备-仪器仪表-仪器仪表Ⅲ
A3378: 机械设备-仪器仪表-仪器仪表Ⅲ
A3379: 机械设备-仪器仪表-仪器仪表Ⅲ
A3380: 机械设备-仪器仪表-仪器仪表Ⅲ
A3381: 机械设备-仪器仪表-仪器仪表Ⅲ
A3382: 机械设备-仪器仪表-仪器仪表Ⅲ
A3383: 机械设备-仪器仪表-仪器仪表Ⅲ
A3384: 机械设备-仪器仪表-仪器仪表Ⅲ
A3385: 机械设备-仪器仪表-仪器仪表Ⅲ
A3386: 机械设备-仪器仪表-仪器仪表Ⅲ
A3387: 机械设备-仪器仪表-仪器仪表Ⅲ
A3388: 机械设备-仪器仪表-仪器仪表Ⅲ
A3389: 机械设备-仪器仪表-仪器仪表Ⅲ
A3390: 机械设备-仪器仪表-仪器仪表Ⅲ
A3391: 机械设备-通用设备-制冷空调设备
A3392: 机械设备-通用设备-制冷空调设备
A3393: 机械设备-通用设备-制冷空调设备
A3394: 机械设备-通用设备-制冷空调设备
A3395: 机械设备-通用设备-制冷空调设备
A3396: 机械设备-通用设备-制冷空调设备
A3397: 机械设备-通用设备-制冷空调设备
A3398: 机械设备-通用设备-制冷空调设备
A3399: 机械设备-通用设备-制冷空调设备
A3400: 机械设备-通用设备-制冷空调设备
A3401: 机械设备-通用设备-制冷空调设备
A3402: 机械设备-通用设备-制冷空调设备
A3403: 机械设备-通用设备-制冷空调设备
A3404: 机械设备-通用设备-制冷空调设备
A3405: 机械设备-通用设备-制冷空调设备
A3406: 机械设备-通用设备-制冷空调设备
A3407: 机械设备-通用设备-其他通用设备
A3408: 机械设备-通用设备-其他通用设备
A3409: 机械设备-通用设备-其他通用设备
A3410: 机械设备-通用设备-其他通用设备
A3411: 机械设备-通用设备-其他通用设备
A3412: 机械设备-通用设备-其他通用设备
A3413: 机械设备-通用设备-其他通用设备
A3414: 机械设备-通用设备-其他通用设备
A3415: 机械设备-通用设备-其他通用设备
A3416: 机械设备-通用设备-其他通用设备
A3417: 机械设备-通用设备-其他通用设备
A3418: 机械设备-通用设备-其他通用设备
A3419: 机械设备-通用设备-其他通用设备
A3420: 机械设备-通用设备-其他通用设备
A3421: 机械设备-通用设备-其他通用设备
A3422: 机械设备-通用设备-其他通用设备
A3423: 机械设备-通用设备-其他通用设备
A3424: 机械设备-通用设备-其他通用设备
A3425: 机械设备-通用设备-其他通用设备
A3426: 机械设备-通用设备-其他通用设备
A3427: 机械设备-通用设备-其他通用设备
A3428: 机械设备-通用设备-其他通用设备
A3429: 机械设备-通用设备-其他通用设备
A3430: 机械设备-通用设备-其他通用设备
A3431: 机械设备-通用设备-其他通用设备
A3432: 机械设备-通用设备-其他通用设备
A3433: 机械设备-通用设备-其他通用设备
A3434: 机械设备-通用设备-其他通用设备
A3435: 机械设备-通用设备-其他通用设备
A3436: 机械设备-通用设备-其他通用设备
A3437: 机械设备-通用设备-其他通用设备
A3438: 机械设备-通用设备-其他通用设备
A3439: 机械设备-通用设备-其他通用设备
A3440: 机械设备-通用设备-其他通用设备
A3441: 机械设备-通用设备-其他通用设备
A3442: 机械设备-通用设备-其他通用设备
A3443: 机械设备-通用设备-其他通用设备
A3444: 机械设备-通用设备-其他通用设备
A3445: 机械设备-通用设备-其他通用设备
A3446: 机械设备-通用设备-其他通用设备
A3447: 机械设备-通用设备-其他通用设备
A3448: 机械设备-通用设备-其他通用设备
A3449: 机械设备-通用设备-其他通用设备
A3450: 机械设备-通用设备-其他通用设备
A3451: 机械设备-通用设备-其他通用设备
A3452: 机械设备-通用设备-其他通用设备
A3453: 机械设备-通用设备-其他通用设备
A3454: 机械设备-通用设备-其他通用设备
A3455: 机械设备-通用设备-其他通用设备
A3456: 机械设备-通用设备-其他通用设备
A3457: 机械设备-通用设备-其他通用设备
A3458: 机械设备-通用设备-其他通用设备
A3459: 机械设备-通用设备-其他通用设备
A3460: 机械设备-通用设备-其他通用设备
A3461: 机械设备-通用设备-其他通用设备
A3462: 机械设备-通用设备-其他通用设备
A3463: 机械设备-通用设备-其他通用设备
A3464: 机械设备-通用设备-磨具磨料
A3465: 机械设备-通用设备-磨具磨料
A3466: 机械设备-通用设备-磨具磨料
A3467: 机械设备-通用设备-磨具磨料
A3468: 机械设备-通用设备-磨具磨料
A3469: 机械设备-通用设备-磨具磨料
A3470: 机械设备-通用设备-磨具磨料
A3471: 机械设备-通用设备-磨具磨料
A3472: 机械设备-通用设备-磨具磨料
A3473: 机械设备-通用设备-磨具磨料
A3474: 机械设备-通用设备-磨具磨料
A3475: 机械设备-通用设备-磨具磨料
A3476: 机械设备-通用设备-磨具磨料
A3477: 机械设备-通用设备-磨具磨料
A3478: 机械设备-通用设备-金属制品
A3479: 机械设备-通用设备-金属制品
A3480: 机械设备-通用设备-金属制品
A3481: 机械设备-通用设备-金属制品
A3482: 机械设备-通用设备-金属制品
A3483: 机械设备-通用设备-金属制品
A3484: 机械设备-通用设备-金属制品
A3485: 机械设备-通用设备-金属制品
A3486: 机械设备-通用设备-金属制品
A3487: 机械设备-通用设备-金属制品
A3488: 机械设备-通用设备-金属制品
A3489: 机械设备-通用设备-金属制品
A3490: 机械设备-通用设备-金属制品
A3491: 机械设备-通用设备-金属制品
A3492: 机械设备-通用设备-金属制品
A3493: 机械设备-通用设备-金属制品
A3494: 机械设备-通用设备-金属制品
A3495: 机械设备-通用设备-金属制品
A3496: 机械设备-通用设备-金属制品
A3497: 机械设备-通用设备-金属制品
A3498: 机械设备-通用设备-金属制品
A3499: 机械设备-通用设备-金属制品
A3500: 机械设备-通用设备-金属制品
A3501: 机械设备-通用设备-金属制品
A3502: 机械设备-通用设备-金属制品
A3503: 机械设备-通用设备-金属制品
A3504: 机械设备-通用设备-金属制品
A3505: 机械设备-通用设备-金属制品
A3506: 机械设备-通用设备-金属制品
A3507: 机械设备-通用设备-金属制品
A3508: 机械设备-通用设备-金属制品
A3509: 机械设备-通用设备-金属制品
A3510: 机械设备-通用设备-金属制品
A3511: 机械设备-通用设备-金属制品
A3512: 机械设备-通用设备-金属制品
A3513: 机械设备-通用设备-金属制品
A3514: 机械设备-通用设备-金属制品
A3515: 机械设备-通用设备-金属制品
A3516: 机械设备-通用设备-金属制品
A3517: 机械设备-通用设备-金属制品
A3518: 机械设备-通用设备-金属制品
A3519: 机械设备-通用设备-金属制品
A3520: 机械设备-通用设备-金属制品
A3521: 机械设备-通用设备-金属制品
A3522: 机械设备-通用设备-金属制品
A3523: 机械设备-通用设备-金属制品
A3524: 机械设备-通用设备-金属制品
A3525: 机械设备-通用设备-金属制品
A3526: 机械设备-通用设备-金属制品
A3527: 机械设备-通用设备-金属制品
A3528: 机械设备-通用设备-金属制品
A3529: 机械设备-通用设备-金属制品
A3530: 机械设备-通用设备-金属制品
A3531: 机械设备-通用设备-金属制品
A3532: 机械设备-通用设备-金属制品
A3533: 机械设备-通用设备-金属制品
A3534: 机械设备-通用设备-金属制品
A3535: 机械设备-通用设备-金属制品
A3536: 机械设备-通用设备-金属制品
A3537: 机械设备-通用设备-金属制品
A3538: 机械设备-通用设备-金属制品
A3539: 机械设备-通用设备-金属制品
A3540: 机械设备-通用设备-金属制品
A3541: 机械设备-通用设备-金属制品
A3542: 机械设备-通用设备-金属制品
A3543: 机械设备-通用设备-金属制品
A3544: 机械设备-通用设备-金属制品
A3545: 机械设备-通用设备-金属制品
A3546: 机械设备-通用设备-金属制品
A3547: 机械设备-通用设备-金属制品
A3548: 机械设备-通用设备-机床工具
A3549: 机械设备-通用设备-机床工具
A3550: 机械设备-通用设备-机床工具
A3551: 机械设备-通用设备-机床工具
A3552: 机械设备-通用设备-机床工具
A3553: 机械设备-通用设备-机床工具
A3554: 机械设备-通用设备-机床工具
A3555: 机械设备-通用设备-机床工具
A3556: 机械设备-通用设备-机床工具
A3557: 机械设备-通用设备-机床工具
A3558: 机械设备-通用设备-机床工具
A3559: 机械设备-通用设备-机床工具
A3560: 机械设备-通用设备-机床工具
A3561: 机械设备-通用设备-机床工具
A3562: 机械设备-通用设备-机床工具
A3563: 机械设备-通用设备-机床工具
A3564: 机械设备-通用设备-机床工具
A3565: 机械设备-通用设备-机床工具
A3566: 机械设备-通用设备-机床工具
A3567: 机械设备-通用设备-机床工具
A3568: 环保-环保-综合环境治理
A3569: 环保-环保-综合环境治理
A3570: 环保-环保-综合环境治理
A3571: 环保-环保-综合环境治理
A3572: 环保-环保-综合环境治理
A3573: 环保-环保-综合环境治理
A3574: 环保-环保-综合环境治理
A3575: 环保-环保-综合环境治理
A3576: 环保-环保-综合环境治理
A3577: 环保-环保-综合环境治理
A3578: 环保-环保-综合环境治理
A3579: 环保-环保-综合环境治理
A3580: 环保-环保-综合环境治理
A3581: 环保-环保-综合环境治理
A3582: 环保-环保-综合环境治理
A3583: 环保-环保-综合环境治理
A3584: 环保-环保-综合环境治理
A3585: 环保-环保-综合环境治理
A3586: 环保-环保-综合环境治理
A3587: 环保-环保-综合环境治理
A3588: 环保-环保-综合环境治理
A3589: 环保-环保-综合环境治理
A3590: 环保-环保-综合环境治理
A3591: 环保-环保-综合环境治理
A3592: 环保-环保-综合环境治理
A3593: 环保-环保-综合环境治理
A3594: 环保-环保-综合环境治理
A3595: 环保-环保-综合环境治理
A3596: 环保-环保-综合环境治理
A3597: 环保-环保-水务及水治理
A3598: 环保-环保-水务及水治理
A3599: 环保-环保-水务及水治理
A3600: 环保-环保-水务及水治理
A3601: 环保-环保-水务及水治理
A3602: 环保-环保-水务及水治理
A3603: 环保-环保-水务及水治理
A3604: 环保-环保-水务及水治理
A3605: 环保-环保-水务及水治理
A3606: 环保-环保-水务及水治理
A3607: 环保-环保-水务及水治理
A3608: 环保-环保-水务及水治理
A3609: 环保-环保-水务及水治理
A3610: 环保-环保-水务及水治理
A3611: 环保-环保-水务及水治理
A3612: 环保-环保-水务及水治理
A3613: 环保-环保-水务及水治理
A3614: 环保-环保-水务及水治理
A3615: 环保-环保-水务及水治理
A3616: 环保-环保-水务及水治理
A3617: 环保-环保-水务及水治理
A3618: 环保-环保-水务及水治理
A3619: 环保-环保-水务及水治理
A3620: 环保-环保-水务及水治理
A3621: 环保-环保-水务及水治理
A3622: 环保-环保-水务及水治理
A3623: 环保-环保-水务及水治理
A3624: 环保-环保-水务及水治理
A3625: 环保-环保-水务及水治理
A3626: 环保-环保-水务及水治理
A3627: 环保-环保-水务及水治理
A3628: 环保-环保-水务及水治理
A3629: 环保-环保-水务及水治理
A3630: 环保-环保-水务及水治理
A3631: 环保-环保-水务及水治理
A3632: 环保-环保-水务及水治理
A3633: 环保-环保-水务及水治理
A3634: 环保-环保-水务及水治理
A3635: 环保-环保-水务及水治理
A3636: 环保-环保-水务及水治理
A3637: 环保-环保-水务及水治理
A3638: 环保-环保-水务及水治理
A3639: 环保-环保-水务及水治理
A3640: 环保-环保-水务及水治理
A3641: 环保-环保-水务及水治理
A3642: 环保-环保-水务及水治理
A3643: 环保-环保-环保设备
A3644: 环保-环保-环保设备
A3645: 环保-环保-环保设备
A3646: 环保-环保-环保设备
A3647: 环保-环保-环保设备
A3648: 环保-环保-环保设备
A3649: 环保-环保-环保设备
A3650: 环保-环保-环保设备
A3651: 环保-环保-环保设备
A3652: 环保-环保-环保设备
A3653: 环保-环保-环保设备
A3654: 环保-环保-环保设备
A3655: 环保-环保-环保设备
A3656: 环保-环保-环保设备
A3657: 环保-环保-环保设备
A3658: 环保-环保-环保设备
A3659: 环保-环保-环保设备
A3660: 环保-环保-环保设备
A3661: 环保-环保-环保设备
A3662: 环保-环保-环保设备
A3663: 环保-环保-环保设备
A3664: 环保-环保-环保设备
A3665: 环保-环保-环保设备
A3666: 环保-环保-环保设备
A3667: 环保-环保-环保设备
A3668: 环保-环保-环保设备
A3669: 环保-环保-环保设备
A3670: 环保-环保-环保设备
A3671: 环保-环保-固废治理
A3672: 环保-环保-固废治理
A3673: 环保-环保-固废治理
A3674: 环保-环保-固废治理
A3675: 环保-环保-固废治理
A3676: 环保-环保-固废治理
A3677: 环保-环保-固废治理
A3678: 环保-环保-固废治理
A3679: 环保-环保-固废治理
A3680: 环保-环保-固废治理
A3681: 环保-环保-固废治理
A3682: 环保-环保-固废治理
A3683: 环保-环保-固废治理
A3684: 环保-环保-固废治理
A3685: 环保-环保-固废治理
A3686: 环保-环保-固废治理
A3687: 环保-环保-固废治理
A3688: 环保-环保-固废治理
A3689: 环保-环保-固废治理
A3690: 环保-环保-固废治理
A3691: 环保-环保-固废治理
A3692: 环保-环保-固废治理
A3693: 环保-环保-固废治理
A3694: 环保-环保-固废治理
A3695: 环保-环保-固废治理
A3696: 环保-环保-固废治理
A3697: 环保-环保-固废治理
A3698: 环保-环保-固废治理
A3699: 环保-环保-固废治理
A3700: 环保-环保-固废治理
A3701: 环保-环保-固废治理
A3702: 环保-环保-固废治理
A3703: 环保-环保-固废治理
A3704: 环保-环保-固废治理
A3705: 环保-环保-固废治理
A3706: 环保-环保-固废治理
A3707: 环保-环保-大气治理
A3708: 环保-环保-大气治理
A3709: 环保-环保-大气治理
A3710: 环保-环保-大气治理
A3711: 环保-环保-大气治理
A3712: 环保-环保-大气治理
A3713: 环保-环保-大气治理
A3714: 黑色金属-钢铁-冶钢原料
A3715: 黑色金属-钢铁-冶钢原料
A3716: 黑色金属-钢铁-冶钢原料
A3717: 黑色金属-钢铁-冶钢原料
A3718: 黑色金属-钢铁-冶钢原料
A3719: 黑色金属-钢铁-冶钢原料
A3720: 黑色金属-钢铁-冶钢原料
A3721: 黑色金属-钢铁-冶钢原料
A3722: 黑色金属-钢铁-冶钢原料
A3723: 黑色金属-钢铁-冶钢原料
A3724: 黑色金属-钢铁-特钢
A3725: 黑色金属-钢铁-特钢
A3726: 黑色金属-钢铁-特钢
A3727: 黑色金属-钢铁-特钢
A3728: 黑色金属-钢铁-特钢
A3729: 黑色金属-钢铁-特钢
A3730: 黑色金属-钢铁-特钢
A3731: 黑色金属-钢铁-特钢
A3732: 黑色金属-钢铁-特钢
A3733: 黑色金属-钢铁-特钢
A3734: 黑色金属-钢铁-特钢
A3735: 黑色金属-钢铁-特钢
A3736: 黑色金属-钢铁-特钢
A3737: 黑色金属-钢铁-普钢
A3738: 黑色金属-钢铁-普钢
A3739: 黑色金属-钢铁-普钢
A3740: 黑色金属-钢铁-普钢
A3741: 黑色金属-钢铁-普钢
A3742: 黑色金属-钢铁-普钢
A3743: 黑色金属-钢铁-普钢
A3744: 黑色金属-钢铁-普钢
A3745: 黑色金属-钢铁-普钢
A3746: 黑色金属-钢铁-普钢
A3747: 黑色金属-钢铁-普钢
A3748: 黑色金属-钢铁-普钢
A3749: 黑色金属-钢铁-普钢
A3750: 黑色金属-钢铁-普钢
A3751: 黑色金属-钢铁-普钢
A3752: 黑色金属-钢铁-普钢
A3753: 黑色金属-钢铁-普钢
A3754: 黑色金属-钢铁-普钢
A3755: 黑色金属-钢铁-普钢
A3756: 黑色金属-钢铁-普钢
A3757: 黑色金属-钢铁-普钢
A3758: 黑色金属-钢铁-普钢
A3759: 黑色金属-钢铁-普钢
A3760: 国防军工-国防军工-军工电子
A3761: 国防军工-国防军工-军工电子
A3762: 国防军工-国防军工-军工电子
A3763: 国防军工-国防军工-军工电子
A3764: 国防军工-国防军工-军工电子
A3765: 国防军工-国防军工-军工电子
A3766: 国防军工-国防军工-军工电子
A3767: 国防军工-国防军工-军工电子
A3768: 国防军工-国防军工-军工电子
A3769: 国防军工-国防军工-军工电子
A3770: 国防军工-国防军工-军工电子
A3771: 国防军工-国防军工-军工电子
A3772: 国防军工-国防军工-军工电子
A3773: 国防军工-国防军工-军工电子
A3774: 国防军工-国防军工-军工电子
A3775: 国防军工-国防军工-军工电子
A3776: 国防军工-国防军工-军工电子
A3777: 国防军工-国防军工-军工电子
A3778: 国防军工-国防军工-军工电子
A3779: 国防军工-国防军工-军工电子
A3780: 国防军工-国防军工-军工电子
A3781: 国防军工-国防军工-军工电子
A3782: 国防军工-国防军工-军工电子
A3783: 国防军工-国防军工-军工电子
A3784: 国防军工-国防军工-军工电子
A3785: 国防军工-国防军工-军工电子
A3786: 国防军工-国防军工-军工电子
A3787: 国防军工-国防军工-军工电子
A3788: 国防军工-国防军工-军工电子
A3789: 国防军工-国防军工-军工电子
A3790: 国防军工-国防军工-军工电子
A3791: 国防军工-国防军工-军工电子
A3792: 国防军工-国防军工-军工电子
A3793: 国防军工-国防军工-军工电子
A3794: 国防军工-国防军工-军工电子
A3795: 国防军工-国防军工-军工电子
A3796: 国防军工-国防军工-军工电子
A3797: 国防军工-国防军工-军工电子
A3798: 国防军工-国防军工-军工电子
A3799: 国防军工-国防军工-军工电子
A3800: 国防军工-国防军工-军工电子
A3801: 国防军工-国防军工-军工电子
A3802: 国防军工-国防军工-军工电子
A3803: 国防军工-国防军工-军工电子
A3804: 国防军工-国防军工-军工电子
A3805: 国防军工-国防军工-军工电子
A3806: 国防军工-国防军工-军工电子
A3807: 国防军工-国防军工-军工电子
A3808: 国防军工-国防军工-军工电子
A3809: 国防军工-国防军工-军工电子
A3810: 国防军工-国防军工-军工电子
A3811: 国防军工-国防军工-军工电子
A3812: 国防军工-国防军工-军工电子
A3813: 国防军工-国防军工-军工电子
A3814: 国防军工-国防军工-军工电子
A3815: 国防军工-国防军工-军工电子
A3816: 国防军工-国防军工-军工电子
A3817: 国防军工-国防军工-军工电子
A3818: 国防军工-国防军工-军工电子
A3819: 国防军工-国防军工-军工电子
A3820: 国防军工-国防军工-航天装备
A3821: 国防军工-国防军工-航天装备
A3822: 国防军工-国防军工-航天装备
A3823: 国防军工-国防军工-航天装备
A3824: 国防军工-国防军工-航天装备
A3825: 国防军工-国防军工-航天装备
A3826: 国防军工-国防军工-航天装备
A3827: 国防军工-国防军工-航天装备
A3828: 国防军工-国防军工-航天装备
A3829: 国防军工-国防军工-航空装备
A3830: 国防军工-国防军工-航空装备
A3831: 国防军工-国防军工-航空装备
A3832: 国防军工-国防军工-航空装备
A3833: 国防军工-国防军工-航空装备
A3834: 国防军工-国防军工-航空装备
A3835: 国防军工-国防军工-航空装备
A3836: 国防军工-国防军工-航空装备
A3837: 国防军工-国防军工-航空装备
A3838: 国防军工-国防军工-航空装备
A3839: 国防军工-国防军工-航空装备
A3840: 国防军工-国防军工-航空装备
A3841: 国防军工-国防军工-航空装备
A3842: 国防军工-国防军工-航空装备
A3843: 国防军工-国防军工-航空装备
A3844: 国防军工-国防军工-航空装备
A3845: 国防军工-国防军工-航空装备
A3846: 国防军工-国防军工-航空装备
A3847: 国防军工-国防军工-航空装备
A3848: 国防军工-国防军工-航空装备
A3849: 国防军工-国防军工-航空装备
A3850: 国防军工-国防军工-航空装备
A3851: 国防军工-国防军工-航空装备
A3852: 国防军工-国防军工-航空装备
A3853: 国防军工-国防军工-航空装备
A3854: 国防军工-国防军工-航空装备
A3855: 国防军工-国防军工-航空装备
A3856: 国防军工-国防军工-航空装备
A3857: 国防军工-国防军工-航空装备
A3858: 国防军工-国防军工-航空装备
A3859: 国防军工-国防军工-航空装备
A3860: 国防军工-国防军工-航空装备
A3861: 国防军工-国防军工-航空装备
A3862: 国防军工-国防军工-航空装备
A3863: 国防军工-国防军工-航空装备
A3864: 国防军工-国防军工-航空装备
A3865: 国防军工-国防军工-航空装备
A3866: 国防军工-国防军工-航空装备
A3867: 国防军工-国防军工-航空装备
A3868: 国防军工-国防军工-航空装备
A3869: 国防军工-国防军工-航空装备
A3870: 国防军工-国防军工-航空装备
A3871: 国防军工-国防军工-航空装备
A3872: 国防军工-国防军工-航空装备
A3873: 国防军工-国防军工-航空装备
A3874: 国防军工-国防军工-航空装备
A3875: 国防军工-国防军工-航空装备
A3876: 国防军工-国防军工-航空装备
A3877: 国防军工-国防军工-航海装备
A3878: 国防军工-国防军工-航海装备
A3879: 国防军工-国防军工-航海装备
A3880: 国防军工-国防军工-航海装备
A3881: 国防军工-国防军工-航海装备
A3882: 国防军工-国防军工-航海装备
A3883: 国防军工-国防军工-航海装备
A3884: 国防军工-国防军工-航海装备
A3885: 国防军工-国防军工-航海装备
A3886: 国防军工-国防军工-航海装备
A3887: 国防军工-国防军工-航海装备
A3888: 国防军工-国防军工-地面兵装
A3889: 国防军工-国防军工-地面兵装
A3890: 国防军工-国防军工-地面兵装
A3891: 国防军工-国防军工-地面兵装
A3892: 国防军工-国防军工-地面兵装
A3893: 国防军工-国防军工-地面兵装
A3894: 国防军工-国防军工-地面兵装
A3895: 国防军工-国防军工-地面兵装
A3896: 国防军工-国防军工-地面兵装
A3897: 国防军工-国防军工-地面兵装
A3898: 国防军工-国防军工-地面兵装
A3899: 国防军工-国防军工-地面兵装
A3900: 公用事业-燃气-燃气Ⅲ
A3901: 公用事业-燃气-燃气Ⅲ
A3902: 公用事业-燃气-燃气Ⅲ
A3903: 公用事业-燃气-燃气Ⅲ
A3904: 公用事业-燃气-燃气Ⅲ
A3905: 公用事业-燃气-燃气Ⅲ
A3906: 公用事业-燃气-燃气Ⅲ
A3907: 公用事业-燃气-燃气Ⅲ
A3908: 公用事业-燃气-燃气Ⅲ
A3909: 公用事业-燃气-燃气Ⅲ
A3910: 公用事业-燃气-燃气Ⅲ
A3911: 公用事业-燃气-燃气Ⅲ
A3912: 公用事业-燃气-燃气Ⅲ
A3913: 公用事业-燃气-燃气Ⅲ
A3914: 公用事业-燃气-燃气Ⅲ
A3915: 公用事业-燃气-燃气Ⅲ
A3916: 公用事业-燃气-燃气Ⅲ
A3917: 公用事业-燃气-燃气Ⅲ
A3918: 公用事业-燃气-燃气Ⅲ
A3919: 公用事业-燃气-燃气Ⅲ
A3920: 公用事业-燃气-燃气Ⅲ
A3921: 公用事业-燃气-燃气Ⅲ
A3922: 公用事业-燃气-燃气Ⅲ
A3923: 公用事业-燃气-燃气Ⅲ
A3924: 公用事业-燃气-燃气Ⅲ
A3925: 公用事业-燃气-燃气Ⅲ
A3926: 公用事业-燃气-燃气Ⅲ
A3927: 公用事业-燃气-燃气Ⅲ
A3928: 公用事业-燃气-燃气Ⅲ
A3929: 公用事业-电力-新能源发电
A3930: 公用事业-电力-新能源发电
A3931: 公用事业-电力-新能源发电
A3932: 公用事业-电力-新能源发电
A3933: 公用事业-电力-新能源发电
A3934: 公用事业-电力-新能源发电
A3935: 公用事业-电力-新能源发电
A3936: 公用事业-电力-新能源发电
A3937: 公用事业-电力-新能源发电
A3938: 公用事业-电力-新能源发电
A3939: 公用事业-电力-新能源发电
A3940: 公用事业-电力-新能源发电
A3941: 公用事业-电力-新能源发电
A3942: 公用事业-电力-新能源发电
A3943: 公用事业-电力-新能源发电
A3944: 公用事业-电力-新能源发电
A3945: 公用事业-电力-新能源发电
A3946: 公用事业-电力-新能源发电
A3947: 公用事业-电力-新能源发电
A3948: 公用事业-电力-新能源发电
A3949: 公用事业-电力-新能源发电
A3950: 公用事业-电力-新能源发电
A3951: 公用事业-电力-新能源发电
A3952: 公用事业-电力-新能源发电
A3953: 公用事业-电力-新能源发电
A3954: 公用事业-电力-新能源发电
A3955: 公用事业-电力-新能源发电
A3956: 公用事业-电力-水电
A3957: 公用事业-电力-水电
A3958: 公用事业-电力-水电
A3959: 公用事业-电力-水电
A3960: 公用事业-电力-水电
A3961: 公用事业-电力-水电
A3962: 公用事业-电力-水电
A3963: 公用事业-电力-水电
A3964: 公用事业-电力-水电
A3965: 公用事业-电力-水电
A3966: 公用事业-电力-热力
A3967: 公用事业-电力-热力
A3968: 公用事业-电力-热力
A3969: 公用事业-电力-热力
A3970: 公用事业-电力-热力
A3971: 公用事业-电力-热力
A3972: 公用事业-电力-热力
A3973: 公用事业-电力-热力
A3974: 公用事业-电力-热力
A3975: 公用事业-电力-热力
A3976: 公用事业-电力-热力
A3977: 公用事业-电力-热力
A3978: 公用事业-电力-热力
A3979: 公用事业-电力-热力
A3980: 公用事业-电力-热力
A3981: 公用事业-电力-热力
A3982: 公用事业-电力-火电
A3983: 公用事业-电力-火电
A3984: 公用事业-电力-火电
A3985: 公用事业-电力-火电
A3986: 公用事业-电力-火电
A3987: 公用事业-电力-火电
A3988: 公用事业-电力-火电
A3989: 公用事业-电力-火电
A3990: 公用事业-电力-火电
A3991: 公用事业-电力-火电
A3992: 公用事业-电力-火电
A3993: 公用事业-电力-火电
A3994: 公用事业-电力-火电
A3995: 公用事业-电力-火电
A3996: 公用事业-电力-火电
A3997: 公用事业-电力-火电
A3998: 公用事业-电力-火电
A3999: 公用事业-电力-火电
A4000: 公用事业-电力-火电
A4001: 公用事业-电力-火电
A4002: 公用事业-电力-火电
A4003: 公用事业-电力-火电
A4004: 公用事业-电力-火电
A4005: 公用事业-电力-火电
A4006: 公用事业-电力-火电
A4007: 公用事业-电力-火电
A4008: 公用事业-电力-火电
A4009: 公用事业-电力-电能综合服务
A4010: 公用事业-电力-电能综合服务
A4011: 公用事业-电力-电能综合服务
A4012: 公用事业-电力-电能综合服务
A4013: 公用事业-电力-电能综合服务
A4014: 公用事业-电力-电能综合服务
A4015: 公用事业-电力-电能综合服务
A4016: 公用事业-电力-电能综合服务
A4017: 公用事业-电力-电能综合服务
A4018: 公用事业-电力-电能综合服务
A4019: 公用事业-电力-电能综合服务
A4020: 公用事业-电力-电能综合服务
A4021: 公用事业-电力-电能综合服务
A4022: 公用事业-电力-电能综合服务
A4023: 公用事业-电力-电能综合服务
A4024: 非银金融-证券-证券Ⅲ
A4025: 非银金融-证券-证券Ⅲ
A4026: 非银金融-证券-证券Ⅲ
A4027: 非银金融-证券-证券Ⅲ
A4028: 非银金融-证券-证券Ⅲ
A4029: 非银金融-证券-证券Ⅲ
A4030: 非银金融-证券-证券Ⅲ
A4031: 非银金融-证券-证券Ⅲ
A4032: 非银金融-证券-证券Ⅲ
A4033: 非银金融-证券-证券Ⅲ
A4034: 非银金融-证券-证券Ⅲ
A4035: 非银金融-证券-证券Ⅲ
A4036: 非银金融-证券-证券Ⅲ
A4037: 非银金融-证券-证券Ⅲ
A4038: 非银金融-证券-证券Ⅲ
A4039: 非银金融-证券-证券Ⅲ
A4040: 非银金融-证券-证券Ⅲ
A4041: 非银金融-证券-证券Ⅲ
A4042: 非银金融-证券-证券Ⅲ
A4043: 非银金融-证券-证券Ⅲ
A4044: 非银金融-证券-证券Ⅲ
A4045: 非银金融-证券-证券Ⅲ
A4046: 非银金融-证券-证券Ⅲ
A4047: 非银金融-证券-证券Ⅲ
A4048: 非银金融-证券-证券Ⅲ
A4049: 非银金融-证券-证券Ⅲ
A4050: 非银金融-证券-证券Ⅲ
A4051: 非银金融-证券-证券Ⅲ
A4052: 非银金融-证券-证券Ⅲ
A4053: 非银金融-证券-证券Ⅲ
A4054: 非银金融-证券-证券Ⅲ
A4055: 非银金融-证券-证券Ⅲ
A4056: 非银金融-证券-证券Ⅲ
A4057: 非银金融-证券-证券Ⅲ
A4058: 非银金融-证券-证券Ⅲ
A4059: 非银金融-证券-证券Ⅲ
A4060: 非银金融-证券-证券Ⅲ
A4061: 非银金融-证券-证券Ⅲ
A4062: 非银金融-证券-证券Ⅲ
A4063: 非银金融-证券-证券Ⅲ
A4064: 非银金融-证券-证券Ⅲ
A4065: 非银金融-证券-证券Ⅲ
A4066: 非银金融-证券-证券Ⅲ
A4067: 非银金融-证券-证券Ⅲ
A4068: 非银金融-证券-证券Ⅲ
A4069: 非银金融-证券-证券Ⅲ
A4070: 非银金融-证券-证券Ⅲ
A4071: 非银金融-证券-证券Ⅲ
A4072: 非银金融-证券-证券Ⅲ
A4073: 非银金融-证券-证券Ⅲ
A4074: 非银金融-保险及其他-多元金融
A4075: 非银金融-保险及其他-多元金融
A4076: 非银金融-保险及其他-多元金融
A4077: 非银金融-保险及其他-多元金融
A4078: 非银金融-保险及其他-多元金融
A4079: 非银金融-保险及其他-多元金融
A4080: 非银金融-保险及其他-多元金融
A4081: 非银金融-保险及其他-多元金融
A4082: 非银金融-保险及其他-多元金融
A4083: 非银金融-保险及其他-多元金融
A4084: 非银金融-保险及其他-多元金融
A4085: 非银金融-保险及其他-多元金融
A4086: 非银金融-保险及其他-多元金融
A4087: 非银金融-保险及其他-多元金融
A4088: 非银金融-保险及其他-多元金融
A4089: 非银金融-保险及其他-多元金融
A4090: 非银金融-保险及其他-多元金融
A4091: 非银金融-保险及其他-多元金融
A4092: 非银金融-保险及其他-多元金融
A4093: 非银金融-保险及其他-多元金融
A4094: 非银金融-保险及其他-多元金融
A4095: 非银金融-保险及其他-多元金融
A4096: 非银金融-保险及其他-多元金融
A4097: 非银金融-保险及其他-多元金融
A4098: 非银金融-保险及其他-多元金融
A4099: 非银金融-保险及其他-多元金融
A4100: 非银金融-保险及其他-多元金融
A4101: 非银金融-保险及其他-多元金融
A4102: 非银金融-保险及其他-多元金融
A4103: 非银金融-保险及其他-多元金融
A4104: 非银金融-保险及其他-多元金融
A4105: 非银金融-保险及其他-保险
A4106: 非银金融-保险及其他-保险
A4107: 非银金融-保险及其他-保险
A4108: 非银金融-保险及其他-保险
A4109: 非银金融-保险及其他-保险
A4110: 非银金融-保险及其他-保险
A4111: 纺织服装-服装家纺-鞋帽及其他
A4112: 纺织服装-服装家纺-鞋帽及其他
A4113: 纺织服装-服装家纺-鞋帽及其他
A4114: 纺织服装-服装家纺-鞋帽及其他
A4115: 纺织服装-服装家纺-鞋帽及其他
A4116: 纺织服装-服装家纺-鞋帽及其他
A4117: 纺织服装-服装家纺-鞋帽及其他
A4118: 纺织服装-服装家纺-鞋帽及其他
A4119: 纺织服装-服装家纺-鞋帽及其他
A4120: 纺织服装-服装家纺-鞋帽及其他
A4121: 纺织服装-服装家纺-鞋帽及其他
A4122: 纺织服装-服装家纺-鞋帽及其他
A4123: 纺织服装-服装家纺-鞋帽及其他
A4124: 纺织服装-服装家纺-鞋帽及其他
A4125: 纺织服装-服装家纺-鞋帽及其他
A4126: 纺织服装-服装家纺-鞋帽及其他
A4127: 纺织服装-服装家纺-家纺
A4128: 纺织服装-服装家纺-家纺
A4129: 纺织服装-服装家纺-家纺
A4130: 纺织服装-服装家纺-家纺
A4131: 纺织服装-服装家纺-家纺
A4132: 纺织服装-服装家纺-家纺
A4133: 纺织服装-服装家纺-家纺
A4134: 纺织服装-服装家纺-服装
A4135: 纺织服装-服装家纺-服装
A4136: 纺织服装-服装家纺-服装
A4137: 纺织服装-服装家纺-服装
A4138: 纺织服装-服装家纺-服装
A4139: 纺织服装-服装家纺-服装
A4140: 纺织服装-服装家纺-服装
A4141: 纺织服装-服装家纺-服装
A4142: 纺织服装-服装家纺-服装
A4143: 纺织服装-服装家纺-服装
A4144: 纺织服装-服装家纺-服装
A4145: 纺织服装-服装家纺-服装
A4146: 纺织服装-服装家纺-服装
A4147: 纺织服装-服装家纺-服装
A4148: 纺织服装-服装家纺-服装
A4149: 纺织服装-服装家纺-服装
A4150: 纺织服装-服装家纺-服装
A4151: 纺织服装-服装家纺-服装
A4152: 纺织服装-服装家纺-服装
A4153: 纺织服装-服装家纺-服装
A4154: 纺织服装-服装家纺-服装
A4155: 纺织服装-服装家纺-服装
A4156: 纺织服装-服装家纺-服装
A4157: 纺织服装-服装家纺-服装
A4158: 纺织服装-服装家纺-服装
A4159: 纺织服装-服装家纺-服装
A4160: 纺织服装-服装家纺-服装
A4161: 纺织服装-服装家纺-服装
A4162: 纺织服装-服装家纺-服装
A4163: 纺织服装-服装家纺-服装
A4164: 纺织服装-服装家纺-服装
A4165: 纺织服装-服装家纺-服装
A4166: 纺织服装-服装家纺-服装
A4167: 纺织服装-服装家纺-服装
A4168: 纺织服装-服装家纺-服装
A4169: 纺织服装-服装家纺-服装
A4170: 纺织服装-服装家纺-服装
A4171: 纺织服装-服装家纺-服装
A4172: 纺织服装-纺织制造-印染
A4173: 纺织服装-纺织制造-印染
A4174: 纺织服装-纺织制造-印染
A4175: 纺织服装-纺织制造-印染
A4176: 纺织服装-纺织制造-其他纺织
A4177: 纺织服装-纺织制造-其他纺织
A4178: 纺织服装-纺织制造-其他纺织
A4179: 纺织服装-纺织制造-其他纺织
A4180: 纺织服装-纺织制造-其他纺织
A4181: 纺织服装-纺织制造-其他纺织
A4182: 纺织服装-纺织制造-其他纺织
A4183: 纺织服装-纺织制造-其他纺织
A4184: 纺织服装-纺织制造-其他纺织
A4185: 纺织服装-纺织制造-其他纺织
A4186: 纺织服装-纺织制造-其他纺织
A4187: 纺织服装-纺织制造-其他纺织
A4188: 纺织服装-纺织制造-其他纺织
A4189: 纺织服装-纺织制造-其他纺织
A4190: 纺织服装-纺织制造-其他纺织
A4191: 纺织服装-纺织制造-其他纺织
A4192: 纺织服装-纺织制造-其他纺织
A4193: 纺织服装-纺织制造-其他纺织
A4194: 纺织服装-纺织制造-其他纺织
A4195: 纺织服装-纺织制造-棉纺
A4196: 纺织服装-纺织制造-棉纺
A4197: 纺织服装-纺织制造-棉纺
A4198: 纺织服装-纺织制造-棉纺
A4199: 纺织服装-纺织制造-棉纺
A4200: 纺织服装-纺织制造-棉纺
A4201: 纺织服装-纺织制造-棉纺
A4202: 纺织服装-纺织制造-棉纺
A4203: 纺织服装-纺织制造-辅料
A4204: 纺织服装-纺织制造-辅料
A4205: 纺织服装-纺织制造-辅料
A4206: 纺织服装-纺织制造-辅料
A4207: 房地产-房地产开发-住宅开发
A4208: 房地产-房地产开发-住宅开发
A4209: 房地产-房地产开发-住宅开发
A4210: 房地产-房地产开发-住宅开发
A4211: 房地产-房地产开发-住宅开发
A4212: 房地产-房地产开发-住宅开发
A4213: 房地产-房地产开发-住宅开发
A4214: 房地产-房地产开发-住宅开发
A4215: 房地产-房地产开发-住宅开发
A4216: 房地产-房地产开发-住宅开发
A4217: 房地产-房地产开发-住宅开发
A4218: 房地产-房地产开发-住宅开发
A4219: 房地产-房地产开发-住宅开发
A4220: 房地产-房地产开发-住宅开发
A4221: 房地产-房地产开发-住宅开发
A4222: 房地产-房地产开发-住宅开发
A4223: 房地产-房地产开发-住宅开发
A4224: 房地产-房地产开发-住宅开发
A4225: 房地产-房地产开发-住宅开发
A4226: 房地产-房地产开发-住宅开发
A4227: 房地产-房地产开发-住宅开发
A4228: 房地产-房地产开发-住宅开发
A4229: 房地产-房地产开发-住宅开发
A4230: 房地产-房地产开发-住宅开发
A4231: 房地产-房地产开发-住宅开发
A4232: 房地产-房地产开发-住宅开发
A4233: 房地产-房地产开发-住宅开发
A4234: 房地产-房地产开发-住宅开发
A4235: 房地产-房地产开发-住宅开发
A4236: 房地产-房地产开发-住宅开发
A4237: 房地产-房地产开发-住宅开发
A4238: 房地产-房地产开发-住宅开发
A4239: 房地产-房地产开发-住宅开发
A4240: 房地产-房地产开发-住宅开发
A4241: 房地产-房地产开发-住宅开发
A4242: 房地产-房地产开发-住宅开发
A4243: 房地产-房地产开发-住宅开发
A4244: 房地产-房地产开发-住宅开发
A4245: 房地产-房地产开发-住宅开发
A4246: 房地产-房地产开发-住宅开发
A4247: 房地产-房地产开发-住宅开发
A4248: 房地产-房地产开发-住宅开发
A4249: 房地产-房地产开发-住宅开发
A4250: 房地产-房地产开发-住宅开发
A4251: 房地产-房地产开发-住宅开发
A4252: 房地产-房地产开发-住宅开发
A4253: 房地产-房地产开发-住宅开发
A4254: 房地产-房地产开发-住宅开发
A4255: 房地产-房地产开发-住宅开发
A4256: 房地产-房地产开发-住宅开发
A4257: 房地产-房地产开发-住宅开发
A4258: 房地产-房地产开发-住宅开发
A4259: 房地产-房地产开发-住宅开发
A4260: 房地产-房地产开发-住宅开发
A4261: 房地产-房地产开发-住宅开发
A4262: 房地产-房地产开发-住宅开发
A4263: 房地产-房地产开发-住宅开发
A4264: 房地产-房地产开发-住宅开发
A4265: 房地产-房地产开发-住宅开发
A4266: 房地产-房地产开发-住宅开发
A4267: 房地产-房地产开发-住宅开发
A4268: 房地产-房地产开发-住宅开发
A4269: 房地产-房地产开发-住宅开发
A4270: 房地产-房地产开发-住宅开发
A4271: 房地产-房地产开发-住宅开发
A4272: 房地产-房地产开发-住宅开发
A4273: 房地产-房地产开发-住宅开发
A4274: 房地产-房地产开发-住宅开发
A4275: 房地产-房地产开发-住宅开发
A4276: 房地产-房地产开发-住宅开发
A4277: 房地产-房地产开发-住宅开发
A4278: 房地产-房地产开发-住宅开发
A4279: 房地产-房地产开发-住宅开发
A4280: 房地产-房地产开发-住宅开发
A4281: 房地产-房地产开发-住宅开发
A4282: 房地产-房地产开发-住宅开发
A4283: 房地产-房地产开发-住宅开发
A4284: 房地产-房地产开发-商业地产
A4285: 房地产-房地产开发-商业地产
A4286: 房地产-房地产开发-商业地产
A4287: 房地产-房地产开发-商业地产
A4288: 房地产-房地产开发-商业地产
A4289: 房地产-房地产开发-商业地产
A4290: 房地产-房地产开发-商业地产
A4291: 房地产-房地产开发-商业地产
A4292: 房地产-房地产开发-商业地产
A4293: 房地产-房地产开发-产业地产
A4294: 房地产-房地产开发-产业地产
A4295: 房地产-房地产开发-产业地产
A4296: 房地产-房地产开发-产业地产
A4297: 房地产-房地产开发-产业地产
A4298: 房地产-房地产开发-产业地产
A4299: 房地产-房地产开发-产业地产
A4300: 房地产-房地产开发-产业地产
A4301: 房地产-房地产开发-产业地产
A4302: 房地产-房地产开发-产业地产
A4303: 房地产-房地产服务-房地产服务Ⅲ
A4304: 房地产-房地产服务-房地产服务Ⅲ
A4305: 房地产-房地产服务-房地产服务Ⅲ
A4306: 房地产-房地产服务-房地产服务Ⅲ
A4307: 房地产-房地产服务-房地产服务Ⅲ
A4308: 房地产-房地产服务-房地产服务Ⅲ
A4309: 房地产-房地产服务-房地产服务Ⅲ
A4310: 房地产-房地产服务-房地产服务Ⅲ
A4311: 电子-消费电子-消费电子零部件及组装
A4312: 电子-消费电子-消费电子零部件及组装
A4313: 电子-消费电子-消费电子零部件及组装
A4314: 电子-消费电子-消费电子零部件及组装
A4315: 电子-消费电子-消费电子零部件及组装
A4316: 电子-消费电子-消费电子零部件及组装
A4317: 电子-消费电子-消费电子零部件及组装
A4318: 电子-消费电子-消费电子零部件及组装
A4319: 电子-消费电子-消费电子零部件及组装
A4320: 电子-消费电子-消费电子零部件及组装
A4321: 电子-消费电子-消费电子零部件及组装
A4322: 电子-消费电子-消费电子零部件及组装
A4323: 电子-消费电子-消费电子零部件及组装
A4324: 电子-消费电子-消费电子零部件及组装
A4325: 电子-消费电子-消费电子零部件及组装
A4326: 电子-消费电子-消费电子零部件及组装
A4327: 电子-消费电子-消费电子零部件及组装
A4328: 电子-消费电子-消费电子零部件及组装
A4329: 电子-消费电子-消费电子零部件及组装
A4330: 电子-消费电子-消费电子零部件及组装
A4331: 电子-消费电子-消费电子零部件及组装
A4332: 电子-消费电子-消费电子零部件及组装
A4333: 电子-消费电子-消费电子零部件及组装
A4334: 电子-消费电子-消费电子零部件及组装
A4335: 电子-消费电子-消费电子零部件及组装
A4336: 电子-消费电子-消费电子零部件及组装
A4337: 电子-消费电子-消费电子零部件及组装
A4338: 电子-消费电子-消费电子零部件及组装
A4339: 电子-消费电子-消费电子零部件及组装
A4340: 电子-消费电子-消费电子零部件及组装
A4341: 电子-消费电子-消费电子零部件及组装
A4342: 电子-消费电子-消费电子零部件及组装
A4343: 电子-消费电子-消费电子零部件及组装
A4344: 电子-消费电子-消费电子零部件及组装
A4345: 电子-消费电子-消费电子零部件及组装
A4346: 电子-消费电子-消费电子零部件及组装
A4347: 电子-消费电子-消费电子零部件及组装
A4348: 电子-消费电子-消费电子零部件及组装
A4349: 电子-消费电子-消费电子零部件及组装
A4350: 电子-消费电子-消费电子零部件及组装
A4351: 电子-消费电子-消费电子零部件及组装
A4352: 电子-消费电子-消费电子零部件及组装
A4353: 电子-消费电子-消费电子零部件及组装
A4354: 电子-消费电子-消费电子零部件及组装
A4355: 电子-消费电子-消费电子零部件及组装
A4356: 电子-消费电子-消费电子零部件及组装
A4357: 电子-消费电子-消费电子零部件及组装
A4358: 电子-消费电子-消费电子零部件及组装
A4359: 电子-消费电子-消费电子零部件及组装
A4360: 电子-消费电子-消费电子零部件及组装
A4361: 电子-消费电子-消费电子零部件及组装
A4362: 电子-消费电子-消费电子零部件及组装
A4363: 电子-消费电子-消费电子零部件及组装
A4364: 电子-消费电子-消费电子零部件及组装
A4365: 电子-消费电子-消费电子零部件及组装
A4366: 电子-消费电子-消费电子零部件及组装
A4367: 电子-消费电子-消费电子零部件及组装
A4368: 电子-消费电子-消费电子零部件及组装
A4369: 电子-消费电子-消费电子零部件及组装
A4370: 电子-消费电子-消费电子零部件及组装
A4371: 电子-消费电子-消费电子零部件及组装
A4372: 电子-消费电子-消费电子零部件及组装
A4373: 电子-消费电子-消费电子零部件及组装
A4374: 电子-消费电子-消费电子零部件及组装
A4375: 电子-消费电子-消费电子零部件及组装
A4376: 电子-消费电子-消费电子零部件及组装
A4377: 电子-消费电子-消费电子零部件及组装
A4378: 电子-消费电子-消费电子零部件及组装
A4379: 电子-消费电子-消费电子零部件及组装
A4380: 电子-消费电子-消费电子零部件及组装
A4381: 电子-消费电子-消费电子零部件及组装
A4382: 电子-消费电子-消费电子零部件及组装
A4383: 电子-消费电子-消费电子零部件及组装
A4384: 电子-消费电子-消费电子零部件及组装
A4385: 电子-消费电子-消费电子零部件及组装
A4386: 电子-消费电子-消费电子零部件及组装
A4387: 电子-消费电子-消费电子零部件及组装
A4388: 电子-消费电子-消费电子零部件及组装
A4389: 电子-消费电子-消费电子零部件及组装
A4390: 电子-消费电子-消费电子零部件及组装
A4391: 电子-消费电子-消费电子零部件及组装
A4392: 电子-消费电子-消费电子零部件及组装
A4393: 电子-消费电子-消费电子零部件及组装
A4394: 电子-消费电子-消费电子零部件及组装
A4395: 电子-消费电子-消费电子零部件及组装
A4396: 电子-消费电子-消费电子零部件及组装
A4397: 电子-消费电子-消费电子零部件及组装
A4398: 电子-消费电子-消费电子零部件及组装
A4399: 电子-消费电子-消费电子零部件及组装
A4400: 电子-消费电子-消费电子零部件及组装
A4401: 电子-消费电子-品牌消费电子
A4402: 电子-消费电子-品牌消费电子
A4403: 电子-消费电子-品牌消费电子
A4404: 电子-消费电子-品牌消费电子
A4405: 电子-消费电子-品牌消费电子
A4406: 电子-消费电子-品牌消费电子
A4407: 电子-消费电子-品牌消费电子
A4408: 电子-消费电子-品牌消费电子
A4409: 电子-其他电子-其他电子Ⅲ
A4410: 电子-其他电子-其他电子Ⅲ
A4411: 电子-其他电子-其他电子Ⅲ
A4412: 电子-其他电子-其他电子Ⅲ
A4413: 电子-其他电子-其他电子Ⅲ
A4414: 电子-其他电子-其他电子Ⅲ
A4415: 电子-其他电子-其他电子Ⅲ
A4416: 电子-其他电子-其他电子Ⅲ
A4417: 电子-其他电子-其他电子Ⅲ
A4418: 电子-其他电子-其他电子Ⅲ
A4419: 电子-其他电子-其他电子Ⅲ
A4420: 电子-其他电子-其他电子Ⅲ
A4421: 电子-其他电子-其他电子Ⅲ
A4422: 电子-其他电子-其他电子Ⅲ
A4423: 电子-其他电子-其他电子Ⅲ
A4424: 电子-其他电子-其他电子Ⅲ
A4425: 电子-其他电子-其他电子Ⅲ
A4426: 电子-其他电子-其他电子Ⅲ
A4427: 电子-其他电子-其他电子Ⅲ
A4428: 电子-其他电子-其他电子Ⅲ
A4429: 电子-其他电子-其他电子Ⅲ
A4430: 电子-其他电子-其他电子Ⅲ
A4431: 电子-其他电子-其他电子Ⅲ
A4432: 电子-其他电子-其他电子Ⅲ
A4433: 电子-其他电子-其他电子Ⅲ
A4434: 电子-其他电子-其他电子Ⅲ
A4435: 电子-其他电子-其他电子Ⅲ
A4436: 电子-其他电子-其他电子Ⅲ
A4437: 电子-其他电子-其他电子Ⅲ
A4438: 电子-其他电子-其他电子Ⅲ
A4439: 电子-其他电子-其他电子Ⅲ
A4440: 电子-其他电子-其他电子Ⅲ
A4441: 电子-其他电子-其他电子Ⅲ
A4442: 电子-其他电子-其他电子Ⅲ
A4443: 电子-其他电子-其他电子Ⅲ
A4444: 电子-其他电子-其他电子Ⅲ
A4445: 电子-其他电子-其他电子Ⅲ
A4446: 电子-光学光电子-面板
A4447: 电子-光学光电子-面板
A4448: 电子-光学光电子-面板
A4449: 电子-光学光电子-面板
A4450: 电子-光学光电子-面板
A4451: 电子-光学光电子-面板
A4452: 电子-光学光电子-面板
A4453: 电子-光学光电子-面板
A4454: 电子-光学光电子-面板
A4455: 电子-光学光电子-面板
A4456: 电子-光学光电子-面板
A4457: 电子-光学光电子-面板
A4458: 电子-光学光电子-面板
A4459: 电子-光学光电子-面板
A4460: 电子-光学光电子-面板
A4461: 电子-光学光电子-面板
A4462: 电子-光学光电子-面板
A4463: 电子-光学光电子-面板
A4464: 电子-光学光电子-面板
A4465: 电子-光学光电子-面板
A4466: 电子-光学光电子-面板
A4467: 电子-光学光电子-面板
A4468: 电子-光学光电子-面板
A4469: 电子-光学光电子-面板
A4470: 电子-光学光电子-面板
A4471: 电子-光学光电子-面板
A4472: 电子-光学光电子-面板
A4473: 电子-光学光电子-面板
A4474: 电子-光学光电子-面板
A4475: 电子-光学光电子-面板
A4476: 电子-光学光电子-面板
A4477: 电子-光学光电子-面板
A4478: 电子-光学光电子-面板
A4479: 电子-光学光电子-面板
A4480: 电子-光学光电子-面板
A4481: 电子-光学光电子-面板
A4482: 电子-光学光电子-面板
A4483: 电子-光学光电子-面板
A4484: 电子-光学光电子-面板
A4485: 电子-光学光电子-面板
A4486: 电子-光学光电子-面板
A4487: 电子-光学光电子-面板
A4488: 电子-光学光电子-光学元件
A4489: 电子-光学光电子-光学元件
A4490: 电子-光学光电子-光学元件
A4491: 电子-光学光电子-光学元件
A4492: 电子-光学光电子-光学元件
A4493: 电子-光学光电子-光学元件
A4494: 电子-光学光电子-光学元件
A4495: 电子-光学光电子-光学元件
A4496: 电子-光学光电子-光学元件
A4497: 电子-光学光电子-光学元件
A4498: 电子-光学光电子-光学元件
A4499: 电子-光学光电子-光学元件
A4500: 电子-光学光电子-光学元件
A4501: 电子-光学光电子-光学元件
A4502: 电子-光学光电子-光学元件
A4503: 电子-光学光电子-光学元件
A4504: 电子-光学光电子-光学元件
A4505: 电子-光学光电子-光学元件
A4506: 电子-光学光电子-光学元件
A4507: 电子-光学光电子-光学元件
A4508: 电子-光学光电子-光学元件
A4509: 电子-光学光电子-光学元件
A4510: 电子-光学光电子-LED
A4511: 电子-光学光电子-LED
A4512: 电子-光学光电子-LED
A4513: 电子-光学光电子-LED
A4514: 电子-光学光电子-LED
A4515: 电子-光学光电子-LED
A4516: 电子-光学光电子-LED
A4517: 电子-光学光电子-LED
A4518: 电子-光学光电子-LED
A4519: 电子-光学光电子-LED
A4520: 电子-光学光电子-LED
A4521: 电子-光学光电子-LED
A4522: 电子-光学光电子-LED
A4523: 电子-光学光电子-LED
A4524: 电子-光学光电子-LED
A4525: 电子-光学光电子-LED
A4526: 电子-光学光电子-LED
A4527: 电子-光学光电子-LED
A4528: 电子-光学光电子-LED
A4529: 电子-光学光电子-LED
A4530: 电子-光学光电子-LED
A4531: 电子-光学光电子-LED
A4532: 电子-光学光电子-LED
A4533: 电子-光学光电子-LED
A4534: 电子-光学光电子-LED
A4535: 电子-光学光电子-LED
A4536: 电子-光学光电子-LED
A4537: 电子-光学光电子-LED
A4538: 电子-光学光电子-LED
A4539: 电子-光学光电子-LED
A4540: 电子-光学光电子-LED
A4541: 电子-光学光电子-LED
A4542: 电子-光学光电子-LED
A4543: 电子-光学光电子-LED
A4544: 电子-光学光电子-LED
A4545: 电子-光学光电子-LED
A4546: 电子-光学光电子-LED
A4547: 电子-光学光电子-LED
A4548: 电子-光学光电子-LED
A4549: 电子-光学光电子-LED
A4550: 电子-光学光电子-LED
A4551: 电子-光学光电子-LED
A4552: 电子-电子化学品-电子化学品Ⅲ
A4553: 电子-电子化学品-电子化学品Ⅲ
A4554: 电子-电子化学品-电子化学品Ⅲ
A4555: 电子-电子化学品-电子化学品Ⅲ
A4556: 电子-电子化学品-电子化学品Ⅲ
A4557: 电子-电子化学品-电子化学品Ⅲ
A4558: 电子-电子化学品-电子化学品Ⅲ
A4559: 电子-电子化学品-电子化学品Ⅲ
A4560: 电子-电子化学品-电子化学品Ⅲ
A4561: 电子-电子化学品-电子化学品Ⅲ
A4562: 电子-电子化学品-电子化学品Ⅲ
A4563: 电子-电子化学品-电子化学品Ⅲ
A4564: 电子-电子化学品-电子化学品Ⅲ
A4565: 电子-电子化学品-电子化学品Ⅲ
A4566: 电子-电子化学品-电子化学品Ⅲ
A4567: 电子-电子化学品-电子化学品Ⅲ
A4568: 电子-电子化学品-电子化学品Ⅲ
A4569: 电子-电子化学品-电子化学品Ⅲ
A4570: 电子-电子化学品-电子化学品Ⅲ
A4571: 电子-电子化学品-电子化学品Ⅲ
A4572: 电子-电子化学品-电子化学品Ⅲ
A4573: 电子-电子化学品-电子化学品Ⅲ
A4574: 电子-电子化学品-电子化学品Ⅲ
A4575: 电子-电子化学品-电子化学品Ⅲ
A4576: 电子-电子化学品-电子化学品Ⅲ
A4577: 电子-电子化学品-电子化学品Ⅲ
A4578: 电子-电子化学品-电子化学品Ⅲ
A4579: 电子-电子化学品-电子化学品Ⅲ
A4580: 电子-电子化学品-电子化学品Ⅲ
A4581: 电子-电子化学品-电子化学品Ⅲ
A4582: 电子-电子化学品-电子化学品Ⅲ
A4583: 电子-电子化学品-电子化学品Ⅲ
A4584: 电子-电子化学品-电子化学品Ⅲ
A4585: 电子-电子化学品-电子化学品Ⅲ
A4586: 电子-电子化学品-电子化学品Ⅲ
A4587: 电子-电子化学品-电子化学品Ⅲ
A4588: 电子-半导体及元件-印制电路板
A4589: 电子-半导体及元件-印制电路板
A4590: 电子-半导体及元件-印制电路板
A4591: 电子-半导体及元件-印制电路板
A4592: 电子-半导体及元件-印制电路板
A4593: 电子-半导体及元件-印制电路板
A4594: 电子-半导体及元件-印制电路板
A4595: 电子-半导体及元件-印制电路板
A4596: 电子-半导体及元件-印制电路板
A4597: 电子-半导体及元件-印制电路板
A4598: 电子-半导体及元件-印制电路板
A4599: 电子-半导体及元件-印制电路板
A4600: 电子-半导体及元件-印制电路板
A4601: 电子-半导体及元件-印制电路板
A4602: 电子-半导体及元件-印制电路板
A4603: 电子-半导体及元件-印制电路板
A4604: 电子-半导体及元件-印制电路板
A4605: 电子-半导体及元件-印制电路板
A4606: 电子-半导体及元件-印制电路板
A4607: 电子-半导体及元件-印制电路板
A4608: 电子-半导体及元件-印制电路板
A4609: 电子-半导体及元件-印制电路板
A4610: 电子-半导体及元件-印制电路板
A4611: 电子-半导体及元件-印制电路板
A4612: 电子-半导体及元件-印制电路板
A4613: 电子-半导体及元件-印制电路板
A4614: 电子-半导体及元件-印制电路板
A4615: 电子-半导体及元件-印制电路板
A4616: 电子-半导体及元件-印制电路板
A4617: 电子-半导体及元件-印制电路板
A4618: 电子-半导体及元件-印制电路板
A4619: 电子-半导体及元件-印制电路板
A4620: 电子-半导体及元件-印制电路板
A4621: 电子-半导体及元件-印制电路板
A4622: 电子-半导体及元件-印制电路板
A4623: 电子-半导体及元件-印制电路板
A4624: 电子-半导体及元件-印制电路板
A4625: 电子-半导体及元件-印制电路板
A4626: 电子-半导体及元件-印制电路板
A4627: 电子-半导体及元件-印制电路板
A4628: 电子-半导体及元件-印制电路板
A4629: 电子-半导体及元件-集成电路制造
A4630: 电子-半导体及元件-集成电路制造
A4631: 电子-半导体及元件-集成电路制造
A4632: 电子-半导体及元件-集成电路制造
A4633: 电子-半导体及元件-集成电路制造
A4634: 电子-半导体及元件-集成电路制造
A4635: 电子-半导体及元件-集成电路设计
A4636: 电子-半导体及元件-集成电路设计
A4637: 电子-半导体及元件-集成电路设计
A4638: 电子-半导体及元件-集成电路设计
A4639: 电子-半导体及元件-集成电路设计
A4640: 电子-半导体及元件-集成电路设计
A4641: 电子-半导体及元件-集成电路设计
A4642: 电子-半导体及元件-集成电路设计
A4643: 电子-半导体及元件-集成电路设计
A4644: 电子-半导体及元件-集成电路设计
A4645: 电子-半导体及元件-集成电路设计
A4646: 电子-半导体及元件-集成电路设计
A4647: 电子-半导体及元件-集成电路设计
A4648: 电子-半导体及元件-集成电路设计
A4649: 电子-半导体及元件-集成电路设计
A4650: 电子-半导体及元件-集成电路设计
A4651: 电子-半导体及元件-集成电路设计
A4652: 电子-半导体及元件-集成电路设计
A4653: 电子-半导体及元件-集成电路设计
A4654: 电子-半导体及元件-集成电路设计
A4655: 电子-半导体及元件-集成电路设计
A4656: 电子-半导体及元件-集成电路设计
A4657: 电子-半导体及元件-集成电路设计
A4658: 电子-半导体及元件-集成电路设计
A4659: 电子-半导体及元件-集成电路设计
A4660: 电子-半导体及元件-集成电路设计
A4661: 电子-半导体及元件-集成电路设计
A4662: 电子-半导体及元件-集成电路设计
A4663: 电子-半导体及元件-集成电路设计
A4664: 电子-半导体及元件-集成电路设计
A4665: 电子-半导体及元件-集成电路设计
A4666: 电子-半导体及元件-集成电路设计
A4667: 电子-半导体及元件-集成电路设计
A4668: 电子-半导体及元件-集成电路设计
A4669: 电子-半导体及元件-集成电路设计
A4670: 电子-半导体及元件-集成电路设计
A4671: 电子-半导体及元件-集成电路设计
A4672: 电子-半导体及元件-集成电路设计
A4673: 电子-半导体及元件-集成电路设计
A4674: 电子-半导体及元件-集成电路设计
A4675: 电子-半导体及元件-集成电路设计
A4676: 电子-半导体及元件-集成电路设计
A4677: 电子-半导体及元件-集成电路设计
A4678: 电子-半导体及元件-集成电路设计
A4679: 电子-半导体及元件-集成电路设计
A4680: 电子-半导体及元件-集成电路设计
A4681: 电子-半导体及元件-集成电路设计
A4682: 电子-半导体及元件-集成电路设计
A4683: 电子-半导体及元件-集成电路设计
A4684: 电子-半导体及元件-集成电路设计
A4685: 电子-半导体及元件-集成电路设计
A4686: 电子-半导体及元件-集成电路设计
A4687: 电子-半导体及元件-集成电路设计
A4688: 电子-半导体及元件-集成电路设计
A4689: 电子-半导体及元件-集成电路设计
A4690: 电子-半导体及元件-集成电路设计
A4691: 电子-半导体及元件-集成电路设计
A4692: 电子-半导体及元件-集成电路设计
A4693: 电子-半导体及元件-集成电路设计
A4694: 电子-半导体及元件-集成电路设计
A4695: 电子-半导体及元件-集成电路设计
A4696: 电子-半导体及元件-集成电路设计
A4697: 电子-半导体及元件-集成电路设计
A4698: 电子-半导体及元件-集成电路设计
A4699: 电子-半导体及元件-集成电路设计
A4700: 电子-半导体及元件-集成电路设计
A4701: 电子-半导体及元件-集成电路设计
A4702: 电子-半导体及元件-集成电路设计
A4703: 电子-半导体及元件-集成电路设计
A4704: 电子-半导体及元件-集成电路设计
A4705: 电子-半导体及元件-集成电路设计
A4706: 电子-半导体及元件-集成电路设计
A4707: 电子-半导体及元件-集成电路设计
A4708: 电子-半导体及元件-集成电路设计
A4709: 电子-半导体及元件-集成电路设计
A4710: 电子-半导体及元件-集成电路设计
A4711: 电子-半导体及元件-集成电路封测
A4712: 电子-半导体及元件-集成电路封测
A4713: 电子-半导体及元件-集成电路封测
A4714: 电子-半导体及元件-集成电路封测
A4715: 电子-半导体及元件-集成电路封测
A4716: 电子-半导体及元件-集成电路封测
A4717: 电子-半导体及元件-集成电路封测
A4718: 电子-半导体及元件-集成电路封测
A4719: 电子-半导体及元件-集成电路封测
A4720: 电子-半导体及元件-集成电路封测
A4721: 电子-半导体及元件-集成电路封测
A4722: 电子-半导体及元件-集成电路封测
A4723: 电子-半导体及元件-集成电路封测
A4724: 电子-半导体及元件-分立器件
A4725: 电子-半导体及元件-分立器件
A4726: 电子-半导体及元件-分立器件
A4727: 电子-半导体及元件-分立器件
A4728: 电子-半导体及元件-分立器件
A4729: 电子-半导体及元件-分立器件
A4730: 电子-半导体及元件-分立器件
A4731: 电子-半导体及元件-分立器件
A4732: 电子-半导体及元件-分立器件
A4733: 电子-半导体及元件-分立器件
A4734: 电子-半导体及元件-分立器件
A4735: 电子-半导体及元件-分立器件
A4736: 电子-半导体及元件-分立器件
A4737: 电子-半导体及元件-分立器件
A4738: 电子-半导体及元件-分立器件
A4739: 电子-半导体及元件-分立器件
A4740: 电子-半导体及元件-分立器件
A4741: 电子-半导体及元件-被动元件
A4742: 电子-半导体及元件-被动元件
A4743: 电子-半导体及元件-被动元件
A4744: 电子-半导体及元件-被动元件
A4745: 电子-半导体及元件-被动元件
A4746: 电子-半导体及元件-被动元件
A4747: 电子-半导体及元件-被动元件
A4748: 电子-半导体及元件-被动元件
A4749: 电子-半导体及元件-被动元件
A4750: 电子-半导体及元件-被动元件
A4751: 电子-半导体及元件-被动元件
A4752: 电子-半导体及元件-被动元件
A4753: 电子-半导体及元件-被动元件
A4754: 电子-半导体及元件-半导体设备
A4755: 电子-半导体及元件-半导体设备
A4756: 电子-半导体及元件-半导体设备
A4757: 电子-半导体及元件-半导体设备
A4758: 电子-半导体及元件-半导体设备
A4759: 电子-半导体及元件-半导体设备
A4760: 电子-半导体及元件-半导体设备
A4761: 电子-半导体及元件-半导体设备
A4762: 电子-半导体及元件-半导体设备
A4763: 电子-半导体及元件-半导体设备
A4764: 电子-半导体及元件-半导体设备
A4765: 电子-半导体及元件-半导体设备
A4766: 电子-半导体及元件-半导体设备
A4767: 电子-半导体及元件-半导体设备
A4768: 电子-半导体及元件-半导体设备
A4769: 电子-半导体及元件-半导体设备
A4770: 电子-半导体及元件-半导体设备
A4771: 电子-半导体及元件-半导体材料
A4772: 电子-半导体及元件-半导体材料
A4773: 电子-半导体及元件-半导体材料
A4774: 电子-半导体及元件-半导体材料
A4775: 电子-半导体及元件-半导体材料
A4776: 电子-半导体及元件-半导体材料
A4777: 电子-半导体及元件-半导体材料
A4778: 电子-半导体及元件-半导体材料
A4779: 电子-半导体及元件-半导体材料
A4780: 电子-半导体及元件-半导体材料
A4781: 电子-半导体及元件-半导体材料
A4782: 电子-半导体及元件-半导体材料
A4783: 电子-半导体及元件-半导体材料
A4784: 电子-半导体及元件-半导体材料
A4785: 电子-半导体及元件-半导体材料
A4786: 电子-半导体及元件-半导体材料
A4787: 电力设备-电力设备-线缆部件及其他
A4788: 电力设备-电力设备-线缆部件及其他
A4789: 电力设备-电力设备-线缆部件及其他
A4790: 电力设备-电力设备-线缆部件及其他
A4791: 电力设备-电力设备-线缆部件及其他
A4792: 电力设备-电力设备-线缆部件及其他
A4793: 电力设备-电力设备-线缆部件及其他
A4794: 电力设备-电力设备-线缆部件及其他
A4795: 电力设备-电力设备-线缆部件及其他
A4796: 电力设备-电力设备-线缆部件及其他
A4797: 电力设备-电力设备-线缆部件及其他
A4798: 电力设备-电力设备-线缆部件及其他
A4799: 电力设备-电力设备-线缆部件及其他
A4800: 电力设备-电力设备-线缆部件及其他
A4801: 电力设备-电力设备-线缆部件及其他
A4802: 电力设备-电力设备-线缆部件及其他
A4803: 电力设备-电力设备-线缆部件及其他
A4804: 电力设备-电力设备-线缆部件及其他
A4805: 电力设备-电力设备-线缆部件及其他
A4806: 电力设备-电力设备-线缆部件及其他
A4807: 电力设备-电力设备-线缆部件及其他
A4808: 电力设备-电力设备-线缆部件及其他
A4809: 电力设备-电力设备-线缆部件及其他
A4810: 电力设备-电力设备-线缆部件及其他
A4811: 电力设备-电力设备-线缆部件及其他
A4812: 电力设备-电力设备-线缆部件及其他
A4813: 电力设备-电力设备-线缆部件及其他
A4814: 电力设备-电力设备-线缆部件及其他
A4815: 电力设备-电力设备-线缆部件及其他
A4816: 电力设备-电力设备-线缆部件及其他
A4817: 电力设备-电力设备-线缆部件及其他
A4818: 电力设备-电力设备-线缆部件及其他
A4819: 电力设备-电力设备-线缆部件及其他
A4820: 电力设备-电力设备-线缆部件及其他
A4821: 电力设备-电力设备-线缆部件及其他
A4822: 电力设备-电力设备-线缆部件及其他
A4823: 电力设备-电力设备-输变电设备
A4824: 电力设备-电力设备-输变电设备
A4825: 电力设备-电力设备-输变电设备
A4826: 电力设备-电力设备-输变电设备
A4827: 电力设备-电力设备-输变电设备
A4828: 电力设备-电力设备-输变电设备
A4829: 电力设备-电力设备-输变电设备
A4830: 电力设备-电力设备-输变电设备
A4831: 电力设备-电力设备-输变电设备
A4832: 电力设备-电力设备-输变电设备
A4833: 电力设备-电力设备-输变电设备
A4834: 电力设备-电力设备-输变电设备
A4835: 电力设备-电力设备-输变电设备
A4836: 电力设备-电力设备-输变电设备
A4837: 电力设备-电力设备-输变电设备
A4838: 电力设备-电力设备-输变电设备
A4839: 电力设备-电力设备-输变电设备
A4840: 电力设备-电力设备-输变电设备
A4841: 电力设备-电力设备-输变电设备
A4842: 电力设备-电力设备-输变电设备
A4843: 电力设备-电力设备-输变电设备
A4844: 电力设备-电力设备-输变电设备
A4845: 电力设备-电力设备-输变电设备
A4846: 电力设备-电力设备-输变电设备
A4847: 电力设备-电力设备-输变电设备
A4848: 电力设备-电力设备-输变电设备
A4849: 电力设备-电力设备-输变电设备
A4850: 电力设备-电力设备-输变电设备
A4851: 电力设备-电力设备-输变电设备
A4852: 电力设备-电力设备-输变电设备
A4853: 电力设备-电力设备-输变电设备
A4854: 电力设备-电力设备-输变电设备
A4855: 电力设备-电力设备-输变电设备
A4856: 电力设备-电力设备-输变电设备
A4857: 电力设备-电力设备-输变电设备
A4858: 电力设备-电力设备-输变电设备
A4859: 电力设备-电力设备-输变电设备
A4860: 电力设备-电力设备-输变电设备
A4861: 电力设备-电力设备-输变电设备
A4862: 电力设备-电力设备-输变电设备
A4863: 电力设备-电力设备-输变电设备
A4864: 电力设备-电力设备-输变电设备
A4865: 电力设备-电力设备-输变电设备
A4866: 电力设备-电力设备-输变电设备
A4867: 电力设备-电力设备-输变电设备
A4868: 电力设备-电力设备-输变电设备
A4869: 电力设备-电力设备-输变电设备
A4870: 电力设备-电力设备-输变电设备
A4871: 电力设备-电力设备-输变电设备
A4872: 电力设备-电力设备-输变电设备
A4873: 电力设备-电力设备-输变电设备
A4874: 电力设备-电力设备-其他电源设备
A4875: 电力设备-电力设备-其他电源设备
A4876: 电力设备-电力设备-其他电源设备
A4877: 电力设备-电力设备-其他电源设备
A4878: 电力设备-电力设备-其他电源设备
A4879: 电力设备-电力设备-其他电源设备
A4880: 电力设备-电力设备-其他电源设备
A4881: 电力设备-电力设备-其他电源设备
A4882: 电力设备-电力设备-其他电源设备
A4883: 电力设备-电力设备-其他电源设备
A4884: 电力设备-电力设备-其他电源设备
A4885: 电力设备-电力设备-其他电源设备
A4886: 电力设备-电力设备-其他电源设备
A4887: 电力设备-电力设备-其他电源设备
A4888: 电力设备-电力设备-其他电源设备
A4889: 电力设备-电力设备-其他电源设备
A4890: 电力设备-电力设备-其他电源设备
A4891: 电力设备-电力设备-其他电源设备
A4892: 电力设备-电力设备-其他电源设备
A4893: 电力设备-电力设备-其他电源设备
A4894: 电力设备-电力设备-其他电源设备
A4895: 电力设备-电力设备-其他电源设备
A4896: 电力设备-电力设备-其他电源设备
A4897: 电力设备-电力设备-其他电源设备
A4898: 电力设备-电力设备-其他电源设备
A4899: 电力设备-电力设备-其他电源设备
A4900: 电力设备-电力设备-其他电源设备
A4901: 电力设备-电力设备-光伏设备
A4902: 电力设备-电力设备-光伏设备
A4903: 电力设备-电力设备-光伏设备
A4904: 电力设备-电力设备-光伏设备
A4905: 电力设备-电力设备-光伏设备
A4906: 电力设备-电力设备-光伏设备
A4907: 电力设备-电力设备-光伏设备
A4908: 电力设备-电力设备-光伏设备
A4909: 电力设备-电力设备-光伏设备
A4910: 电力设备-电力设备-光伏设备
A4911: 电力设备-电力设备-光伏设备
A4912: 电力设备-电力设备-光伏设备
A4913: 电力设备-电力设备-光伏设备
A4914: 电力设备-电力设备-光伏设备
A4915: 电力设备-电力设备-光伏设备
A4916: 电力设备-电力设备-光伏设备
A4917: 电力设备-电力设备-光伏设备
A4918: 电力设备-电力设备-光伏设备
A4919: 电力设备-电力设备-光伏设备
A4920: 电力设备-电力设备-光伏设备
A4921: 电力设备-电力设备-光伏设备
A4922: 电力设备-电力设备-光伏设备
A4923: 电力设备-电力设备-光伏设备
A4924: 电力设备-电力设备-光伏设备
A4925: 电力设备-电力设备-光伏设备
A4926: 电力设备-电力设备-光伏设备
A4927: 电力设备-电力设备-光伏设备
A4928: 电力设备-电力设备-光伏设备
A4929: 电力设备-电力设备-光伏设备
A4930: 电力设备-电力设备-光伏设备
A4931: 电力设备-电力设备-光伏设备
A4932: 电力设备-电力设备-光伏设备
A4933: 电力设备-电力设备-光伏设备
A4934: 电力设备-电力设备-光伏设备
A4935: 电力设备-电力设备-光伏设备
A4936: 电力设备-电力设备-光伏设备
A4937: 电力设备-电力设备-光伏设备
A4938: 电力设备-电力设备-光伏设备
A4939: 电力设备-电力设备-光伏设备
A4940: 电力设备-电力设备-光伏设备
A4941: 电力设备-电力设备-光伏设备
A4942: 电力设备-电力设备-光伏设备
A4943: 电力设备-电力设备-光伏设备
A4944: 电力设备-电力设备-光伏设备
A4945: 电力设备-电力设备-光伏设备
A4946: 电力设备-电力设备-光伏设备
A4947: 电力设备-电力设备-光伏设备
A4948: 电力设备-电力设备-光伏设备
A4949: 电力设备-电力设备-光伏设备
A4950: 电力设备-电力设备-光伏设备
A4951: 电力设备-电力设备-光伏设备
A4952: 电力设备-电力设备-光伏设备
A4953: 电力设备-电力设备-光伏设备
A4954: 电力设备-电力设备-光伏设备
A4955: 电力设备-电力设备-光伏设备
A4956: 电力设备-电力设备-光伏设备
A4957: 电力设备-电力设备-光伏设备
A4958: 电力设备-电力设备-光伏设备
A4959: 电力设备-电力设备-光伏设备
A4960: 电力设备-电力设备-光伏设备
A4961: 电力设备-电力设备-光伏设备
A4962: 电力设备-电力设备-光伏设备
A4963: 电力设备-电力设备-光伏设备
A4964: 电力设备-电力设备-光伏设备
A4965: 电力设备-电力设备-光伏设备
A4966: 电力设备-电力设备-风电设备
A4967: 电力设备-电力设备-风电设备
A4968: 电力设备-电力设备-风电设备
A4969: 电力设备-电力设备-风电设备
A4970: 电力设备-电力设备-风电设备
A4971: 电力设备-电力设备-风电设备
A4972: 电力设备-电力设备-风电设备
A4973: 电力设备-电力设备-风电设备
A4974: 电力设备-电力设备-风电设备
A4975: 电力设备-电力设备-风电设备
A4976: 电力设备-电力设备-风电设备
A4977: 电力设备-电力设备-风电设备
A4978: 电力设备-电力设备-风电设备
A4979: 电力设备-电力设备-风电设备
A4980: 电力设备-电力设备-风电设备
A4981: 电力设备-电力设备-风电设备
A4982: 电力设备-电力设备-风电设备
A4983: 电力设备-电力设备-风电设备
A4984: 电力设备-电力设备-风电设备
A4985: 电力设备-电力设备-风电设备
A4986: 电力设备-电力设备-风电设备
A4987: 电力设备-电力设备-风电设备
A4988: 电力设备-电力设备-风电设备
A4989: 电力设备-电力设备-风电设备
A4990: 电力设备-电力设备-风电设备
A4991: 电力设备-电力设备-风电设备
A4992: 电力设备-电力设备-电气自控设备
A4993: 电力设备-电力设备-电气自控设备
A4994: 电力设备-电力设备-电气自控设备
A4995: 电力设备-电力设备-电气自控设备
A4996: 电力设备-电力设备-电气自控设备
A4997: 电力设备-电力设备-电气自控设备
A4998: 电力设备-电力设备-电气自控设备
A4999: 电力设备-电力设备-电气自控设备
A5000: 电力设备-电力设备-电气自控设备
A5001: 电力设备-电力设备-电气自控设备
A5002: 电力设备-电力设备-电气自控设备
A5003: 电力设备-电力设备-电气自控设备
A5004: 电力设备-电力设备-电气自控设备
A5005: 电力设备-电力设备-电气自控设备
A5006: 电力设备-电力设备-电气自控设备
A5007: 电力设备-电力设备-电气自控设备
A5008: 电力设备-电力设备-电气自控设备
A5009: 电力设备-电力设备-电气自控设备
A5010: 电力设备-电力设备-电气自控设备
A5011: 电力设备-电力设备-电气自控设备
A5012: 电力设备-电力设备-电气自控设备
A5013: 电力设备-电力设备-电气自控设备
A5014: 电力设备-电力设备-电气自控设备
A5015: 电力设备-电力设备-电气自控设备
A5016: 电力设备-电力设备-电气自控设备
A5017: 电力设备-电力设备-电气自控设备
A5018: 电力设备-电力设备-电气自控设备
A5019: 电力设备-电力设备-电气自控设备
A5020: 电力设备-电力设备-电气自控设备
A5021: 电力设备-电力设备-电气自控设备
A5022: 电力设备-电力设备-电气自控设备
A5023: 电力设备-电力设备-电气自控设备
A5024: 电力设备-电力设备-电气自控设备
A5025: 电力设备-电力设备-电气自控设备
A5026: 电力设备-电力设备-电气自控设备
A5027: 电力设备-电力设备-电气自控设备
A5028: 电力设备-电力设备-电机
A5029: 电力设备-电力设备-电机
A5030: 电力设备-电力设备-电机
A5031: 电力设备-电力设备-电机
A5032: 电力设备-电力设备-电机
A5033: 电力设备-电力设备-电机
A5034: 电力设备-电力设备-电机
A5035: 电力设备-电力设备-电机
A5036: 电力设备-电力设备-电机
A5037: 电力设备-电力设备-电机
A5038: 电力设备-电力设备-电机
A5039: 电力设备-电力设备-电机
A5040: 电力设备-电力设备-电机
A5041: 电力设备-电力设备-电机
A5042: 电力设备-电力设备-电机
A5043: 电力设备-电力设备-电机
A5044: 电力设备-电力设备-电机
A5045: 电力设备-电力设备-电机
A5046: 电力设备-电力设备-电机
A5047: 电力设备-电力设备-电机
A5048: 电力设备-电力设备-电池
A5049: 电力设备-电力设备-电池
A5050: 电力设备-电力设备-电池
A5051: 电力设备-电力设备-电池
A5052: 电力设备-电力设备-电池
A5053: 电力设备-电力设备-电池
A5054: 电力设备-电力设备-电池
A5055: 电力设备-电力设备-电池
A5056: 电力设备-电力设备-电池
A5057: 电力设备-电力设备-电池
A5058: 电力设备-电力设备-电池
A5059: 电力设备-电力设备-电池
A5060: 电力设备-电力设备-电池
A5061: 电力设备-电力设备-电池
A5062: 电力设备-电力设备-电池
A5063: 电力设备-电力设备-电池
A5064: 电力设备-电力设备-电池
A5065: 电力设备-电力设备-电池
A5066: 电力设备-电力设备-电池
A5067: 电力设备-电力设备-电池
A5068: 电力设备-电力设备-电池
A5069: 电力设备-电力设备-电池
A5070: 电力设备-电力设备-电池
A5071: 电力设备-电力设备-电池
A5072: 电力设备-电力设备-电池
A5073: 电力设备-电力设备-电池
A5074: 电力设备-电力设备-电池
A5075: 电力设备-电力设备-电池
A5076: 电力设备-电力设备-电池
A5077: 电力设备-电力设备-电池
A5078: 电力设备-电力设备-电池
A5079: 电力设备-电力设备-电池
A5080: 电力设备-电力设备-电池
A5081: 电力设备-电力设备-电池
A5082: 电力设备-电力设备-电池
A5083: 电力设备-电力设备-电池
A5084: 电力设备-电力设备-电池
A5085: 电力设备-电力设备-电池
A5086: 电力设备-电力设备-电池
A5087: 电力设备-电力设备-电池
A5088: 电力设备-电力设备-电池
A5089: 电力设备-电力设备-电池
A5090: 电力设备-电力设备-电池
A5091: 电力设备-电力设备-电池
A5092: 电力设备-电力设备-电池
A5093: 电力设备-电力设备-电池
A5094: 电力设备-电力设备-电池
A5095: 电力设备-电力设备-电池
A5096: 电力设备-电力设备-电池
A5097: 电力设备-电力设备-电池
A5098: 电力设备-电力设备-电池
A5099: 电力设备-电力设备-电池
A5100: 电力设备-电力设备-电池
A5101: 电力设备-电力设备-电池
A5102: 电力设备-电力设备-电池
A5103: 电力设备-电力设备-电池
A5104: 电力设备-电力设备-电池
A5105: 电力设备-电力设备-电池
A5106: 电力设备-电力设备-电池
A5107: 电力设备-电力设备-电池
A5108: 电力设备-电力设备-电池
A5109: 电力设备-电力设备-电池
A5110: 电力设备-电力设备-电池
A5111: 电力设备-电力设备-电池
A5112: 电力设备-电力设备-电池
A5113: 电力设备-电力设备-电池
A5114: 电力设备-电力设备-电池
A5115: 电力设备-电力设备-电池
A5116: 电力设备-电力设备-电池
A5117: 电力设备-电力设备-电池
A5118: 电力设备-电力设备-电池
A5119: 电力设备-电力设备-电池
A5120: 电力设备-电力设备-电池
A5121: 电力设备-电力设备-电池
A5122: 电力设备-电力设备-电池
A5123: 电力设备-电力设备-电池
A5124: 电力设备-电力设备-电池
A5125: 电力设备-电力设备-电池
A5126: 电力设备-电力设备-电池
A5127: 电力设备-电力设备-电池
A5128: 电力设备-电力设备-电池
A5129: 电力设备-电力设备-电池
A5130: 电力设备-电力设备-电池
A5131: 电力设备-电力设备-电池
A5132: 电力设备-电力设备-电池
A5133: 电力设备-电力设备-电池
A5134: 电力设备-电力设备-电池
A5135: 电力设备-电力设备-电池
A5136: 电力设备-电力设备-电池
A5137: 电力设备-电力设备-电池
A5138: 电力设备-电力设备-电池
A5139: 电力设备-电力设备-电池
A5140: 电力设备-电力设备-电池
A5141: 电力设备-电力设备-电池
A5142: 电力设备-电力设备-电池
A5143: 电力设备-电力设备-电池
A5144: 电力设备-电力设备-电池
A5145: 电力设备-电力设备-电池
A5146: 电力设备-电力设备-电池
A5147: 电力设备-电力设备-电池
A5148: 电力设备-电力设备-电池
A5149: 传媒-传媒-有线电视网络
A5150: 传媒-传媒-有线电视网络
A5151: 传媒-传媒-有线电视网络
A5152: 传媒-传媒-有线电视网络
A5153: 传媒-传媒-有线电视网络
A5154: 传媒-传媒-有线电视网络
A5155: 传媒-传媒-有线电视网络
A5156: 传媒-传媒-有线电视网络
A5157: 传媒-传媒-有线电视网络
A5158: 传媒-传媒-有线电视网络
A5159: 传媒-传媒-有线电视网络
A5160: 传媒-传媒-有线电视网络
A5161: 传媒-传媒-有线电视网络
A5162: 传媒-传媒-游戏
A5163: 传媒-传媒-游戏
A5164: 传媒-传媒-游戏
A5165: 传媒-传媒-游戏
A5166: 传媒-传媒-游戏
A5167: 传媒-传媒-游戏
A5168: 传媒-传媒-游戏
A5169: 传媒-传媒-游戏
A5170: 传媒-传媒-游戏
A5171: 传媒-传媒-游戏
A5172: 传媒-传媒-游戏
A5173: 传媒-传媒-游戏
A5174: 传媒-传媒-游戏
A5175: 传媒-传媒-游戏
A5176: 传媒-传媒-游戏
A5177: 传媒-传媒-游戏
A5178: 传媒-传媒-游戏
A5179: 传媒-传媒-游戏
A5180: 传媒-传媒-游戏
A5181: 传媒-传媒-游戏
A5182: 传媒-传媒-游戏
A5183: 传媒-传媒-游戏
A5184: 传媒-传媒-游戏
A5185: 传媒-传媒-游戏
A5186: 传媒-传媒-游戏
A5187: 传媒-传媒-游戏
A5188: 传媒-传媒-影视院线
A5189: 传媒-传媒-影视院线
A5190: 传媒-传媒-影视院线
A5191: 传媒-传媒-影视院线
A5192: 传媒-传媒-影视院线
A5193: 传媒-传媒-影视院线
A5194: 传媒-传媒-影视院线
A5195: 传媒-传媒-影视院线
A5196: 传媒-传媒-影视院线
A5197: 传媒-传媒-影视院线
A5198: 传媒-传媒-影视院线
A5199: 传媒-传媒-影视院线
A5200: 传媒-传媒-影视院线
A5201: 传媒-传媒-影视院线
A5202: 传媒-传媒-影视院线
A5203: 传媒-传媒-影视院线
A5204: 传媒-传媒-影视院线
A5205: 传媒-传媒-影视院线
A5206: 传媒-传媒-影视院线
A5207: 传媒-传媒-影视院线
A5208: 传媒-传媒-影视院线
A5209: 传媒-传媒-数字媒体
A5210: 传媒-传媒-数字媒体
A5211: 传媒-传媒-数字媒体
A5212: 传媒-传媒-数字媒体
A5213: 传媒-传媒-数字媒体
A5214: 传媒-传媒-数字媒体
A5215: 传媒-传媒-数字媒体
A5216: 传媒-传媒-数字媒体
A5217: 传媒-传媒-数字媒体
A5218: 传媒-传媒-数字媒体
A5219: 传媒-传媒-数字媒体
A5220: 传媒-传媒-数字媒体
A5221: 传媒-传媒-数字媒体
A5222: 传媒-传媒-数字媒体
A5223: 传媒-传媒-数字媒体
A5224: 传媒-传媒-广告营销
A5225: 传媒-传媒-广告营销
A5226: 传媒-传媒-广告营销
A5227: 传媒-传媒-广告营销
A5228: 传媒-传媒-广告营销
A5229: 传媒-传媒-广告营销
A5230: 传媒-传媒-广告营销
A5231: 传媒-传媒-广告营销
A5232: 传媒-传媒-广告营销
A5233: 传媒-传媒-广告营销
A5234: 传媒-传媒-广告营销
A5235: 传媒-传媒-广告营销
A5236: 传媒-传媒-广告营销
A5237: 传媒-传媒-广告营销
A5238: 传媒-传媒-广告营销
A5239: 传媒-传媒-广告营销
A5240: 传媒-传媒-广告营销
A5241: 传媒-传媒-广告营销
A5242: 传媒-传媒-广告营销
A5243: 传媒-传媒-广告营销
A5244: 传媒-传媒-广告营销
A5245: 传媒-传媒-广告营销
A5246: 传媒-传媒-广告营销
A5247: 传媒-传媒-广告营销
A5248: 传媒-传媒-广告营销
A5249: 传媒-传媒-广告营销
A5250: 传媒-传媒-广告营销
A5251: 传媒-传媒-广告营销
A5252: 传媒-传媒-广告营销
A5253: 传媒-传媒-广告营销
A5254: 传媒-传媒-广告营销
A5255: 传媒-传媒-出版
A5256: 传媒-传媒-出版
A5257: 传媒-传媒-出版
A5258: 传媒-传媒-出版
A5259: 传媒-传媒-出版
A5260: 传媒-传媒-出版
A5261: 传媒-传媒-出版
A5262: 传媒-传媒-出版
A5263: 传媒-传媒-出版
A5264: 传媒-传媒-出版
A5265: 传媒-传媒-出版
A5266: 传媒-传媒-出版
A5267: 传媒-传媒-出版
A5268: 传媒-传媒-出版
A5269: 传媒-传媒-出版
A5270: 传媒-传媒-出版
A5271: 传媒-传媒-出版
A5272: 传媒-传媒-出版
A5273: 传媒-传媒-出版
A5274: 传媒-传媒-出版
A5275: 传媒-传媒-出版
A5276: 传媒-传媒-出版
A5277: 传媒-传媒-出版
A5278: 传媒-传媒-出版
A5279: 传媒-传媒-出版
A5280: 传媒-传媒-出版
A5281: 传媒-传媒-出版