A1: 所属同花顺行业 | B1: 所属同花顺行业
A2: 综合-综合-综合Ⅲ | B2: 综合-综合-综合Ⅲ | C2: =COUNTIF(A2:A700,B2) -> 1 | D2: 28 | E2: =C2/D2 -> 3.5714285714285712e-02
A3: 有色金属-小金属-其他小金属 | B3: 有色金属-小金属-其他小金属 | C3: =COUNTIF(A3:A701,B3) -> 1 | D3: 20 | E3: =C3/D3 -> 5.0000000000000003e-02
A4: 有色金属-金属新材料-其他金属新材料 | B4: 有色金属-金属新材料-其他金属新材料 | C4: =COUNTIF(A4:A702,B4) -> 1 | D4: 17 | E4: =C4/D4 -> 5.8823529411764705e-02
A5: 有色金属-贵金属-贵金属Ⅲ | B5: 有色金属-贵金属-贵金属Ⅲ | C5: =COUNTIF(A5:A703,B5) -> 6 | D5: 11 | E5: =C5/D5 -> 0.54545454545454541
A6: 有色金属-贵金属-贵金属Ⅲ | B6: 有色金属-工业金属-铜 | C6: =COUNTIF(A6:A704,B6) -> 5 | D6: 15 | E6: =C6/D6 -> 0.33333333333333331
A7: 有色金属-贵金属-贵金属Ⅲ | B7: 有色金属-工业金属-铅锌 | C7: =COUNTIF(A7:A705,B7) -> 3 | D7: 14 | E7: =C7/D7 -> 0.21428571428571427
A8: 有色金属-贵金属-贵金属Ⅲ | B8: 有色金属-工业金属-铝 | C8: =COUNTIF(A8:A706,B8) -> 5 | D8: 31 | E8: =C8/D8 -> 0.16129032258064516
A9: 有色金属-贵金属-贵金属Ⅲ | B9: 银行-银行-农商行 | C9: =COUNTIF(A9:A707,B9) -> 3 | D9: 10 | E9: =C9/D9 -> 0.29999999999999999
A10: 有色金属-贵金属-贵金属Ⅲ | B10: 银行-银行-国有大型银行 | C10: =COUNTIF(A10:A708,B10) -> 3 | D10: 6 | E10: =C10/D10 -> 0.5
A11: 有色金属-工业金属-铜 | B11: 银行-银行-股份制银行 | C11: =COUNTIF(A11:A709,B11) -> 2 | D11: 9 | E11: =C11/D11 -> 0.22222222222222221
A12: 有色金属-工业金属-铜 | B12: 银行-银行-城商行 | C12: =COUNTIF(A12:A710,B12) -> 5 | D12: 17 | E12: =C12/D12 -> 0.29411764705882354
A13: 有色金属-工业金属-铜 | B13: 医药生物-中药-中药Ⅲ | C13: =COUNTIF(A13:A711,B13) -> 5 | D13: 73 | E13: =C13/D13 -> 6.8493150684931503e-02
A14: 有色金属-工业金属-铜 | B14: 医药生物-医药商业-医药商业Ⅲ | C14: =COUNTIF(A14:A712,B14) -> 3 | D14: 31 | E14: =C14/D14 -> 9.6774193548387094e-02
A15: 有色金属-工业金属-铜 | B15: 医药生物-医疗器械-医疗设备 | C15: =COUNTIF(A15:A713,B15) -> 1 | D15: 41 | E15: =C15/D15 -> 2.4390243902439025e-02
A16: 有色金属-工业金属-铅锌 | B16: 医药生物-医疗器械-医疗耗材 | C16: =COUNTIF(A16:A714,B16) -> 1 | D16: 45 | E16: =C16/D16 -> 2.2222222222222223e-02
A17: 有色金属-工业金属-铅锌 | B17: 医药生物-医疗器械-体外诊断 | C17: =COUNTIF(A17:A715,B17) -> 2 | D17: 40 | E17: =C17/D17 -> 5.0000000000000003e-02
A18: 有色金属-工业金属-铅锌 | B18: 医药生物-生物制品-其他生物制品 | C18: =COUNTIF(A18:A716,B18) -> 5 | D18: 35 | E18: =C18/D18 -> 0.14285714285714285
A19: 有色金属-工业金属-铝 | B19: 医药生物-化学制药-原料药 | C19: =COUNTIF(A19:A717,B19) -> 3 | D19: 42 | E19: =C19/D19 -> 7.1428571428571425e-02
A20: 有色金属-工业金属-铝 | B20: 医药生物-化学制药-化学制剂 | C20: =COUNTIF(A20:A718,B20) -> 3 | D20: 113 | E20: =C20/D20 -> 2.6548672566371681e-02
A21: 有色金属-工业金属-铝 | B21: 通信-通信设备-通信终端及配件 | C21: =COUNTIF(A21:A719,B21) -> 2 | D21: 27 | E21: =C21/D21 -> 7.407407407407407e-02
A22: 有色金属-工业金属-铝 | B22: 通信-通信设备-通信网络设备及器件 | C22: =COUNTIF(A22:A720,B22) -> 2 | D22: 35 | E22: =C22/D22 -> 5.7142857142857141e-02
A23: 有色金属-工业金属-铝 | B23: 通信-通信设备-其他通信设备 | C23: =COUNTIF(A23:A721,B23) -> 1 | D23: 13 | E23: =C23/D23 -> 7.6923076923076927e-02
A24: 银行-银行-农商行 | B24: 通信-通信服务-通信服务Ⅲ | C24: =COUNTIF(A24:A722,B24) -> 9 | D24: 47 | E24: =C24/D24 -> 0.19148936170212766
A25: 银行-银行-农商行 | B25: 食品饮料-饮料制造-软饮料 | C25: =COUNTIF(A25:A723,B25) -> 1 | D25: 11 | E25: =C25/D25 -> 9.0909090909090912e-02
A26: 银行-银行-农商行 | B26: 食品饮料-饮料制造-啤酒 | C26: =COUNTIF(A26:A724,B26) -> 1 | D26: 7 | E26: =C26/D26 -> 0.14285714285714285
A27: 银行-银行-国有大型银行 | B27: 食品饮料-饮料制造-白酒 | C27: =COUNTIF(A27:A725,B27) -> 2 | D27: 20 | E27: =C27/D27 -> 0.10000000000000001
A28: 银行-银行-国有大型银行 | B28: 食品饮料-食品加工制造-乳品 | C28: =COUNTIF(A28:A726,B28) -> 3 | D28: 18 | E28: =C28/D28 -> 0.16666666666666666
A29: 银行-银行-国有大型银行 | B29: 食品饮料-食品加工制造-肉制品 | C29: =COUNTIF(A29:A727,B29) -> 2 | D29: 9 | E29: =C29/D29 -> 0.22222222222222221
A30: 银行-银行-股份制银行 | B30: 食品饮料-食品加工制造-其他食品 | C30: =COUNTIF(A30:A728,B30) -> 1 | D30: 19 | E30: =C30/D30 -> 5.2631578947368418e-02
A31: 银行-银行-股份制银行 | B31: 食品饮料-食品加工制造-调味发酵品 | C31: =COUNTIF(A31:A729,B31) -> 1 | D31: 15 | E31: =C31/D31 -> 6.6666666666666666e-02
A32: 银行-银行-城商行 | B32: 石油石化-油气开采及服务-油气开采 | C32: =COUNTIF(A32:A730,B32) -> 3 | D32: 7 | E32: =C32/D32 -> 0.42857142857142855
A33: 银行-银行-城商行 | B33: 石油石化-油气开采及服务-油服工程 | C33: =COUNTIF(A33:A731,B33) -> 2 | D33: 13 | E33: =C33/D33 -> 0.15384615384615385
A34: 银行-银行-城商行 | B34: 石油石化-石油加工贸易-油品石化贸易 | C34: =COUNTIF(A34:A732,B34) -> 2 | D34: 6 | E34: =C34/D34 -> 0.33333333333333331
A35: 银行-银行-城商行 | B35: 石油石化-石油加工贸易-石油加工 | C35: =COUNTIF(A35:A733,B35) -> 1 | D35: 22 | E35: =C35/D35 -> 4.5454545454545456e-02
A36: 银行-银行-城商行 | B36: 社会服务-其他社会服务-专业服务 | C36: =COUNTIF(A36:A734,B36) -> 7 | D36: 30 | E36: =C36/D36 -> 0.23333333333333334
A37: 医药生物-中药-中药Ⅲ | B37: 社会服务-其他社会服务-体育 | C37: =COUNTIF(A37:A735,B37) -> 1 | D37: 3 | E37: =C37/D37 -> 0.33333333333333331
A38: 医药生物-中药-中药Ⅲ | B38: 社会服务-景点及旅游-人工景点 | C38: =COUNTIF(A38:A736,B38) -> 1 | D38: 5 | E38: =C38/D38 -> 0.20000000000000001
A39: 医药生物-中药-中药Ⅲ | B39: 社会服务-教育-教育Ⅲ | C39: =COUNTIF(A39:A737,B39) -> 4 | D39: 19 | E39: =C39/D39 -> 0.21052631578947367
A40: 医药生物-中药-中药Ⅲ | B40: 商贸零售-贸易-贸易Ⅲ | C40: =COUNTIF(A40:A738,B40) -> 1 | D40: 16 | E40: =C40/D40 -> 6.25e-02
A41: 医药生物-中药-中药Ⅲ | B41: 商贸零售-零售-商业物业经营 | C41: =COUNTIF(A41:A739,B41) -> 7 | D41: 20 | E41: =C41/D41 -> 0.34999999999999998
A42: 医药生物-医药商业-医药商业Ⅲ | B42: 商贸零售-零售-百货零售 | C42: =COUNTIF(A42:A740,B42) -> 7 | D42: 43 | E42: =C42/D42 -> 0.16279069767441862
A43: 医药生物-医药商业-医药商业Ⅲ | B43: 商贸零售-互联网电商-互联网电商Ⅲ | C43: =COUNTIF(A43:A741,B43) -> 1 | D43: 21 | E43: =C43/D43 -> 4.7619047619047616e-02
A44: 医药生物-医药商业-医药商业Ⅲ | B44: 轻工制造-造纸-造纸Ⅲ | C44: =COUNTIF(A44:A742,B44) -> 3 | D44: 24 | E44: =C44/D44 -> 0.125
A45: 医药生物-医疗器械-医疗设备 | B45: 轻工制造-家用轻工-文娱用品 | C45: =COUNTIF(A45:A743,B45) -> 3 | D45: 20 | E45: =C45/D45 -> 0.14999999999999999
A46: 医药生物-医疗器械-医疗耗材 | B46: 轻工制造-家用轻工-饰品 | C46: =COUNTIF(A46:A744,B46) -> 2 | D46: 16 | E46: =C46/D46 -> 0.125
A47: 医药生物-医疗器械-体外诊断 | B47: 轻工制造-家用轻工-其他家用轻工 | C47: =COUNTIF(A47:A745,B47) -> 6 | D47: 32 | E47: =C47/D47 -> 0.1875
A48: 医药生物-医疗器械-体外诊断 | B48: 轻工制造-家用轻工-家具 | C48: =COUNTIF(A48:A746,B48) -> 7 | D48: 31 | E48: =C48/D48 -> 0.22580645161290322
A49: 医药生物-生物制品-其他生物制品 | B49: 轻工制造-家用轻工-瓷砖地板 | C49: =COUNTIF(A49:A747,B49) -> 2 | D49: 9 | E49: =C49/D49 -> 0.22222222222222221
A50: 医药生物-生物制品-其他生物制品 | B50: 轻工制造-包装印刷-印刷 | C50: =COUNTIF(A50:A748,B50) -> 1 | D50: 5 | E50: =C50/D50 -> 0.20000000000000001
A51: 医药生物-生物制品-其他生物制品 | B51: 轻工制造-包装印刷-包装 | C51: =COUNTIF(A51:A749,B51) -> 6 | D51: 43 | E51: =C51/D51 -> 0.13953488372093023
A52: 医药生物-生物制品-其他生物制品 | B52: 农林牧渔-种植业与林业-其他种植业 | C52: =COUNTIF(A52:A750,B52) -> 2 | D52: 9 | E52: =C52/D52 -> 0.22222222222222221
A53: 医药生物-生物制品-其他生物制品 | B53: 农林牧渔-种植业与林业-林业 | C53: =COUNTIF(A53:A751,B53) -> 1 | D53: 4 | E53: =C53/D53 -> 0.25
A54: 医药生物-化学制药-原料药 | B54: 农林牧渔-养殖业-水产养殖 | C54: =COUNTIF(A54:A752,B54) -> 1 | D54: 4 | E54: =C54/D54 -> 0.25
A55: 医药生物-化学制药-原料药 | B55: 农林牧渔-农产品加工-饲料 | C55: =COUNTIF(A55:A753,B55) -> 2 | D55: 18 | E55: =C55/D55 -> 0.1111111111111111
A56: 医药生物-化学制药-原料药 | B56: 农林牧渔-农产品加工-其他农产品加工 | C56: =COUNTIF(A56:A754,B56) -> 3 | D56: 11 | E56: =C56/D56 -> 0.27272727272727271
A57: 医药生物-化学制药-化学制剂 | B57: 农林牧渔-农产品加工-果蔬加工 | C57: =COUNTIF(A57:A755,B57) -> 2 | D57: 5 | E57: =C57/D57 -> 0.40000000000000002
A58: 医药生物-化学制药-化学制剂 | B58: 美容护理-美容护理-化妆品 | C58: =COUNTIF(A58:A756,B58) -> 1 | D58: 14 | E58: =C58/D58 -> 7.1428571428571425e-02
A59: 医药生物-化学制药-化学制剂 | B59: 美容护理-美容护理-个护用品 | C59: =COUNTIF(A59:A757,B59) -> 1 | D59: 14 | E59: =C59/D59 -> 7.1428571428571425e-02
A60: 通信-通信设备-通信终端及配件 | B60: 煤炭-煤炭开采加工-煤炭开采 | C60: =COUNTIF(A60:A758,B60) -> 3 | D60: 28 | E60: =C60/D60 -> 0.10714285714285714
A61: 通信-通信设备-通信终端及配件 | B61: 交运设备-汽车整车-商用载货车 | C61: =COUNTIF(A61:A759,B61) -> 1 | D61: 9 | E61: =C61/D61 -> 0.1111111111111111
A62: 通信-通信设备-通信网络设备及器件 | B62: 交运设备-汽车零部件-汽车零部件Ⅲ | C62: =COUNTIF(A62:A760,B62) -> 63 | D62: 229 | E62: =C62/D62 -> 0.27510917030567683
A63: 通信-通信设备-通信网络设备及器件 | B63: 交运设备-汽车服务-汽车服务Ⅲ | C63: =COUNTIF(A63:A761,B63) -> 1 | D63: 11 | E63: =C63/D63 -> 9.0909090909090912e-02
A64: 通信-通信设备-其他通信设备 | B64: 交运设备-非汽车交运-轨交设备 | C64: =COUNTIF(A64:A762,B64) -> 9 | D64: 30 | E64: =C64/D64 -> 0.29999999999999999
A65: 通信-通信服务-通信服务Ⅲ | B65: 交通运输-物流-物流Ⅲ | C65: =COUNTIF(A65:A763,B65) -> 3 | D65: 47 | E65: =C65/D65 -> 6.3829787234042548e-02
A66: 通信-通信服务-通信服务Ⅲ | B66: 交通运输-公路铁路运输-铁路运输 | C66: =COUNTIF(A66:A764,B66) -> 2 | D66: 7 | E66: =C66/D66 -> 0.2857142857142857
A67: 通信-通信服务-通信服务Ⅲ | B67: 交通运输-公路铁路运输-高速公路 | C67: =COUNTIF(A67:A765,B67) -> 8 | D67: 19 | E67: =C67/D67 -> 0.42105263157894735
A68: 通信-通信服务-通信服务Ⅲ | B68: 交通运输-港口航运-航运 | C68: =COUNTIF(A68:A766,B68) -> 1 | D68: 18 | E68: =C68/D68 -> 5.5555555555555552e-02
A69: 通信-通信服务-通信服务Ⅲ | B69: 建筑装饰-建筑装饰-装饰园林 | C69: =COUNTIF(A69:A767,B69) -> 8 | D69: 42 | E69: =C69/D69 -> 0.19047619047619047
A70: 通信-通信服务-通信服务Ⅲ | B70: 建筑装饰-建筑装饰-专业工程 | C70: =COUNTIF(A70:A768,B70) -> 3 | D70: 34 | E70: =C70/D70 -> 8.8235294117647065e-02
A71: 通信-通信服务-通信服务Ⅲ | B71: 建筑装饰-建筑装饰-基础建设 | C71: =COUNTIF(A71:A769,B71) -> 1 | D71: 26 | E71: =C71/D71 -> 3.8461538461538464e-02
A72: 通信-通信服务-通信服务Ⅲ | B72: 建筑装饰-建筑装饰-工程咨询服务 | C72: =COUNTIF(A72:A770,B72) -> 12 | D72: 44 | E72: =C72/D72 -> 0.27272727272727271
A73: 通信-通信服务-通信服务Ⅲ | B73: 建筑装饰-建筑装饰-房屋建设 | C73: =COUNTIF(A73:A771,B73) -> 1 | D73: 8 | E73: =C73/D73 -> 0.125
A74: 食品饮料-饮料制造-软饮料 | B74: 建筑材料-建筑材料-水泥 | C74: =COUNTIF(A74:A772,B74) -> 3 | D74: 25 | E74: =C74/D74 -> 0.12
A75: 食品饮料-饮料制造-啤酒 | B75: 建筑材料-建筑材料-其他建材 | C75: =COUNTIF(A75:A773,B75) -> 5 | D75: 24 | E75: =C75/D75 -> 0.20833333333333334
A76: 食品饮料-饮料制造-白酒 | B76: 建筑材料-建筑材料-管材 | C76: =COUNTIF(A76:A774,B76) -> 1 | D76: 7 | E76: =C76/D76 -> 0.14285714285714285
A77: 食品饮料-饮料制造-白酒 | B77: 建筑材料-建筑材料-玻璃玻纤 | C77: =COUNTIF(A77:A775,B77) -> 1 | D77: 13 | E77: =C77/D77 -> 7.6923076923076927e-02
A78: 食品饮料-食品加工制造-乳品 | B78: 家用电器-小家电-小家电Ⅲ | C78: =COUNTIF(A78:A776,B78) -> 6 | D78: 26 | E78: =C78/D78 -> 0.23076923076923078
A79: 食品饮料-食品加工制造-乳品 | B79: 家用电器-白色家电-其他白色家电 | C79: =COUNTIF(A79:A777,B79) -> 6 | D79: 27 | E79: =C79/D79 -> 0.22222222222222221
A80: 食品饮料-食品加工制造-乳品 | B80: 家用电器-白色家电-空调 | C80: =COUNTIF(A80:A778,B80) -> 3 | D80: 3 | E80: =C80/D80 -> 1
A81: 食品饮料-食品加工制造-肉制品 | B81: 计算机-计算机应用-软件开发 | C81: =COUNTIF(A81:A779,B81) -> 15 | D81: 135 | E81: =C81/D81 -> 0.1111111111111111
A82: 食品饮料-食品加工制造-肉制品 | B82: 计算机-计算机应用-IT服务 | C82: =COUNTIF(A82:A780,B82) -> 18 | D82: 122 | E82: =C82/D82 -> 0.14754098360655737
A83: 食品饮料-食品加工制造-其他食品 | B83: 计算机-计算机设备-计算机设备Ⅲ | C83: =COUNTIF(A83:A781,B83) -> 15 | D83: 80 | E83: =C83/D83 -> 0.1875
A84: 食品饮料-食品加工制造-调味发酵品 | B84: 基础化工-化学制品-涂料油墨 | C84: =COUNTIF(A84:A782,B84) -> 5 | D84: 14 | E84: =C84/D84 -> 0.35714285714285715
A85: 石油石化-油气开采及服务-油气开采 | B85: 基础化工-化学制品-食品及饲料添加剂 | C85: =COUNTIF(A85:A783,B85) -> 2 | D85: 21 | E85: =C85/D85 -> 9.5238095238095233e-02
A86: 石油石化-油气开采及服务-油气开采 | B86: 基础化工-化学制品-其他化学制品 | C86: =COUNTIF(A86:A784,B86) -> 8 | D86: 73 | E86: =C86/D86 -> 0.1095890410958904
A87: 石油石化-油气开采及服务-油气开采 | B87: 基础化工-化学制品-聚氨酯 | C87: =COUNTIF(A87:A785,B87) -> 1 | D87: 11 | E87: =C87/D87 -> 9.0909090909090912e-02
A88: 石油石化-油气开采及服务-油服工程 | B88: 基础化工-化学制品-复合肥 | C88: =COUNTIF(A88:A786,B88) -> 1 | D88: 8 | E88: =C88/D88 -> 0.125
A89: 石油石化-油气开采及服务-油服工程 | B89: 基础化工-化学制品-纺织化学用品 | C89: =COUNTIF(A89:A787,B89) -> 2 | D89: 13 | E89: =C89/D89 -> 0.15384615384615385
A90: 石油石化-石油加工贸易-油品石化贸易 | B90: 基础化工-化学原料-无机盐 | C90: =COUNTIF(A90:A788,B90) -> 1 | D90: 10 | E90: =C90/D90 -> 0.10000000000000001
A91: 石油石化-石油加工贸易-油品石化贸易 | B91: 基础化工-化工合成材料-其他橡胶制品 | C91: =COUNTIF(A91:A789,B91) -> 2 | D91: 13 | E91: =C91/D91 -> 0.15384615384615385
A92: 石油石化-石油加工贸易-石油加工 | B92: 基础化工-化工合成材料-其他塑料制品 | C92: =COUNTIF(A92:A790,B92) -> 4 | D92: 19 | E92: =C92/D92 -> 0.21052631578947367
A93: 社会服务-其他社会服务-专业服务 | B93: 基础化工-化工合成材料-膜材料 | C93: =COUNTIF(A93:A791,B93) -> 1 | D93: 18 | E93: =C93/D93 -> 5.5555555555555552e-02
A94: 社会服务-其他社会服务-专业服务 | B94: 基础化工-化工合成材料-合成树脂 | C94: =COUNTIF(A94:A792,B94) -> 2 | D94: 11 | E94: =C94/D94 -> 0.18181818181818182
A95: 社会服务-其他社会服务-专业服务 | B95: 基础化工-化工合成材料-改性塑料 | C95: =COUNTIF(A95:A793,B95) -> 5 | D95: 18 | E95: =C95/D95 -> 0.27777777777777779
A96: 社会服务-其他社会服务-专业服务 | B96: 基础化工-化工合成材料-涤纶 | C96: =COUNTIF(A96:A794,B96) -> 1 | D96: 10 | E96: =C96/D96 -> 0.10000000000000001
A97: 社会服务-其他社会服务-专业服务 | B97: 机械设备-自动化设备-其他自动化设备 | C97: =COUNTIF(A97:A795,B97) -> 6 | D97: 25 | E97: =C97/D97 -> 0.23999999999999999
A98: 社会服务-其他社会服务-专业服务 | B98: 机械设备-自动化设备-机器人 | C98: =COUNTIF(A98:A796,B98) -> 2 | D98: 22 | E98: =C98/D98 -> 9.0909090909090912e-02
A99: 社会服务-其他社会服务-专业服务 | B99: 机械设备-自动化设备-工控设备 | C99: =COUNTIF(A99:A797,B99) -> 2 | D99: 32 | E99: =C99/D99 -> 6.25e-02
A100: 社会服务-其他社会服务-体育 | B100: 机械设备-专用设备-其他专用设备 | C100: =COUNTIF(A100:A798,B100) -> 13 | D100: 77 | E100: =C100/D100 -> 0.16883116883116883
A101: 社会服务-景点及旅游-人工景点 | B101: 机械设备-专用设备-农用机械 | C101: =COUNTIF(A101:A799,B101) -> 1 | D101: 10 | E101: =C101/D101 -> 0.10000000000000001
A102: 社会服务-教育-教育Ⅲ | B102: 机械设备-专用设备-能源及重型设备 | C102: =COUNTIF(A102:A800,B102) -> 10 | D102: 49 | E102: =C102/D102 -> 0.20408163265306123
A103: 社会服务-教育-教育Ⅲ | B103: 机械设备-专用设备-楼宇设备 | C103: =COUNTIF(A103:A801,B103) -> 6 | D103: 13 | E103: =C103/D103 -> 0.46153846153846156
A104: 社会服务-教育-教育Ⅲ | B104: 机械设备-专用设备-工程机械 | C104: =COUNTIF(A104:A802,B104) -> 5 | D104: 28 | E104: =C104/D104 -> 0.17857142857142858
A105: 社会服务-教育-教育Ⅲ | B105: 机械设备-专用设备-纺织服装设备 | C105: =COUNTIF(A105:A803,B105) -> 5 | D105: 12 | E105: =C105/D105 -> 0.41666666666666669
A106: 商贸零售-贸易-贸易Ⅲ | B106: 机械设备-仪器仪表-仪器仪表Ⅲ | C106: =COUNTIF(A106:A804,B106) -> 9 | D106: 53 | E106: =C106/D106 -> 0.16981132075471697
A107: 商贸零售-零售-商业物业经营 | B107: 机械设备-通用设备-制冷空调设备 | C107: =COUNTIF(A107:A805,B107) -> 1 | D107: 16 | E107: =C107/D107 -> 6.25e-02
A108: 商贸零售-零售-商业物业经营 | B108: 机械设备-通用设备-其他通用设备 | C108: =COUNTIF(A108:A806,B108) -> 13 | D108: 57 | E108: =C108/D108 -> 0.22807017543859648
A109: 商贸零售-零售-商业物业经营 | B109: 机械设备-通用设备-磨具磨料 | C109: =COUNTIF(A109:A807,B109) -> 2 | D109: 14 | E109: =C109/D109 -> 0.14285714285714285
A110: 商贸零售-零售-商业物业经营 | B110: 机械设备-通用设备-金属制品 | C110: =COUNTIF(A110:A808,B110) -> 14 | D110: 70 | E110: =C110/D110 -> 0.20000000000000001
A111: 商贸零售-零售-商业物业经营 | B111: 机械设备-通用设备-机床工具 | C111: =COUNTIF(A111:A809,B111) -> 1 | D111: 20 | E111: =C111/D111 -> 5.0000000000000003e-02
A112: 商贸零售-零售-商业物业经营 | B112: 环保-环保-综合环境治理 | C112: =COUNTIF(A112:A810,B112) -> 5 | D112: 29 | E112: =C112/D112 -> 0.17241379310344829
A113: 商贸零售-零售-商业物业经营 | B113: 环保-环保-水务及水治理 | C113: =COUNTIF(A113:A811,B113) -> 9 | D113: 46 | E113: =C113/D113 -> 0.19565217391304349
A114: 商贸零售-零售-百货零售 | B114: 环保-环保-环保设备 | C114: =COUNTIF(A114:A812,B114) -> 5 | D114: 28 | E114: =C114/D114 -> 0.17857142857142858
A115: 商贸零售-零售-百货零售 | B115: 环保-环保-固废治理 | C115: =COUNTIF(A115:A813,B115) -> 6 | D115: 36 | E115: =C115/D115 -> 0.16666666666666666
A116: 商贸零售-零售-百货零售 | B116: 环保-环保-大气治理 | C116: =COUNTIF(A116:A814,B116) -> 1 | D116: 7 | E116: =C116/D116 -> 0.14285714285714285
A117: 商贸零售-零售-百货零售 | B117: 黑色金属-钢铁-冶钢原料 | C117: =COUNTIF(A117:A815,B117) -> 1 | D117: 10 | E117: =C117/D117 -> 0.10000000000000001
A118: 商贸零售-零售-百货零售 | B118: 黑色金属-钢铁-特钢 | C118: =COUNTIF(A118:A816,B118) -> 1 | D118: 13 | E118: =C118/D118 -> 7.6923076923076927e-02
A119: 商贸零售-零售-百货零售 | B119: 黑色金属-钢铁-普钢 | C119: =COUNTIF(A119:A817,B119) -> 2 | D119: 23 | E119: =C119/D119 -> 8.6956521739130432e-02
A120: 商贸零售-零售-百货零售 | B120: 国防军工-国防军工-军工电子 | C120: =COUNTIF(A120:A818,B120) -> 3 | D120: 60 | E120: =C120/D120 -> 5.0000000000000003e-02
A121: 商贸零售-互联网电商-互联网电商Ⅲ | B121: 国防军工-国防军工-航天装备 | C121: =COUNTIF(A121:A819,B121) -> 1 | D121: 9 | E121: =C121/D121 -> 0.1111111111111111
A122: 轻工制造-造纸-造纸Ⅲ | B122: 国防军工-国防军工-航空装备 | C122: =COUNTIF(A122:A820,B122) -> 2 | D122: 48 | E122: =C122/D122 -> 4.1666666666666664e-02
A123: 轻工制造-造纸-造纸Ⅲ | B123: 国防军工-国防军工-地面兵装 | C123: =COUNTIF(A123:A821,B123) -> 1 | D123: 12 | E123: =C123/D123 -> 8.3333333333333329e-02
A124: 轻工制造-造纸-造纸Ⅲ | B124: 公用事业-燃气-燃气Ⅲ | C124: =COUNTIF(A124:A822,B124) -> 3 | D124: 29 | E124: =C124/D124 -> 0.10344827586206896
A125: 轻工制造-家用轻工-文娱用品 | B125: 公用事业-电力-新能源发电 | C125: =COUNTIF(A125:A823,B125) -> 2 | D125: 27 | E125: =C125/D125 -> 7.407407407407407e-02
A126: 轻工制造-家用轻工-文娱用品 | B126: 公用事业-电力-水电 | C126: =COUNTIF(A126:A824,B126) -> 4 | D126: 10 | E126: =C126/D126 -> 0.40000000000000002
A127: 轻工制造-家用轻工-文娱用品 | B127: 非银金融-证券-证券Ⅲ | C127: =COUNTIF(A127:A825,B127) -> 14 | D127: 50 | E127: =C127/D127 -> 0.28000000000000003
A128: 轻工制造-家用轻工-饰品 | B128: 非银金融-保险及其他-多元金融 | C128: =COUNTIF(A128:A826,B128) -> 4 | D128: 31 | E128: =C128/D128 -> 0.12903225806451613
A129: 轻工制造-家用轻工-饰品 | B129: 非银金融-保险及其他-保险 | C129: =COUNTIF(A129:A827,B129) -> 5 | D129: 6 | E129: =C129/D129 -> 0.83333333333333337
A130: 轻工制造-家用轻工-其他家用轻工 | B130: 纺织服装-服装家纺-鞋帽及其他 | C130: =COUNTIF(A130:A828,B130) -> 6 | D130: 16 | E130: =C130/D130 -> 0.375
A131: 轻工制造-家用轻工-其他家用轻工 | B131: 纺织服装-服装家纺-家纺 | C131: =COUNTIF(A131:A829,B131) -> 4 | D131: 7 | E131: =C131/D131 -> 0.5714285714285714
A132: 轻工制造-家用轻工-其他家用轻工 | B132: 纺织服装-服装家纺-服装 | C132: =COUNTIF(A132:A830,B132) -> 8 | D132: 38 | E132: =C132/D132 -> 0.21052631578947367
A133: 轻工制造-家用轻工-其他家用轻工 | B133: 纺织服装-纺织制造-其他纺织 | C133: =COUNTIF(A133:A831,B133) -> 5 | D133: 19 | E133: =C133/D133 -> 0.26315789473684209
A134: 轻工制造-家用轻工-其他家用轻工 | B134: 纺织服装-纺织制造-棉纺 | C134: =COUNTIF(A134:A832,B134) -> 1 | D134: 8 | E134: =C134/D134 -> 0.125
A135: 轻工制造-家用轻工-其他家用轻工 | B135: 房地产-房地产开发-住宅开发 | C135: =COUNTIF(A135:A833,B135) -> 8 | D135: 77 | E135: =C135/D135 -> 0.1038961038961039
A136: 轻工制造-家用轻工-家具 | B136: 房地产-房地产开发-商业地产 | C136: =COUNTIF(A136:A834,B136) -> 1 | D136: 9 | E136: =C136/D136 -> 0.1111111111111111
A137: 轻工制造-家用轻工-家具 | B137: 房地产-房地产开发-产业地产 | C137: =COUNTIF(A137:A835,B137) -> 2 | D137: 10 | E137: =C137/D137 -> 0.20000000000000001
A138: 轻工制造-家用轻工-家具 | B138: 电子-消费电子-消费电子零部件及组装 | C138: =COUNTIF(A138:A836,B138) -> 9 | D138: 90 | E138: =C138/D138 -> 0.10000000000000001
A139: 轻工制造-家用轻工-家具 | B139: 电子-消费电子-品牌消费电子 | C139: =COUNTIF(A139:A837,B139) -> 2 | D139: 8 | E139: =C139/D139 -> 0.25
A140: 轻工制造-家用轻工-家具 | B140: 电子-其他电子-其他电子Ⅲ | C140: =COUNTIF(A140:A838,B140) -> 1 | D140: 37 | E140: =C140/D140 -> 2.7027027027027029e-02
A141: 轻工制造-家用轻工-家具 | B141: 电子-光学光电子-面板 | C141: =COUNTIF(A141:A839,B141) -> 9 | D141: 42 | E141: =C141/D141 -> 0.21428571428571427
A142: 轻工制造-家用轻工-家具 | B142: 电子-光学光电子-光学元件 | C142: =COUNTIF(A142:A840,B142) -> 2 | D142: 22 | E142: =C142/D142 -> 9.0909090909090912e-02
A143: 轻工制造-家用轻工-瓷砖地板 | B143: 电子-光学光电子-LED | C143: =COUNTIF(A143:A841,B143) -> 6 | D143: 42 | E143: =C143/D143 -> 0.14285714285714285
A144: 轻工制造-家用轻工-瓷砖地板 | B144: 电子-电子化学品-电子化学品Ⅲ | C144: =COUNTIF(A144:A842,B144) -> 4 | D144: 36 | E144: =C144/D144 -> 0.1111111111111111
A145: 轻工制造-包装印刷-印刷 | B145: 电子-半导体及元件-印制电路板 | C145: =COUNTIF(A145:A843,B145) -> 6 | D145: 41 | E145: =C145/D145 -> 0.14634146341463414
A146: 轻工制造-包装印刷-包装 | B146: 电子-半导体及元件-集成电路设计 | C146: =COUNTIF(A146:A844,B146) -> 1 | D146: 76 | E146: =C146/D146 -> 1.3157894736842105e-02
A147: 轻工制造-包装印刷-包装 | B147: 电子-半导体及元件-集成电路封测 | C147: =COUNTIF(A147:A845,B147) -> 2 | D147: 13 | E147: =C147/D147 -> 0.15384615384615385
A148: 轻工制造-包装印刷-包装 | B148: 电子-半导体及元件-被动元件 | C148: =COUNTIF(A148:A846,B148) -> 2 | D148: 13 | E148: =C148/D148 -> 0.15384615384615385
A149: 轻工制造-包装印刷-包装 | B149: 电子-半导体及元件-半导体设备 | C149: =COUNTIF(A149:A847,B149) -> 2 | D149: 17 | E149: =C149/D149 -> 0.11764705882352941
A150: 轻工制造-包装印刷-包装 | B150: 电力设备-电力设备-线缆部件及其他 | C150: =COUNTIF(A150:A848,B150) -> 2 | D150: 36 | E150: =C150/D150 -> 5.5555555555555552e-02
A151: 轻工制造-包装印刷-包装 | B151: 电力设备-电力设备-输变电设备 | C151: =COUNTIF(A151:A849,B151) -> 6 | D151: 51 | E151: =C151/D151 -> 0.11764705882352941
A152: 农林牧渔-种植业与林业-其他种植业 | B152: 电力设备-电力设备-电气自控设备 | C152: =COUNTIF(A152:A850,B152) -> 6 | D152: 36 | E152: =C152/D152 -> 0.16666666666666666
A153: 农林牧渔-种植业与林业-其他种植业 | B153: 电力设备-电力设备-电机 | C153: =COUNTIF(A153:A851,B153) -> 5 | D153: 20 | E153: =C153/D153 -> 0.25
A154: 农林牧渔-种植业与林业-林业 | B154: 电力设备-电力设备-电池 | C154: =COUNTIF(A154:A852,B154) -> 2 | D154: 101 | E154: =C154/D154 -> 1.9801980198019802e-02
A155: 农林牧渔-养殖业-水产养殖 | B155: 传媒-传媒-游戏 | C155: =COUNTIF(A155:A853,B155) -> 2 | D155: 26 | E155: =C155/D155 -> 7.6923076923076927e-02
A156: 农林牧渔-农产品加工-饲料 | B156: 传媒-传媒-影视院线 | C156: =COUNTIF(A156:A854,B156) -> 3 | D156: 21 | E156: =C156/D156 -> 0.14285714285714285
A157: 农林牧渔-农产品加工-饲料 | B157: 传媒-传媒-数字媒体 | C157: =COUNTIF(A157:A855,B157) -> 4 | D157: 15 | E157: =C157/D157 -> 0.26666666666666666
A158: 农林牧渔-农产品加工-其他农产品加工 | B158: 传媒-传媒-广告营销 | C158: =COUNTIF(A158:A856,B158) -> 4 | D158: 31 | E158: =C158/D158 -> 0.12903225806451613
A159: 农林牧渔-农产品加工-其他农产品加工 | B159: 传媒-传媒-出版 | C159: =COUNTIF(A159:A857,B159) -> 7 | D159: 27 | E159: =C159/D159 -> 0.25925925925925924
A160: 农林牧渔-农产品加工-其他农产品加工
A161: 农林牧渔-农产品加工-果蔬加工
A162: 农林牧渔-农产品加工-果蔬加工
A163: 美容护理-美容护理-化妆品
A164: 美容护理-美容护理-个护用品
A165: 煤炭-煤炭开采加工-煤炭开采
A166: 煤炭-煤炭开采加工-煤炭开采
A167: 煤炭-煤炭开采加工-煤炭开采
A168: 交运设备-汽车整车-商用载货车
A169: 交运设备-汽车零部件-汽车零部件Ⅲ
A170: 交运设备-汽车零部件-汽车零部件Ⅲ
A171: 交运设备-汽车零部件-汽车零部件Ⅲ
A172: 交运设备-汽车零部件-汽车零部件Ⅲ
A173: 交运设备-汽车零部件-汽车零部件Ⅲ
A174: 交运设备-汽车零部件-汽车零部件Ⅲ
A175: 交运设备-汽车零部件-汽车零部件Ⅲ
A176: 交运设备-汽车零部件-汽车零部件Ⅲ
A177: 交运设备-汽车零部件-汽车零部件Ⅲ
A178: 交运设备-汽车零部件-汽车零部件Ⅲ
A179: 交运设备-汽车零部件-汽车零部件Ⅲ
A180: 交运设备-汽车零部件-汽车零部件Ⅲ
A181: 交运设备-汽车零部件-汽车零部件Ⅲ
A182: 交运设备-汽车零部件-汽车零部件Ⅲ
A183: 交运设备-汽车零部件-汽车零部件Ⅲ
A184: 交运设备-汽车零部件-汽车零部件Ⅲ
A185: 交运设备-汽车零部件-汽车零部件Ⅲ
A186: 交运设备-汽车零部件-汽车零部件Ⅲ
A187: 交运设备-汽车零部件-汽车零部件Ⅲ
A188: 交运设备-汽车零部件-汽车零部件Ⅲ
A189: 交运设备-汽车零部件-汽车零部件Ⅲ
A190: 交运设备-汽车零部件-汽车零部件Ⅲ
A191: 交运设备-汽车零部件-汽车零部件Ⅲ
A192: 交运设备-汽车零部件-汽车零部件Ⅲ
A193: 交运设备-汽车零部件-汽车零部件Ⅲ
A194: 交运设备-汽车零部件-汽车零部件Ⅲ
A195: 交运设备-汽车零部件-汽车零部件Ⅲ
A196: 交运设备-汽车零部件-汽车零部件Ⅲ
A197: 交运设备-汽车零部件-汽车零部件Ⅲ
A198: 交运设备-汽车零部件-汽车零部件Ⅲ
A199: 交运设备-汽车零部件-汽车零部件Ⅲ
A200: 交运设备-汽车零部件-汽车零部件Ⅲ
A201: 交运设备-汽车零部件-汽车零部件Ⅲ
A202: 交运设备-汽车零部件-汽车零部件Ⅲ
A203: 交运设备-汽车零部件-汽车零部件Ⅲ
A204: 交运设备-汽车零部件-汽车零部件Ⅲ
A205: 交运设备-汽车零部件-汽车零部件Ⅲ
A206: 交运设备-汽车零部件-汽车零部件Ⅲ
A207: 交运设备-汽车零部件-汽车零部件Ⅲ
A208: 交运设备-汽车零部件-汽车零部件Ⅲ
A209: 交运设备-汽车零部件-汽车零部件Ⅲ
A210: 交运设备-汽车零部件-汽车零部件Ⅲ
A211: 交运设备-汽车零部件-汽车零部件Ⅲ
A212: 交运设备-汽车零部件-汽车零部件Ⅲ
A213: 交运设备-汽车零部件-汽车零部件Ⅲ
A214: 交运设备-汽车零部件-汽车零部件Ⅲ
A215: 交运设备-汽车零部件-汽车零部件Ⅲ
A216: 交运设备-汽车零部件-汽车零部件Ⅲ
A217: 交运设备-汽车零部件-汽车零部件Ⅲ
A218: 交运设备-汽车零部件-汽车零部件Ⅲ
A219: 交运设备-汽车零部件-汽车零部件Ⅲ
A220: 交运设备-汽车零部件-汽车零部件Ⅲ
A221: 交运设备-汽车零部件-汽车零部件Ⅲ
A222: 交运设备-汽车零部件-汽车零部件Ⅲ
A223: 交运设备-汽车零部件-汽车零部件Ⅲ
A224: 交运设备-汽车零部件-汽车零部件Ⅲ
A225: 交运设备-汽车零部件-汽车零部件Ⅲ
A226: 交运设备-汽车零部件-汽车零部件Ⅲ
A227: 交运设备-汽车零部件-汽车零部件Ⅲ
A228: 交运设备-汽车零部件-汽车零部件Ⅲ
A229: 交运设备-汽车零部件-汽车零部件Ⅲ
A230: 交运设备-汽车零部件-汽车零部件Ⅲ
A231: 交运设备-汽车零部件-汽车零部件Ⅲ
A232: 交运设备-汽车服务-汽车服务Ⅲ
A233: 交运设备-非汽车交运-轨交设备
A234: 交运设备-非汽车交运-轨交设备
A235: 交运设备-非汽车交运-轨交设备
A236: 交运设备-非汽车交运-轨交设备
A237: 交运设备-非汽车交运-轨交设备
A238: 交运设备-非汽车交运-轨交设备
A239: 交运设备-非汽车交运-轨交设备
A240: 交运设备-非汽车交运-轨交设备
A241: 交运设备-非汽车交运-轨交设备
A242: 交通运输-物流-物流Ⅲ
A243: 交通运输-物流-物流Ⅲ
A244: 交通运输-物流-物流Ⅲ
A245: 交通运输-公路铁路运输-铁路运输
A246: 交通运输-公路铁路运输-铁路运输
A247: 交通运输-公路铁路运输-高速公路
A248: 交通运输-公路铁路运输-高速公路
A249: 交通运输-公路铁路运输-高速公路
A250: 交通运输-公路铁路运输-高速公路
A251: 交通运输-公路铁路运输-高速公路
A252: 交通运输-公路铁路运输-高速公路
A253: 交通运输-公路铁路运输-高速公路
A254: 交通运输-公路铁路运输-高速公路
A255: 交通运输-港口航运-航运
A256: 建筑装饰-建筑装饰-装饰园林
A257: 建筑装饰-建筑装饰-装饰园林
A258: 建筑装饰-建筑装饰-装饰园林
A259: 建筑装饰-建筑装饰-装饰园林
A260: 建筑装饰-建筑装饰-装饰园林
A261: 建筑装饰-建筑装饰-装饰园林
A262: 建筑装饰-建筑装饰-装饰园林
A263: 建筑装饰-建筑装饰-装饰园林
A264: 建筑装饰-建筑装饰-专业工程
A265: 建筑装饰-建筑装饰-专业工程
A266: 建筑装饰-建筑装饰-专业工程
A267: 建筑装饰-建筑装饰-基础建设
A268: 建筑装饰-建筑装饰-工程咨询服务
A269: 建筑装饰-建筑装饰-工程咨询服务
A270: 建筑装饰-建筑装饰-工程咨询服务
A271: 建筑装饰-建筑装饰-工程咨询服务
A272: 建筑装饰-建筑装饰-工程咨询服务
A273: 建筑装饰-建筑装饰-工程咨询服务
A274: 建筑装饰-建筑装饰-工程咨询服务
A275: 建筑装饰-建筑装饰-工程咨询服务
A276: 建筑装饰-建筑装饰-工程咨询服务
A277: 建筑装饰-建筑装饰-工程咨询服务
A278: 建筑装饰-建筑装饰-工程咨询服务
A279: 建筑装饰-建筑装饰-工程咨询服务
A280: 建筑装饰-建筑装饰-房屋建设
A281: 建筑材料-建筑材料-水泥
A282: 建筑材料-建筑材料-水泥
A283: 建筑材料-建筑材料-水泥
A284: 建筑材料-建筑材料-其他建材
A285: 建筑材料-建筑材料-其他建材
A286: 建筑材料-建筑材料-其他建材
A287: 建筑材料-建筑材料-其他建材
A288: 建筑材料-建筑材料-其他建材
A289: 建筑材料-建筑材料-管材
A290: 建筑材料-建筑材料-玻璃玻纤
A291: 家用电器-小家电-小家电Ⅲ
A292: 家用电器-小家电-小家电Ⅲ
A293: 家用电器-小家电-小家电Ⅲ
A294: 家用电器-小家电-小家电Ⅲ
A295: 家用电器-小家电-小家电Ⅲ
A296: 家用电器-小家电-小家电Ⅲ
A297: 家用电器-白色家电-其他白色家电
A298: 家用电器-白色家电-其他白色家电
A299: 家用电器-白色家电-其他白色家电
A300: 家用电器-白色家电-其他白色家电
A301: 家用电器-白色家电-其他白色家电
A302: 家用电器-白色家电-其他白色家电
A303: 家用电器-白色家电-空调
A304: 家用电器-白色家电-空调
A305: 家用电器-白色家电-空调
A306: 计算机-计算机应用-软件开发
A307: 计算机-计算机应用-软件开发
A308: 计算机-计算机应用-软件开发
A309: 计算机-计算机应用-软件开发
A310: 计算机-计算机应用-软件开发
A311: 计算机-计算机应用-软件开发
A312: 计算机-计算机应用-软件开发
A313: 计算机-计算机应用-软件开发
A314: 计算机-计算机应用-软件开发
A315: 计算机-计算机应用-软件开发
A316: 计算机-计算机应用-软件开发
A317: 计算机-计算机应用-软件开发
A318: 计算机-计算机应用-软件开发
A319: 计算机-计算机应用-软件开发
A320: 计算机-计算机应用-软件开发
A321: 计算机-计算机应用-IT服务
A322: 计算机-计算机应用-IT服务
A323: 计算机-计算机应用-IT服务
A324: 计算机-计算机应用-IT服务
A325: 计算机-计算机应用-IT服务
A326: 计算机-计算机应用-IT服务
A327: 计算机-计算机应用-IT服务
A328: 计算机-计算机应用-IT服务
A329: 计算机-计算机应用-IT服务
A330: 计算机-计算机应用-IT服务
A331: 计算机-计算机应用-IT服务
A332: 计算机-计算机应用-IT服务
A333: 计算机-计算机应用-IT服务
A334: 计算机-计算机应用-IT服务
A335: 计算机-计算机应用-IT服务
A336: 计算机-计算机应用-IT服务
A337: 计算机-计算机应用-IT服务
A338: 计算机-计算机应用-IT服务
A339: 计算机-计算机设备-计算机设备Ⅲ
A340: 计算机-计算机设备-计算机设备Ⅲ
A341: 计算机-计算机设备-计算机设备Ⅲ
A342: 计算机-计算机设备-计算机设备Ⅲ
A343: 计算机-计算机设备-计算机设备Ⅲ
A344: 计算机-计算机设备-计算机设备Ⅲ
A345: 计算机-计算机设备-计算机设备Ⅲ
A346: 计算机-计算机设备-计算机设备Ⅲ
A347: 计算机-计算机设备-计算机设备Ⅲ
A348: 计算机-计算机设备-计算机设备Ⅲ
A349: 计算机-计算机设备-计算机设备Ⅲ
A350: 计算机-计算机设备-计算机设备Ⅲ
A351: 计算机-计算机设备-计算机设备Ⅲ
A352: 计算机-计算机设备-计算机设备Ⅲ
A353: 计算机-计算机设备-计算机设备Ⅲ
A354: 基础化工-化学制品-涂料油墨
A355: 基础化工-化学制品-涂料油墨
A356: 基础化工-化学制品-涂料油墨
A357: 基础化工-化学制品-涂料油墨
A358: 基础化工-化学制品-涂料油墨
A359: 基础化工-化学制品-食品及饲料添加剂
A360: 基础化工-化学制品-食品及饲料添加剂
A361: 基础化工-化学制品-其他化学制品
A362: 基础化工-化学制品-其他化学制品
A363: 基础化工-化学制品-其他化学制品
A364: 基础化工-化学制品-其他化学制品
A365: 基础化工-化学制品-其他化学制品
A366: 基础化工-化学制品-其他化学制品
A367: 基础化工-化学制品-其他化学制品
A368: 基础化工-化学制品-其他化学制品
A369: 基础化工-化学制品-聚氨酯
A370: 基础化工-化学制品-复合肥
A371: 基础化工-化学制品-纺织化学用品
A372: 基础化工-化学制品-纺织化学用品
A373: 基础化工-化学原料-无机盐
A374: 基础化工-化工合成材料-其他橡胶制品
A375: 基础化工-化工合成材料-其他橡胶制品
A376: 基础化工-化工合成材料-其他塑料制品
A377: 基础化工-化工合成材料-其他塑料制品
A378: 基础化工-化工合成材料-其他塑料制品
A379: 基础化工-化工合成材料-其他塑料制品
A380: 基础化工-化工合成材料-膜材料
A381: 基础化工-化工合成材料-合成树脂
A382: 基础化工-化工合成材料-合成树脂
A383: 基础化工-化工合成材料-改性塑料
A384: 基础化工-化工合成材料-改性塑料
A385: 基础化工-化工合成材料-改性塑料
A386: 基础化工-化工合成材料-改性塑料
A387: 基础化工-化工合成材料-改性塑料
A388: 基础化工-化工合成材料-涤纶
A389: 机械设备-自动化设备-其他自动化设备
A390: 机械设备-自动化设备-其他自动化设备
A391: 机械设备-自动化设备-其他自动化设备
A392: 机械设备-自动化设备-其他自动化设备
A393: 机械设备-自动化设备-其他自动化设备
A394: 机械设备-自动化设备-其他自动化设备
A395: 机械设备-自动化设备-机器人
A396: 机械设备-自动化设备-机器人
A397: 机械设备-自动化设备-工控设备
A398: 机械设备-自动化设备-工控设备
A399: 机械设备-专用设备-其他专用设备
A400: 机械设备-专用设备-其他专用设备
A401: 机械设备-专用设备-其他专用设备
A402: 机械设备-专用设备-其他专用设备
A403: 机械设备-专用设备-其他专用设备
A404: 机械设备-专用设备-其他专用设备
A405: 机械设备-专用设备-其他专用设备
A406: 机械设备-专用设备-其他专用设备
A407: 机械设备-专用设备-其他专用设备
A408: 机械设备-专用设备-其他专用设备
A409: 机械设备-专用设备-其他专用设备
A410: 机械设备-专用设备-其他专用设备
A411: 机械设备-专用设备-其他专用设备
A412: 机械设备-专用设备-农用机械
A413: 机械设备-专用设备-能源及重型设备
A414: 机械设备-专用设备-能源及重型设备
A415: 机械设备-专用设备-能源及重型设备
A416: 机械设备-专用设备-能源及重型设备
A417: 机械设备-专用设备-能源及重型设备
A418: 机械设备-专用设备-能源及重型设备
A419: 机械设备-专用设备-能源及重型设备
A420: 机械设备-专用设备-能源及重型设备
A421: 机械设备-专用设备-能源及重型设备
A422: 机械设备-专用设备-能源及重型设备
A423: 机械设备-专用设备-楼宇设备
A424: 机械设备-专用设备-楼宇设备
A425: 机械设备-专用设备-楼宇设备
A426: 机械设备-专用设备-楼宇设备
A427: 机械设备-专用设备-楼宇设备
A428: 机械设备-专用设备-楼宇设备
A429: 机械设备-专用设备-工程机械
A430: 机械设备-专用设备-工程机械
A431: 机械设备-专用设备-工程机械
A432: 机械设备-专用设备-工程机械
A433: 机械设备-专用设备-工程机械
A434: 机械设备-专用设备-纺织服装设备
A435: 机械设备-专用设备-纺织服装设备
A436: 机械设备-专用设备-纺织服装设备
A437: 机械设备-专用设备-纺织服装设备
A438: 机械设备-专用设备-纺织服装设备
A439: 机械设备-仪器仪表-仪器仪表Ⅲ
A440: 机械设备-仪器仪表-仪器仪表Ⅲ
A441: 机械设备-仪器仪表-仪器仪表Ⅲ
A442: 机械设备-仪器仪表-仪器仪表Ⅲ
A443: 机械设备-仪器仪表-仪器仪表Ⅲ
A444: 机械设备-仪器仪表-仪器仪表Ⅲ
A445: 机械设备-仪器仪表-仪器仪表Ⅲ
A446: 机械设备-仪器仪表-仪器仪表Ⅲ
A447: 机械设备-仪器仪表-仪器仪表Ⅲ
A448: 机械设备-通用设备-制冷空调设备
A449: 机械设备-通用设备-其他通用设备
A450: 机械设备-通用设备-其他通用设备
A451: 机械设备-通用设备-其他通用设备
A452: 机械设备-通用设备-其他通用设备
A453: 机械设备-通用设备-其他通用设备
A454: 机械设备-通用设备-其他通用设备
A455: 机械设备-通用设备-其他通用设备
A456: 机械设备-通用设备-其他通用设备
A457: 机械设备-通用设备-其他通用设备
A458: 机械设备-通用设备-其他通用设备
A459: 机械设备-通用设备-其他通用设备
A460: 机械设备-通用设备-其他通用设备
A461: 机械设备-通用设备-其他通用设备
A462: 机械设备-通用设备-磨具磨料
A463: 机械设备-通用设备-磨具磨料
A464: 机械设备-通用设备-金属制品
A465: 机械设备-通用设备-金属制品
A466: 机械设备-通用设备-金属制品
A467: 机械设备-通用设备-金属制品
A468: 机械设备-通用设备-金属制品
A469: 机械设备-通用设备-金属制品
A470: 机械设备-通用设备-金属制品
A471: 机械设备-通用设备-金属制品
A472: 机械设备-通用设备-金属制品
A473: 机械设备-通用设备-金属制品
A474: 机械设备-通用设备-金属制品
A475: 机械设备-通用设备-金属制品
A476: 机械设备-通用设备-金属制品
A477: 机械设备-通用设备-金属制品
A478: 机械设备-通用设备-机床工具
A479: 环保-环保-综合环境治理
A480: 环保-环保-综合环境治理
A481: 环保-环保-综合环境治理
A482: 环保-环保-综合环境治理
A483: 环保-环保-综合环境治理
A484: 环保-环保-水务及水治理
A485: 环保-环保-水务及水治理
A486: 环保-环保-水务及水治理
A487: 环保-环保-水务及水治理
A488: 环保-环保-水务及水治理
A489: 环保-环保-水务及水治理
A490: 环保-环保-水务及水治理
A491: 环保-环保-水务及水治理
A492: 环保-环保-水务及水治理
A493: 环保-环保-环保设备
A494: 环保-环保-环保设备
A495: 环保-环保-环保设备
A496: 环保-环保-环保设备
A497: 环保-环保-环保设备
A498: 环保-环保-固废治理
A499: 环保-环保-固废治理
A500: 环保-环保-固废治理
A501: 环保-环保-固废治理
A502: 环保-环保-固废治理
A503: 环保-环保-固废治理
A504: 环保-环保-大气治理
A505: 黑色金属-钢铁-冶钢原料
A506: 黑色金属-钢铁-特钢
A507: 黑色金属-钢铁-普钢
A508: 黑色金属-钢铁-普钢
A509: 国防军工-国防军工-军工电子
A510: 国防军工-国防军工-军工电子
A511: 国防军工-国防军工-军工电子
A512: 国防军工-国防军工-航天装备
A513: 国防军工-国防军工-航空装备
A514: 国防军工-国防军工-航空装备
A515: 国防军工-国防军工-地面兵装
A516: 公用事业-燃气-燃气Ⅲ
A517: 公用事业-燃气-燃气Ⅲ
A518: 公用事业-燃气-燃气Ⅲ
A519: 公用事业-电力-新能源发电
A520: 公用事业-电力-新能源发电
A521: 公用事业-电力-水电
A522: 公用事业-电力-水电
A523: 公用事业-电力-水电
A524: 公用事业-电力-水电
A525: 非银金融-证券-证券Ⅲ
A526: 非银金融-证券-证券Ⅲ
A527: 非银金融-证券-证券Ⅲ
A528: 非银金融-证券-证券Ⅲ
A529: 非银金融-证券-证券Ⅲ
A530: 非银金融-证券-证券Ⅲ
A531: 非银金融-证券-证券Ⅲ
A532: 非银金融-证券-证券Ⅲ
A533: 非银金融-证券-证券Ⅲ
A534: 非银金融-证券-证券Ⅲ
A535: 非银金融-证券-证券Ⅲ
A536: 非银金融-证券-证券Ⅲ
A537: 非银金融-证券-证券Ⅲ
A538: 非银金融-证券-证券Ⅲ
A539: 非银金融-保险及其他-多元金融
A540: 非银金融-保险及其他-多元金融
A541: 非银金融-保险及其他-多元金融
A542: 非银金融-保险及其他-多元金融
A543: 非银金融-保险及其他-保险
A544: 非银金融-保险及其他-保险
A545: 非银金融-保险及其他-保险
A546: 非银金融-保险及其他-保险
A547: 非银金融-保险及其他-保险
A548: 纺织服装-服装家纺-鞋帽及其他
A549: 纺织服装-服装家纺-鞋帽及其他
A550: 纺织服装-服装家纺-鞋帽及其他
A551: 纺织服装-服装家纺-鞋帽及其他
A552: 纺织服装-服装家纺-鞋帽及其他
A553: 纺织服装-服装家纺-鞋帽及其他
A554: 纺织服装-服装家纺-家纺
A555: 纺织服装-服装家纺-家纺
A556: 纺织服装-服装家纺-家纺
A557: 纺织服装-服装家纺-家纺
A558: 纺织服装-服装家纺-服装
A559: 纺织服装-服装家纺-服装
A560: 纺织服装-服装家纺-服装
A561: 纺织服装-服装家纺-服装
A562: 纺织服装-服装家纺-服装
A563: 纺织服装-服装家纺-服装
A564: 纺织服装-服装家纺-服装
A565: 纺织服装-服装家纺-服装
A566: 纺织服装-纺织制造-其他纺织
A567: 纺织服装-纺织制造-其他纺织
A568: 纺织服装-纺织制造-其他纺织
A569: 纺织服装-纺织制造-其他纺织
A570: 纺织服装-纺织制造-其他纺织
A571: 纺织服装-纺织制造-棉纺
A572: 房地产-房地产开发-住宅开发
A573: 房地产-房地产开发-住宅开发
A574: 房地产-房地产开发-住宅开发
A575: 房地产-房地产开发-住宅开发
A576: 房地产-房地产开发-住宅开发
A577: 房地产-房地产开发-住宅开发
A578: 房地产-房地产开发-住宅开发
A579: 房地产-房地产开发-住宅开发
A580: 房地产-房地产开发-商业地产
A581: 房地产-房地产开发-产业地产
A582: 房地产-房地产开发-产业地产
A583: 电子-消费电子-消费电子零部件及组装
A584: 电子-消费电子-消费电子零部件及组装
A585: 电子-消费电子-消费电子零部件及组装
A586: 电子-消费电子-消费电子零部件及组装
A587: 电子-消费电子-消费电子零部件及组装
A588: 电子-消费电子-消费电子零部件及组装
A589: 电子-消费电子-消费电子零部件及组装
A590: 电子-消费电子-消费电子零部件及组装
A591: 电子-消费电子-消费电子零部件及组装
A592: 电子-消费电子-品牌消费电子
A593: 电子-消费电子-品牌消费电子
A594: 电子-其他电子-其他电子Ⅲ
A595: 电子-光学光电子-面板
A596: 电子-光学光电子-面板
A597: 电子-光学光电子-面板
A598: 电子-光学光电子-面板
A599: 电子-光学光电子-面板
A600: 电子-光学光电子-面板
A601: 电子-光学光电子-面板
A602: 电子-光学光电子-面板
A603: 电子-光学光电子-面板
A604: 电子-光学光电子-光学元件
A605: 电子-光学光电子-光学元件
A606: 电子-光学光电子-LED
A607: 电子-光学光电子-LED
A608: 电子-光学光电子-LED
A609: 电子-光学光电子-LED
A610: 电子-光学光电子-LED
A611: 电子-光学光电子-LED
A612: 电子-电子化学品-电子化学品Ⅲ
A613: 电子-电子化学品-电子化学品Ⅲ
A614: 电子-电子化学品-电子化学品Ⅲ
A615: 电子-电子化学品-电子化学品Ⅲ
A616: 电子-半导体及元件-印制电路板
A617: 电子-半导体及元件-印制电路板
A618: 电子-半导体及元件-印制电路板
A619: 电子-半导体及元件-印制电路板
A620: 电子-半导体及元件-印制电路板
A621: 电子-半导体及元件-印制电路板
A622: 电子-半导体及元件-集成电路设计
A623: 电子-半导体及元件-集成电路封测
A624: 电子-半导体及元件-集成电路封测
A625: 电子-半导体及元件-被动元件
A626: 电子-半导体及元件-被动元件
A627: 电子-半导体及元件-半导体设备
A628: 电子-半导体及元件-半导体设备
A629: 电力设备-电力设备-线缆部件及其他
A630: 电力设备-电力设备-线缆部件及其他
A631: 电力设备-电力设备-输变电设备
A632: 电力设备-电力设备-输变电设备
A633: 电力设备-电力设备-输变电设备
A634: 电力设备-电力设备-输变电设备
A635: 电力设备-电力设备-输变电设备
A636: 电力设备-电力设备-输变电设备
A637: 电力设备-电力设备-电气自控设备
A638: 电力设备-电力设备-电气自控设备
A639: 电力设备-电力设备-电气自控设备
A640: 电力设备-电力设备-电气自控设备
A641: 电力设备-电力设备-电气自控设备
A642: 电力设备-电力设备-电气自控设备
A643: 电力设备-电力设备-电机
A644: 电力设备-电力设备-电机
A645: 电力设备-电力设备-电机
A646: 电力设备-电力设备-电机
A647: 电力设备-电力设备-电机
A648: 电力设备-电力设备-电池
A649: 电力设备-电力设备-电池
A650: 传媒-传媒-游戏
A651: 传媒-传媒-游戏
A652: 传媒-传媒-影视院线
A653: 传媒-传媒-影视院线
A654: 传媒-传媒-影视院线
A655: 传媒-传媒-数字媒体
A656: 传媒-传媒-数字媒体
A657: 传媒-传媒-数字媒体
A658: 传媒-传媒-数字媒体
A659: 传媒-传媒-广告营销
A660: 传媒-传媒-广告营销
A661: 传媒-传媒-广告营销
A662: 传媒-传媒-广告营销
A663: 传媒-传媒-出版
A664: 传媒-传媒-出版
A665: 传媒-传媒-出版
A666: 传媒-传媒-出版
A667: 传媒-传媒-出版
A668: 传媒-传媒-出版
A669: 传媒-传媒-出版